title	score	num_comm	created	content‘Do Not Invite Anyone Over’ to Your Home, Chicago’s Top Doctor Urges	36286	2560	2020-10-19 20:50:04	Pope Francis said we have all gone ahead “at breakneck speed”, ignoring the wars, injustice, and cries of the poor and our ailing planet. “We carried on regardless, thinking we would stay healthy in a world that was sick.”	36261	163	2020-03-28 07:44:34	Canada Reports Zero COVID-19 Deaths for First Time Since March	36257	1139	2020-09-12 05:29:23	White House head of security is 'very ill' with coronavirus, report says	36204	1261	2020-10-08 20:09:58	Study: Middle and high schoolers can spread coronavirus as effectively as adults	36135	1552	2020-07-19 15:36:44	Over the past 24 hours, the U.S. reported 26,885 new cases of coronavirus and 1,029 new deaths, raising the total to 215,429 cases and 5,068 dead. This is the first time any country has reported more than 1,000 new deaths in one day	36062	4220	2020-04-02 10:46:08	CDC continuing to deny expanded testing. There are 7 private labs ready to start COVID-19 testing in New York that could process up to 2,000 more tests per day -- if they had CDC approval, Gov. Cuomo says	36019	1230	2020-03-08 19:34:29	Wilmington Hospital nurse walks off job after being forbidden from wearing N95 mask to treat COVID-19 patients	35900	1800	2020-04-15 21:54:03	80 percent of workers would not feel safe if their state reopened now, survey reveals	35861	1475	2020-04-28 03:01:25	Italy's daily coronavirus recoveries surpass new cases for the first time since the outbreak began	35781	510	2020-04-24 13:18:38	Coronavirus: Parents sending sick, symptomatic kids to school, health officer says	35756	2163	2020-09-23 17:10:36	Game of Thrones actor Kristofer Hivju confirms he is COVID-19 positive	35741	1006	2020-03-17 00:59:27	Elizabeth Warren’s oldest brother dies of coronavirus in Oklahoma	35690	150	2020-04-23 18:30:17	Princeton University has reversed their plans, undergrads may no longer return to campus this year due to COVID-19	35684	1132	2020-08-08 03:32:59	Wearing a mask to protect others is an intentional act of kindness	35624	519	2020-05-25 08:13:49	FDA tells Alex Jones to stop promoting unapproved, misbranded coronavirus cures online	35370	479	2020-04-10 05:08:55	The inventor of N95 masks, which integrate virus-blocking technology into their design, has come out of retirement to find ways to disinfect the masks for reuse, amid the coronavirus pandemic.	35344	939	2020-04-19 05:58:12	30 year old Brooklyn teacher denied Coronavirus test three times is in serious condition on a ventilator	35288	1798	2020-03-29 22:03:59	More Than 150 Experts Urge the U.S. to Shut Down as Coronavirus Cases Surpass 4 Million	35121	2678	2020-07-25 23:06:46	Couple who insisted on 100 wedding guests are diagnosed with Covid-19	35079	1349	2020-07-28 00:49:09	The U.S. has the worst coronavirus outbreak in the world: 'The numbers don't lie,' Dr. Fauci says	35038	1946	2020-08-06 00:43:20	WHO urges China to close ‘dangerous’ wet market as stalls in Wuhan begin to reopen	35032	2123	2020-04-13 15:25:23	Jeff Bezos asking whole foods employees to donate sick leave to a each other.	34889	766	2020-03-14 08:43:11	A Georgia bar owner removed $3,714 worth of bills stapled to the walls to give to her unemployed staff	34779	1017	2020-04-09 14:44:39	'Pandemic pricing' is here. Rents are dropping across the US	34771	2539	2020-06-17 18:00:41	Things To Do In Dallas This Week: Stay The Fuck Home.	34694	1177	2020-03-16 15:39:44	'I'm fighting a war against COVID-19 and a war against stupidity,' says CMO of Houston hospital : After two hours of sleep a night for four months and seeing a member of his team contract the virus, Joseph Varon, MD, is growing exasperated.	34691	1541	2020-08-01 21:04:59	73% Of Inmates At An Ohio Prison Test Positive For Coronavirus	34635	1864	2020-04-21 01:31:44	U.S. Officially Has Worst Coronavirus Pandemic Day Yet	34615	3274	2020-06-26 02:52:29	N.J. restaurants NOT reopening for indoor dining this week after ‘knucklehead’ crowds at bars ruin it for everyone	34604	1573	2020-06-29 22:46:14	‘OSHA is AWOL’: Critics say federal agency is where workplace COVID-19 complaints go to die	34587	875	2020-07-17 15:47:54	'Scared and confused:' DHS says teachers shouldn't wear N95 masks; scientist says that makes 'no sense'	34576	2271	2020-09-02 16:54:30	Autopsy: Santa Clara patient died of COVID-19 on Feb. 6 — 23 days before 1st U.S. death declared	34506	2417	2020-04-22 09:58:45	Rite Aid Worker Says She Was Fired After Asking Mask-Less Customer to Leave Store: 'They're Punishing Me for Defending Myself'	34469	1532	2020-09-18 13:20:35	Hospitals say feds are seizing masks and other coronavirus supplies without a word	34209	1248	2020-04-08 03:05:09	"This ""Do's and Don't's"" List From the 1918 Pandemic Proves We've Learned Absolutely Nothing in 100 Years"	34177	544	2020-08-15 20:22:19	"NYC ER doctor: The lack of US testing is a ""National Scandal"""	34129	2454	2020-03-02 17:07:53	Sen. Klobuchar says her husband has coronavirus: “We just got the test results at 7 a.m. this morning ... He now has pneumonia and is on oxygen but not a ventilator.”	34107	66	2020-03-23 18:46:04	US critics of stay-at-home orders tied to fossil fuel funding	34087	1377	2020-05-23 19:03:48	Dr. Fauci Says Early Results from Coronavirus Vaccine Are 'Very Good News'	34036	1629	2020-08-02 19:58:10	NJ governor orders all flags across the state be lowered to half-staff indefinitely for lives lost to coronavirus	34017	953	2020-04-04 03:44:15	More than 100 Austrians ‘accidentally’ received US coronavirus stimulus money	33994	1305	2020-09-08 13:58:50	If you can punish a teenage girl for spaghetti straps, you can enforce a mask mandate	33861	1010	2020-08-12 00:31:35	'We need to close down' — Florida reports more than 10,000 coronavirus cases for fifth day	33794	2678	2020-07-20 03:09:12	California Gov. Newsom Signs Executive Order To Prevent Stimulus Money From Being Taken By Debt Collectors	33797	1045	2020-04-24 00:04:02	PhD: I’m in a high risk group for COVID-19. There is a good chance that if I get the disease, I will die. You can keep me - and millions like me - alive by staying home. Our lives are more important than your craft cocktail.	33754	823	2020-03-15 20:08:36	"Harvard expert: ""We may be done with the pandemic, but the pandemic is not done with us"""	33651	1406	2020-06-17 01:27:00	Japan to pay firms to leave China, relocate production elsewhere as part of coronavirus stimulus	33637	1589	2020-04-09 23:43:38	“Totally predictable”: State reopenings have backfired | Vox	33619	3290	2020-06-15 05:59:16	COVID-19 front-line workers deserve financial reward	33414	700	2020-03-23 18:02:33	Overwhelmed by cases, North Dakota tells residents with COVID-19 to do their own contact tracing	33320	1667	2020-10-23 14:59:55	"A nine-year-old Kenyan boy who made a wooden hand-washing machine to help curb the spread of coronavirus says he is ""very happy"" after receiving a presidential award"	33241	324	2020-06-02 22:20:50	Amazon fires warehouse worker who led Staten Island strike for more coronavirus protection	33177	368	2020-03-31 04:57:43	Kindergartner tests positive for COVID-19 on first day of in-person classes at League City school in Texas	33083	1419	2020-09-01 17:46:05	Matthew McConaughey delivers 110K face masks to hospitals in rural Texas	33076	811	2020-05-23 00:58:35	Millions Of Americans Skipping Payments As Tidal Wave Of Defaults And Evictions Looms	33075	2664	2020-06-03 16:02:17	Teacher creates national database of COVID-19-related school closings, cases and deaths	32953	569	2020-08-16 18:50:59	Every night at 8PM, the residents of Atlanta cheer for all the healthcare workers during change of shift	32731	886	2020-03-26 06:41:03	After 13 days since the ease of the lockdown, all 20 regions in Italy except Lombardy reported less than 100 cases each. Today's positive rate is 1,1%, lowest ever reported. More than 3M tests have been performed in total	32722	1417	2020-05-17 21:44:17	More than 2,000 students, 500 teachers in Mississippi in quarantine due to COVID-19	32710	1375	2020-08-18 14:24:37	Six campaign staffers working on Tulsa rally test positive for coronavirus	32707	386	2020-06-20 22:29:23	CDC is now reporting the number of reported cases for each state again. Good job with the petition guys.	32644	913	2020-03-04 21:26:03	Michigan has 14 school-related coronavirus outbreaks. State won’t say where.	32543	996	2020-08-20 16:24:10	3 doctors in Russia fall out of windows in 2 weeks. 2 dead. They warned about lack of means of protection in russian hospitals	32480	1184	2020-05-03 08:59:03	Lives Cut Short: Remembering Health Care Workers In Their 20s Killed By COVID-19	32471	1077	2020-08-17 15:58:15	"Sunday's front page of The New York Times is dedicated to those who died of COVID-19. ""The 1,000 people here reflect just 1 percent of the [U.S.] toll."""	32402	1327	2020-05-24 02:03:15	Essential workers are losing their hazard pay even though the hazard isn’t over	32302	2157	2020-05-16 15:24:03	Georgia teenager loses both parents to COVID-19 within a week	32277	1641	2020-08-03 14:45:17	Iran’s minister of communication gives each citizen a free 100GB internet to encourage people stay in their homes.	32249	1042	2020-03-08 01:36:44	97,000 children reportedly test positive for coronavirus in two weeks as schools gear up for instruction	32246	1416	2020-08-08 23:20:50	80% of Covid-19 Patients in ICU are overweight (Netherlands)	32216	3739	2020-03-30 13:10:14	'Heads we win, tails you lose': how America's rich have turned pandemic into profit | As 26 million Americans lose their jobs, the billionaire class has added $308bn to its wealth	32211	534	2020-04-27 08:54:59	Japanese island suffering second wave of coronavirus after lifting lockdown too early	32213	1611	2020-05-01 07:31:26	The U.S. was the world's best prepared nation to confront a pandemic. How did it spiral to 'almost inconceivable' failure?	32205	1898	2020-10-16 14:31:09	Social distancing one week earlier could have saved 36,000 US lives: study	32179	2382	2020-05-21 16:45:54	Florida coach wanted 90,000 fans at his home stadium, but now his players have COVID	32103	1242	2020-10-14 03:38:53	Swedish IKEA store finds 50,000 forgotten face masks, gives them to local hospital	32107	504	2020-03-17 22:05:52	Your Mask Cuts Own Risk by 65 Percent	32093	1758	2020-07-09 04:36:17	Fauci warns US needs to 'hunker down' for fall, winter: 'It's not going to be easy'	32061	2843	2020-09-11 01:55:39	Days after photos of packed hallways go viral, Paulding high school reports 9 COVID 19 cases	32005	1505	2020-08-09 05:03:51	US becomes first country to record over 2,000 coronavirus deaths in last 24 hours: Report	31834	3413	2020-04-11 07:33:51	Kimberly Guilfoyle, Don Jr.'s girlfriend, tests positive for coronavirus	31809	1445	2020-07-04 06:43:58	USS Theodore Roosevelt now has 416 coronavirus cases in wake of captain's firing	31755	1552	2020-04-10 13:55:00	Fauci calls for social distances until there is zero new cases, zero deaths	31710	1437	2020-04-03 22:52:19	The Intensive Care section of the hospital of Bergamo, Italy, which has been the most COVID-battered city in the world, is now COVID free.	31674	704	2020-07-08 19:53:53	Boy, 7, uses $600 of savings to make coronavirus care packages for seniors, feed 90 students	31669	757	2020-03-20 18:39:04	Obesity increases risk of Covid-19 death by 48%, study finds	31657	2247	2020-08-26 14:25:30	Doctors say they're dealing with significantly more patients who resist their advice because of misinformation they read online	31636	1242	2020-08-18 20:34:39	Wuhan will test its entire population of 11 million after reporting new infections for the first time since its lockdown was lifted	31582	1662	2020-05-12 11:59:08	Effects of Closing Schools During the 1918-1919 Influenza Pandemic: proactive closings had far better mortality rates than reactive closings	31392	1485	2020-03-05 08:21:56	California governor says schools will reopen when the data shows it is safe to do so	31388	1181	2020-07-09 00:44:06	After 7 weeks extreme lock down, Victoria (Australia) reduced the daily new cases from 725 to 11	31359	2203	2020-09-21 14:27:07	‘Stupid and crazy’: Local officials protest Gov. Kemp’s decision to reopen beaches in hard-hit Georgia	31354	1180	2020-04-06 15:05:42	The U.S. Pres. tests negative, White House says	31337	143	2020-03-15 03:21:49	Amazon notifies Canadian workers it is cancelling hero pay despite ‘heavy demand’ and positive COVID-19 cases at warehouses	31321	1908	2020-05-16 03:46:10	Coronavirus: Denmark’s government told private companies that it would cover 75% of employees’ salaries, if they promised not to cut staff.	31311	1199	2020-03-18 14:59:32	Bill Gates: ‘We underestimated the value of masks’	31300	1594	2020-09-16 15:58:36	Coronavirus: Vitamin D reduces infection and impact of COVID-19, studies find	31177	1704	2020-09-26 14:27:24	Zero! NZ has no Covid-19 cases	31177	974	2020-06-08 05:04:41	Shopper who stockpiled $10k of toilet paper, sanitiser refused refund	31141	1277	2020-04-16 11:58:00	NY Gov: ‘We’re seriously considering a quarantine’ for visitors from out of state	31042	1706	2020-06-23 17:12:07	Man loses both parents to coronavirus 6 minutes apart: ‘You don’t want this pain’	31030	1425	2020-04-03 23:49:35	Kennels go empty after every animal gets adopted at Colorado shelter amid outbreak.	31008	640	2020-03-28 02:47:42	White House ordered NIH to cancel coronavirus research funding, Fauci says	30995	66	2020-06-25 04:37:59	4 Tampa Bay FL Hospitals run out of ICU beds	30960	1872	2020-07-05 17:56:24	Risk of never fully recovering after coronavirus ‘very real,’ scientists say	30856	2161	2020-06-28 00:28:41	Oklahoma Gov. “Shocked” To Test Positive For COVID-19 Despite Not Wearing A Mask	30662	1108	2020-07-19 00:07:41	Delta Air Lines has put 240 people on ‘no fly list’ for not wearing masks, CEO says	30645	986	2020-08-27 19:02:55	A coronavirus cluster in New Jersey has been traced to a high school house party, and the teens and their parents are refusing to cooperate with contact tracers, officials say	30635	1135	2020-07-26 10:02:46	Texas Closes all Bars. Reduces Restaurant Capacity.	30578	2086	2020-06-26 18:05:34	Coronavirus testing in South Korea: 1. Drive to a testing station 2. Stay in your car 3. It takes less than 10 minutes 4. Results texted to you the next day , Done. Oh, and it's free.	30550	77	2020-03-15 18:27:17	New York City Reports No COVID Deaths in 24 Hours	30530	1336	2020-07-14 16:08:12	More Costco Employees Have Tested Positive For The Coronavirus Days After A Coworker Died From The Disease	30498	1185	2020-03-20 04:54:56	Utah students and staff who don’t wear masks in schools can be charged with a misdemeanor	30336	1006	2020-08-21 04:37:36	Taiwan today announced no new cases of coronavirus, meaning the country has gone 28 days without reporting a single local transmission.	30335	1119	2020-05-10 11:18:39	White House opposes requirement for passengers to wear masks on planes, trains	30155	1872	2020-08-02 12:05:28	We have surpassed 100,000 recovered cases worldwide	29904	902	2020-03-23 14:55:25	People with COVID-19 often lie about symptoms and distancing, according to research	29808	1474	2020-08-22 15:57:10	A School Reopens, and the Coronavirus Creeps In — as more schools abandon plans for in-person classes, one that opened in Indiana this week had to quarantine students within hours.	29719	1824	2020-08-01 14:48:45	States and Hospitals Are Essentially Smuggling PPE Because They’re Afraid the Feds Will Seize It	29681	345	2020-04-21 17:50:29	Reddit Sees Traffic Surge of 20-50% During Coronavirus Outbreak	29646	667	2020-03-18 02:21:52	New York shoppers hound customer out of grocery store for not wearing mask in viral video	29523	2569	2020-05-25 20:40:16	Elon Musk publishes list of hospitals Tesla sent ventilators to after claims none were delivered to California	29481	2428	2020-04-17 14:54:07	Assaulting a worker who's enforcing masks is now a felony under a new Illinois law	29447	514	2020-08-11 00:42:29	North Carolina textile mill ‘heeds call of nation,’ gears up to make 10 million face masks per week	29387	836	2020-03-23 03:47:02	Anthony Fauci Nominated for an ‘Oscar’ of Civil Service	29374	864	2020-05-04 04:07:48	We regret to inform you that your inflatable T. rex costume is not virus-proof	29308	760	2020-04-25 17:15:54	One trip per week. One person per household. That should be the law for grocery buying, union says	29274	3191	2020-04-18 16:55:34	The chinese doctors squad just arrived in Italy to help to fight the COVID-19 with their experience	29256	1352	2020-03-13 03:56:31	The United States President Has Declared A State Of Emergency	29204	6899	2020-03-13 23:36:07	"[CNBC](https://www.cnbc.com/2020/03/13/trump-will-hold-a-press-conference-at-3-pm-et-to-discuss-coronavirus-response.html)[BBC](https://www.bbc.com/news/world-us-canada-51882381)[CNN](https://www.cnn.com/2020/03/13/politics/states-coronavirus-fema/index.html)[NBC](https://www.nbcnews.com/health/health-news/live-blog/coronavirus-updates-live-dow-plunges-white-house-grapples-spreading-crisis-n1157551)"The first COVID-19 patient in New Jersey found out his test results were positive watching the news from his hospital bed	29176	828	2020-03-31 17:13:31	Houston ICU is 90% full and expected to exceed capacity in just 2 weeks	29108	3102	2020-06-24 04:53:54	Humanity wins: our fight to unlock 32,544 COVID-19 articles for the world. This petition is dedicated to the victims of the outbreak and their families. We fought for every article for every scientist for you.	29114	519	2020-03-07 04:48:25	Bolsonaro still has coronavirus after testing positive for the third time	29104	844	2020-07-22 16:31:35	Harvard expert: US would have a 'very different situation' with earlier testing, lockdowns	29029	2092	2020-04-01 16:41:58	I put together a Google Drive Folder with over 40 free mental health resources (books, worksheets, workbooks, guides) to help others cope with anxiety/fear, addiction, depression, suicidal ideation and stress.	28947	546	2020-03-30 17:56:36	New York state now has more confirmed coronavirus cases than any country in the world	28860	1955	2020-04-08 21:43:48	US sees record 88,973 Covid-19 infections for second day straight	28782	1863	2020-10-25 15:09:03	"New York Governor tells reopen protesters: ""You have no right to jeopardize my health"""	28580	2584	2020-05-03 18:48:23	U.S. reports at least 1,444 new coronavirus deaths, biggest one-day increase in more than 2 months	28526	2125	2020-07-30 06:26:14	U.S. Coronavirus Death Toll Hits 170,000 Ahead of Fall Flu Season	28518	1442	2020-08-17 03:57:49	Dr. Fauci: 'You don't make the timeline, the virus makes the timeline'	28467	1446	2020-03-26 08:30:50	Fauci says he was in surgery when task force discussed CDC testing guidelines	28297	349	2020-08-27 01:19:22	UK scientists create coronavirus antibody test with '99.8% accuracy and results in 35 minutes'	28233	786	2020-05-04 13:49:40	Death Count Expected To Soar As NYC Says It Will Begin Reporting Probable COVID Deaths In Addition To Confirmed Ones	28137	1740	2020-04-09 06:57:46	Frontier Airline gets rid of $39 “Social Distancing Upgrade” after heavy criticism.	28121	980	2020-05-07 18:10:21	Governor of Texas Issues Statewide Mask Mandate	28076	1876	2020-07-03 00:24:42	Asymptomatic spread of coronavirus is 'very rare', says WHO	28058	2642	2020-06-08 22:18:06	Slovakia to perform a full-scale COVID-19 testing. The entire population of the country is to be tested over 2 weekends.	28043	586	2020-10-17 14:49:08	Boomers Are Ignoring Coronavirus Risks, and Their Millennial Children Are Scared	28020	4324	2020-03-13 02:56:46	Trump Being Transferred to Walter Reed Military Center	27994	3908	2020-10-03 01:14:54	Nick Cordero, Standout Actor in Broadway Musicals, Dies of COVID-19 Complications at 41	27966	1412	2020-07-06 05:12:34	Member of Pence’s staff tests positive for coronavirus	27962	246	2020-03-21 02:44:46	Medical supply company charging $786 for a box of 20 face masks (formerly $42) accused of exploiting coronavirus crisis	27922	127	2020-04-22 03:21:07	1918 pandemic. During a football game. Everyone is wearing a mask. 102 years ago.	27902	753	2020-08-02 23:31:43	Nurses Who Battled Virus in New York Confront Friends Back Home Who Say It’s a Hoax	27872	1261	2020-07-07 14:18:00	Fauci says it's 'very concerning' that Florida is re-opening bars and restaurants at full capacity	27831	1296	2020-09-28 22:01:57	"Italy is preparing countrywide ""immunity testing"" so that people with antibodies can go back to work"	27831	1619	2020-04-07 03:59:39	The U.S. has the world's highest coronavirus death rate at more than 5% - a number that reflects the country's lack of testing	27816	1835	2020-03-06 20:03:21	McConnell admits he was wrong to say Obama administration failed to leave pandemic playbook	27695	927	2020-05-15 05:11:06	A choir decided to go ahead with rehearsal. Now dozens of members have COVID-19 and two are dead	27689	461	2020-03-30 06:49:33	Dolly Parton donates $1m to finding a cure for deadly illness	27653	542	2020-04-02 02:45:51	Texas Gov. Greg Abbott Caught on Recording Saying Reopening Will Increase Spread of Coronavirus	27483	2316	2020-05-06 00:08:39	Massive Spike in NYC ‘Cardiac Arrest’ Deaths Seen as Sign of COVID-19 Undercounting	27463	1328	2020-04-11 00:22:37	Pastor again defies state order not to hold large gatherings. He says 1,000 people came to his church Sunday	27367	2445	2020-03-30 14:58:43	Vermont Goes 30+ Days with No COVID-19 Deaths	27343	904	2020-07-19 02:44:32	Entire fourth grade class in Mississippi sent to quarantine	27333	1272	2020-08-25 15:13:03	Brazil says a 28-year-old volunteer in AstraZeneca's COVID-19 vaccine trial has died of coronavirus complications. It's unknown if he received the vaccine or a placebo - G1	27254	1308	2020-10-21 21:11:02	'Close to 100% accuracy': Helsinki airport uses sniffer dogs to detect Covid	27237	679	2020-09-24 15:09:22	Mounting evidence shows masks may help avoid severe illness, even if you get COVID-19	27207	940	2020-07-26 17:57:55	Ted Cruz Under Investigation For Not Wearing A Mandatory Mask On Flight	27187	1008	2020-07-14 10:53:37	Oklahoma State linebacker says he tested positive for Covid-19 after attending protest	27123	1894	2020-06-03 07:43:10	Messaging about Covid-19 has changed too much and too often, quickly evolving from “flatten the curve” to something very different, so Americans aren't listening	27096	2760	2020-08-27 14:57:23	Fired scientist Rebekah Jones builds coronavirus dashboard to rival Florida’s | Fired scientist Rebekah Jones’ site shows thousands more people with the coronavirus, and hundreds of thousands fewer who have been tested, than the site run by the Florida Health Department	27039	796	2020-06-12 01:46:06	'OPEN IMMEDIATELY!': Wisconsinites head out to bars after state stay-at-home orders lifted	27006	5794	2020-05-14 16:10:18	Fauci tells MarketWatch: I would not get on a plane or eat inside a restaurant	26949	1361	2020-07-24 17:47:15	Tennessee 6-year-old with cystic fibrosis beats COVID-19	26840	366	2020-04-04 18:09:39	Madison County prosecutor: ‘We can only hope the deadly coronavirus strain spreads in riots’	26598	194	2020-06-02 02:04:03	"Truckers brave coronavirus outbreak to deliver goods: ""If we stop, the world stops"""	26562	986	2020-03-22 20:32:53	Teachers who are resigning and retiring across the U.S. blame remote learning frustrations, COVID-19 concerns	26521	1524	2020-08-30 02:06:32	Fauci said he tested negative for coronavirus Saturday	26453	718	2020-04-06 04:56:32	Coronavirus cases spike in Texas, Arizona, Florida after reopening	26431	1835	2020-06-05 15:19:48	'No mask. No ride': Uber will require drivers and passengers to wear face masks indefinitely	26357	533	2020-07-01 20:20:25	"Fauzi: USA tests are ""a week away"". They were ""a week away"" last week and ""a week away"" two weeks ago."	26362	1532	2020-03-13 15:16:17	USA, just killing it with public safety awareness	26353	3249	2020-03-03 12:51:30	Native American health center asked for COVID-19 supplies. It got body bags instead.	26200	901	2020-05-06 06:26:03	Georgia high school with viral hallway photo reopens again after 35 students, teachers catch COVID	26145	1422	2020-08-13 21:07:21	Resolution by 60 countries wants WHO to investigate origin of Wuhan coronavirus	26121	981	2020-05-17 13:10:36	12 states show record spikes in coronavirus cases	26087	1782	2020-06-22 17:26:13	Fauci warns reopening states: 'You can't just leap over things'	25999	2117	2020-04-30 19:45:12	"Italy: Giampiero Giron, 85 years old, Venetian anesthetist. ""They asked for my availability, and I said yes. When you decide to be a doctor in life, you get involved. I swore an oath. Afraid of getting sick? Then it is better not to be a doctor »."	25957	386	2020-03-22 20:11:44	Obama says coronavirus has exposed lack of leadership in US	25931	1345	2020-05-17 05:48:43	US coronavirus deaths projected to more than double to 410,000 by year's end	25890	1012	2020-09-05 15:28:44	The number of confirmed coronavirus cases around the world has reached 100,000	25818	567	2020-03-06 14:13:10	15 US states now hit by rare inflammatory syndrome impacting children	25806	1992	2020-05-13 20:59:39	