title	score	num_comm	created	contentPortuguese government has decreed that all asylum seekers and all undocumented migrants with pending applications for residence are automatically granted and may access healthcare and benefits.	18153	797	2020-03-28 16:06:13	'Archbishop' of Florida church selling bleach 'miracle cure' arrested with son	18148	481	2020-08-12 21:29:15	4 In 5 Americans Want Cities Quarantined In Case Of Coronavirus Outbreak	18044	1967	2020-03-02 21:36:09	Nurses read names of colleagues who died of COVID-19 in protest outside White House	18040	273	2020-04-22 00:17:32	"75 women graduating today from Korea's National Army Nursing Academy will head immediately to Covid-19 epicenter Daegu, where nurses have been quitting en masse. ""My grandpa put his life on the line as a medic during the Korean War. For our citizens and servicemen, I'm willing to do the same now."""	17999	479	2020-03-03 07:15:21	Excellent news - 2 days in a row of fewer new Coronavirus cases in Italy!	17986	1057	2020-03-23 21:24:18	We Still Don't Know All the Long-Term Consequences of 'Mild' COVID-19	17944	353	2020-08-24 16:08:35	Alarm as FDA willing to issue Covid-19 vaccine before stringent safety testing	17895	1545	2020-08-31 11:20:38	Germany has performed a million tests so far, 93% negative	17809	928	2020-04-04 19:52:53	"Live animal ""wet markets"" in New York City face protests amid coronavirus pandemic"	17769	1345	2020-05-09 16:47:43	Turning Point USA deletes anti-mask meme after co-founder dies of coronavirus complications	17763	593	2020-07-30 20:51:56	'She was always there’: A nurse who brightened the hospital ward died alone, stricken by covid | Lisa Ewald, 53, told friends she wasn’t allowed to wear a mask at the Detroit hospital where she worked	17717	546	2020-06-13 06:31:57	Governor Cuomo: “Facts are empowering. Even when the facts are discouraging, not knowing the facts is worse. I promise that I will continue to give New Yorkers all the facts, not selective facts.”	17715	799	2020-03-26 19:42:29	Passengers Clap as Woman Kicked off Flight for Refusing to Wear Face Mask	17699	680	2020-07-24 01:09:34	Fauci: 'If it looks like you're overreacting you're probably doing the right thing'	17681	674	2020-03-15 20:29:25	Drive-in movie theaters are making a comeback thanks to the coronavirus	17666	580	2020-05-24 20:26:03	Obit of Texas man who died of COVID-19 includes ominous warning - “Dave did everything he was supposed to do, but you did not,” the obit reads. “Shame on you and may Karma find you all!”	17549	799	2020-08-04 08:49:58	Oregon to require masks everywhere indoors starting July 1	17482	724	2020-06-30 06:43:32	"GameStop just told its staff to keep their stores open even during state lockdowns, and to tell law enforcement that it's OK because they're ""essential retail"""	17464	1369	2020-03-20 01:30:38	Fines tripled, trains canceled in Salem ahead of Halloween to discourage crowds during COVID pandemic	17455	578	2020-10-22 15:47:40	8 in 10 Americans would wait to resume activities after government lifts coronavirus restrictions: poll	17446	1176	2020-04-14 15:49:51	CDC advises booting travelers who refuse to wear masks on planes, trains, buses, other transportation	17393	625	2020-10-20 01:54:47	Finland reports zero new infections today (2600 tests) for the first time since March (translation in comments)	17390	340	2020-06-04 14:49:41	Germany has a remarkably low coronavirus death rate — thanks largely to mass testing, but also culture, luck, and an impressive healthcare system	17381	885	2020-03-28 17:43:35	First U.S coronavirus case of unknown origin confirmed in Northern California, a sign the virus may be spreading in a local area	17342	1628	2020-02-27 02:51:50	‘We hear you, dad': A daughter stays on the phone for hours and hours as her father dies alone from coronavirus	17295	453	2020-04-19 18:21:33	Detroit health care worker dies after being denied coronavirus test 4 times, daughter says	17302	170	2020-04-25 19:38:57	Japanese students hold graduation ceremony in Minecraft amid school cancellation	17284	211	2020-03-16 16:15:40	Drugmaker caps insulin costs at $35 to help diabetes patients during Coronavirus pandemic	17268	436	2020-04-08 04:43:37	US reports most coronavirus deaths in one day as 1,224 die on Saturday	17269	2095	2020-04-05 05:51:01	Spread is slowing down in Italy. Today +13% cases, the lowest ever.	17226	825	2020-03-16 22:12:24	Volunteers 3D-Print Unobtainable $11,000 Valve For $1 To Keep Covid-19 Patients Alive; Original Manufacturer Threatens To Sue	17206	1014	2020-03-18 02:46:28	Nearly 11,000 people have been exposed to the coronavirus on flights, the CDC says	17155	1068	2020-09-20 16:43:28	Television stations owned by Sinclair Broadcast Group are set to air discredited conspiracy theory doc over the weekend that suggests Dr. Anthony Fauci, the nation's top expert on infectious diseases, was responsible for the creation of the coronavirus.	17144	1381	2020-07-25 18:07:00	Coronavirus killing three times more people than flu and pneumonia combined	17045	660	2020-10-08 13:25:21	Maryland Man Arrested for Having 60 People Over for Bonfire, Violating Social Distancing Orders	17037	686	2020-03-29 10:38:16	The U.S. has had the equivalent of 12 plane crashes a day for two months, but little sense of grief	17039	1213	2020-05-23 04:40:30	25,000 people now skiing in Sweden, organizers putting together after-ski parties for 499 people, getting around national ban on gatherings of 500+. Locals putting signs up at train station saying, “Think of those of us who live here, you egomaniacs.” (in Swedish)	17015	1104	2020-03-21 21:38:03	‘Women Will Not Be Forced to Be Alone When They Are Giving Birth’ | Gov. Andrew M. Cuomo will issue an executive order mandating that hospitals allow partners in delivery rooms	17016	1000	2020-03-28 23:43:41	Italy is registering 1 death due to coronavirus every 4 minutes	16981	1671	2020-03-16 04:53:45	Ex-N.J. Gov. Chris Christie remains hospitalized for COVID-19	16904	937	2020-10-07 16:48:02	Dr. Fauci says pause on trial is 'not uncommon at all' after major coronavirus vaccine trial placed on hold	16879	559	2020-09-09 18:56:03	Ab8 COVID-19 Drug Breakthrough: Tiny Antibody Component Completely Neutralizes the SARS-CoV-2 Virus	16829	597	2020-09-15 17:18:34	JAMA: Taiwan has tested every resident with unexplained flu-like symptoms for COVID-19 since Jan. 31, and tests every traveler with fever or respiratory symptoms. Taiwan has had only one death from COVID-19.	16816	786	2020-03-12 14:31:58	Surgeon general: 'This is going to be the hardest and the saddest week of most Americans' lives'	16803	2636	2020-04-05 17:35:06	Two makeshift hospitals in Wuhan to be closed today with further two being closed tomorrow due to all patients successfuly recovering	16743	913	2020-03-07 15:54:43	Bill Gates on coronavirus: We need an 'extreme shutdown' of 6 to 10 weeks	16738	1541	2020-03-27 10:05:38	Positive COVID-19 test rates top 25% in some U.S. Midwest states	16641	1153	2020-09-28 02:28:59	Argentina: a married woman came back from Spain with symptoms, met with a 'friend' and had sex. The 'friend' then returned to his hometown and went to a party with about 20 people. This resulted in the entire town of 2500 people being put in quarantine, as well as the woman and her husband.	16594	939	2020-03-17 23:54:53	How the Sturgis Motorcycle Rally may have spread coronavirus across the Upper Midwest	16570	910	2020-10-18 03:09:59	A distillery in Minnesota converted from making alcohol to making hand sanitizer. They're giving it away free.	16525	308	2020-03-19 15:23:36	"Dee Snider blasts unmasked protesters for using ""We’re Not Gonna Take It"""	16491	409	2020-09-20 06:07:14	Doctor's message to her kids: 'If they lose me to COVID I want them to know Mommy tried really hard'	16423	459	2020-04-03 21:44:11	Bolsonaro experiencing Covid-19 symptoms, says CNN Brazil	16408	147	2020-07-07 03:15:20	Til in 2018, the CDC had to cut its global disease prevention preparedness by 80%	16347	417	2020-03-13 17:48:24	We are a team of medical experts following COVID-19's progression closely. Ask Us Anything.	16344	4151	2020-03-04 19:06:36	"News about the coronavirus outbreak that started in Wuhan, China, is changing rapidly. Our team of experts are here to break down what we know and how you can stay safe.Answering questions today are:* Neha Pathak, MD, DipABLM: [https://www.webmd.com/neha-pathak-md](https://www.webmd.com/neha-pathak-md)* Hansa Bhargava, MD: [https://www.webmd.com/hansa-bhargava](https://www.webmd.com/hansa-bhargava)* Brenda Goodman, reporter: [https://www.webmd.com/brenda-goodman](https://www.webmd.com/brenda-goodman)* Michael Mina, MD, PhD: [https://ccdd.hsph.harvard.edu/people/michael-mina/](https://ccdd.hsph.harvard.edu/people/michael-mina/)* Isaac Bogoch, MD, SM, FRCPC: [https://www.uhnresearch.ca/researcher/isaac-bogoch](https://www.uhnresearch.ca/researcher/isaac-bogoch)* More about Carlos del Rio, MD: [http://vaccines.emory.edu/faculty-evc/primary-faculty/del\_rio\_carlos.html](http://vaccines.emory.edu/faculty-evc/primary-faculty/del_rio_carlos.html)* More on WebMD's coronavirus coverage: [https://www.webmd.com/lung/news/20200124/coronavirus-2020-outbreak-latest-updates](https://www.webmd.com/lung/news/20200124/coronavirus-2020-outbreak-latest-updates)* Proof: [https://twitter.com/WebMD/status/1233482007897923584](https://twitter.com/WebMD/status/1233482007897923584)**Edit:** We are signing off! Thank you for joining us. "Millennials and the Economy: Coronavirus Is the Second Setback in a Generation	16335	1444	2020-09-30 15:18:02	White House rejects bailout for U.S. Postal Service battered by coronavirus	16320	533	2020-04-11 20:42:20	James Dyson designed a new ventilator in 10 days. He's making 15,000 for the pandemic fight	16268	734	2020-03-26 17:20:45	Zookeepers self-isolate in a wildlife park for 12 weeks to look after the animals	16234	253	2020-03-31 06:23:16	‘How is this possible? What are the odds?’ | The novel coronavirus put two teenage brothers on life support, shaking a Virginia family.	16220	1093	2020-08-24 02:57:58	Teenager issued with huge £10,000 fine for hosting house party in Lenton	16188	792	2020-09-13 16:32:53	Majority of Americans say that federal government not doing enough to prevent second wave of virus: poll shows	16169	928	2020-05-12 21:57:55	Landlord says he won't collect rent because of coronavirus outbreak, urges others to do the same	16119	947	2020-03-16 18:42:20	Norway enters third day without deaths, no exponential growth.	16101	836	2020-03-22 16:30:14	Yale’s rapid COVID-19 saliva test receives FDA emergency use authorization	16099	479	2020-08-16 05:22:57	Fauci warns against rush to reopen and asks 'how many deaths are you willing to accept?'	16050	1903	2020-05-05 19:09:16	Even though there are no confirmed cases of Covid-19, El Salvador declares national quarantine, forbids anyone but Salvadoran nationals or diplomats to enter the country and closes all schools and universities for the next three weeks.	16031	500	2020-03-12 03:01:50	Brazil’s Jair Bolsonaro has tested positive for coronavirus - CNN Brazil	16022	121	2020-07-07 19:15:28	'We're heroes, too:' Hospital janitors risk lives to stop spread of COVID-19	15927	259	2020-06-16 00:49:59	California Governor Orders Second Shutdown of Restaurants	15924	1063	2020-07-07 04:19:23	Similarly to Patient 31 in South Korea, one reckless infected person was solely responsible for a major Covid19 infection in Uruguay. She was not feeling well after coming home from Italy and Spain and still attended a wedding on March 7th with 500 other people. She is currently being sued. [ENG]	15881	617	2020-03-20 04:00:25	Denver requires mask-wearing outdoors, limits gathering to five people as coronavirus cases rise	15882	707	2020-10-17 00:18:21	1.2 Million member we can do this guys. Open source 3d printed ventilator.	15847	712	2020-03-18 05:44:58	Sailors cheer Navy captain who was removed after pleading for help with coronavirus outbreak	15805	962	2020-04-03 17:01:28	Restaurant staffers in quarantine after working Τrump fundraiser	15720	315	2020-10-06 18:20:36	"CA Governor Gavin Newsom tells reporters @ElonMusk has delivered a thousand ventilators to the system today. ""They arrived in Los Angeles, and Elon Musk is already working with a hospital association and others to get those ventilators out in real time, it’s an heroic effort."""	15709	1079	2020-03-24 05:02:24	The True Coronavirus Toll in the U.S. Has Already Surpassed 200,000	15692	935	2020-08-13 09:27:05	The United States surpasses 80,000 COVID-19 Deaths	15652	2419	2020-05-10 03:07:06	“Nationwide, 200,700 more people have died than usual from Mar 15 to Jul 25, according to CDC estimates, which adjust current death records to account for typical reporting lags..54,000 higher than the official count of coronavirus deaths for that period.”	15626	978	2020-08-08 14:06:36	Smash Mouth plays to packed crowds at Sturges Ralley: Not the sharpest tool in the shed	15599	1118	2020-08-12 17:09:26	In just a single day, one thousand retired and private practice doctors and nurses answered City Hall’s cry for help, volunteering to join the Big Apple’s medical reserve and help treat their fellow New Yorkers stricken with coronavirus.	15599	346	2020-03-19 06:48:59	No COVID-19 bailouts for firms that use tax havens, Prime Minister Justin Trudeau says	15558	393	2020-04-29 06:26:36	Young and unafraid of the coronavirus? Good for you. Now stop killing people - Newsweek	15532	1504	2020-03-12 00:57:19	More than 11,000 children test positive for coronavirus in Florida	15483	1806	2020-07-10 22:53:00	Vitamin D determines severity in COVID-19 so government advice needs to change, experts urge	15477	1449	2020-05-25 02:50:05	New Zealand records four new cases of COVID-19	15470	1393	2020-08-11 13:38:59	France: Re-tested blood of 24 patients treated in December for pneumonia finds Covid-positive	15397	1087	2020-05-03 23:12:32	Hi, I am Ekrem Imamoglu, Mayor of Istanbul, the largest city in Europe. AMA about our fight back against COVID-19.	15364	244	2020-05-18 16:51:47	"Proof it's me: [https://i.imgur.com/dhZfG7s.jpg](https://i.imgur.com/dhZfG7s.jpg)The pandemic has disrupted our lives throughout the globe, and Istanbul has been no exception.We as the Istanbul Metropolitan Municipality are responsible for providing and maintaining services in transportation, infrastructure, environment, utilities, arts, culture, social aid, sports, and a lot more to a city of 16 million people.My team and I are now dealing with unprecedented challenges in each of our areas of operation, along with a few rare opportunities.We have been working round the clock for the past few months to help limit the contagion of the disease and provide relief for those bearing the brunt of the pandemic. Simultaneously, we are taking advantage of the lockdown as an opportunity to cleanse and disinfect public spaces, repave major roads and squares, upgrade our drainage systems, continue the construction of our new metro lines, and enhance cooperation with our international partners and counterparts.Just like everywhere, the pandemic has brought out the best of our people. In less than a week, our fellow citizens have raised over $2 million in solidarity via our bill-on-the-hook campaign to pay the water and gas bills of those Istanbulites financially struggling during the lockdown.I will be here for the next hour to share our experience and answer your questions.**UPDATE:** It is now 17:08 in Istanbul and I have to sign off. Thank you everyone for your questions, and special thanks to r/Coronavirus moderators for inviting me to do this AMA. As a concluding note, I would like to remind everyone that the struggle against COVID-19 is a global one. As I keep saying in Turkish: Birlikte başaracağız - we will get through this together!If you want to stay up to date with what's going on in Istanbul, follow my English account on Twitter: [http://twitter.com/imamoglu\_int](http://twitter.com/imamoglu_int)"Governor Cuomo: “Younger people listen up: 55% of NYS #Coronavirus cases are ages 18-49. Young people aren’t invincible. You can get this and you can give it to someone older you love. You shouldn’t endanger your own health & you certainly shouldn't endanger other people's health. #StayAtHome”	15309	908	2020-03-21 19:36:36	Texas Couple Beats COVID-19, Cancer, and Chemotherapy Together	15261	200	2020-07-27 01:13:27	"Sam Wang, a neuroscientist and professor at Princeton University, comments on photos of a large crowd of people out and about: ""This gathering will kill a dozen people by May. I hope you found it worth the cost."""	15261	691	2020-03-23 06:39:31	America Is Giving Up on the Pandemic	15263	2162	2020-06-07 22:45:53	Scientific Studies Looking For Participants	15259	148	2020-04-04 21:02:25	"With the rapid increase in severity of the coronavirus situation, we feel as though it is important to make a difference in any way we can. Therefore, we are calling on YOU, our users, to help scientists progress research!**What does this mean?**This post will host all of the studies/surveys for users to participate in. **Participation is strictly voluntary, and you may withdraw from any of the below studies at any time.** This post will be stickied to the r/Coronavirus subreddit whenever possible in order to give these projects ample exposure.**For Researchers:** If you would like to have your study/survey posted, please [send us modmail](https://www.reddit.com/message/compose?to=%2Fr%2FCoronavirus) and we will give you instructions on how to verify your study.In addition, there is a useful resource available for researchers from SafeGraph. They are sharing their data and that of their partners free for non-commercial and academic research use. To access this database, please [click here](https://www.safegraph.com/covid-19-data-consortium?utm_source=consortium_outreach&utm_campaign=consortium_rd)**For Users:** Feel free to click on the links to any of the studies posted here that interest you and for which you qualify. Again, you are under no obligation to participate in any of the studies listed.**Disclaimer:** All of the studies posted here have been verified to be authentic studies, either from a recognized research facility, government organization, or academic institution, and are conducted with all the necessary ethical and legal considerations. Individual studies may outline their specific disclaimers in the comments.**NOTE: This post will remain active at all times. Please check back intermittently as we will be adding new studies on a regular basis. We may unpin the post from our front page to promote featured projects or AMAs, but we will re-pin it after the special events have ended. Individual comments with study details will be removed when the study has ended.**"Over 1000 people have recovered in Italy!	15252	560	2020-03-10 22:43:15	Crystal clear water in Venice due to decrease of pollution	15246	574	2020-03-15 14:57:28	A Medical Worker Describes Terrifying Lung Failure From COVID-19 — Even in His Young Patients - “It first struck me how different it was when I saw my first coronavirus patient go bad. I was like, Holy shit, this is not the flu. Watching this relatively young guy, gasping for air, pink frothy	15234	1287	2020-03-21 13:19:23	New York City man arrested for running speakeasy where people were drinking and gambling during coronavirus lockdown	15211	592	2020-03-30 17:58:25	US hospital uses five months’ worth of supplies in six days as shortages hit	15202	924	2020-03-17 17:55:07	Starbucks Is Paying All Workers for the Next 30 Days, Even If They Choose to Stay Home	15169	503	2020-03-24 01:13:40	Major Antibody Study Finds 3.4 Million in England Had Covid-19	15127	1188	2020-08-13 13:23:39	The New York Times has dropped its paywall on Coronavirus coverage.	15103	294	2020-03-12 06:06:40	Gov. Cuomo: The Four Seasons Hotel on 57th Street will provide FREE lodging to doctors, nurses & medical personnel currently working to respond to the #COVID19 pandemic. Thank you @FourSeasons.The first of many hotels we hope will make their rooms available.	15093	259	2020-03-25 23:37:33	Russia's potential coronavirus vaccine shows 'no serious adverse events' and creates antibody response: The Lancet	15052	1187	2020-09-04 15:45:16	Two days after Alton, IL mayor announces police will issue citations to those violating the state's stay-at-home order, mayor's wife is caught at party and cited for violating stay-at-home order.	15043	468	2020-04-07 07:11:48	Top US infectious diseases expert calls for a federally mandated stay-at-home order	15006	937	2020-04-03 04:43:08	Fauci: Chinese authorities did a 'disservice' by not allowing scientists to speak about COVID-19	14989	508	2020-06-07 15:23:05	With India on Lockdown, Endangered Sea Turtles on Course to Lay SIXTY MILLION Eggs This Year	14983	626	2020-03-31 21:48:27	Himalayas visible for first time in 30 years as pollution levels in India drop	14924	469	2020-04-08 22:59:50	Nepal announces country-wide lockdown from March 23rd. A country with 0 active Covid-19 cases.	14921	768	2020-03-22 03:13:40	Dr. Fauci says he'll never be 'muzzled' in discussing coronavirus science and facts	14922	459	2020-09-09 23:47:07	With No End in Sight to the Coronavirus, Some Teachers Are Retiring Rather Than Go Back to School	14913	1040	2020-07-08 21:48:25	To escape the bubonic plague, Isaac Newton left London for the near total solitude of his family farm, where he invented calculus, created the science of motion, unravelled gravity, and more. Or so the story goes.	14895	557	2020-04-06 23:43:15	Beautiful demonstration of micro-droplet i.e. airborne virus	14891	1267	2020-04-03 16:13:38	"The CEO of a small ventilator company near Seattle has ""received inquiries from a number of wealthy individuals hoping to buy their own personal ventilators, a fallback plan in case the American hospital system buckles."""	14838	1142	2020-03-18 23:01:18	California becomes first state to recommend coronavirus tests for some without symptoms	14838	537	2020-04-22 03:57:19	Psychopathic traits linked to non-compliance with social distancing guidelines amid the coronavirus pandemic	14806	784	2020-06-08 02:14:53	Italy saw the smallest increase in new cases since its outbreak began, and there were nearly as many recoveries as new infections in the past 24 hours	14751	805	2020-03-30 20:47:08	US Intelligence alerted NATO and Israel to a disease outbreak in Wuhan, China during the second week of November 2019	14748	895	2020-04-17 07:10:40	John Conway, inventor of the Game of Life, has died of COVID-19	14712	355	2020-04-14 04:22:53	Spain Reports No Virus Deaths for First Time Since March	14675	332	2020-06-02 12:40:39	Those who intentionally spread coronavirus could be charged as terrorists	14633	477	2020-03-25 07:48:01	Dr. Fauci says people should not politicize coronavirus: ‘We’ve been through a Depression, we’ve been through a World War. We pulled together through 9/11’	14522	970	2020-08-14 05:12:18	Ford plans to build 1,000 respirators per month (using F-150 seat fans, portable battery packs & 3D printed parts) and 100,000 face shields per week, in partnership with the UAW, GE Healthcare & 3M.	14490	488	2020-03-24 17:20:02	Coronavirus: Dad hides symptoms to gain access to NY maternity ward	14490	1180	2020-03-31 20:41:09	Gamestop Employees are being told to buy their own cleaning supplies. After some stores turned off playable stations paid for by game companies, GameStop instructed them to turn them back on—with no supplies to clean them.	14483	846	2020-03-17 22:36:42	NYC hospital plays 'Don't Stop Believin'' every time a COVID-19 patient is discharged	14466	452	2020-04-14 14:29:20	Coronavirus: New York City to run out of medical supplies within three weeks, Bill de Blasio warns.	14352	1401	2020-03-20 03:15:28	"Dallas Mavericks owner Mark Cuban on suspension of NBA season due to coronavirus: ""I'm a lot more worried about my kids and my mom who's 82 years old…than I am about when we play our next game."""	14349	221	2020-03-12 08:08:35	Coronavirus has killed nearly 52,000 people in the US, over a quarter of the world's deaths	14326	949	2020-04-25 16:26:50	Respiratory Therapist in Dallas Dies After Contracting COVID-19 | Isabelle Papadimitriou is among hundreds of U.S. health care workers who've fallen on the front lines	14321	456	2020-07-16 16:25:48	CDC was pressured 'from the top down' to change coronavirus testing guidance, official says - ABC17NEWS	14315	170	2020-08-26 20:42:29	Bill Gates: Entire country needs to shut down for 6-10 weeks to effectively fight coronavirus	14308	1065	2020-03-27 22:23:03	Face Shields Reduced Percentage of Health Workers Infected With Covid-19 From 19% to Zero	14290	636	2020-08-19 23:02:00	Newest Shortage in New York: The City Is Running Out of Dogs [and also cats] to Adopt [After a Surge in Adoption/Fostering Applications]	14226	494	2020-03-25 22:40:07	A N.Y. Nurse Dies. Angry Co-Workers Blame a Lack of Protective Gear.	14190	968	2020-03-27 03:12:48	Economic Shutdown Is Estimated to Save 600,000 American Lives	14154	1690	2020-03-24 17:09:02	Italy for 1st time sees single-digit daily deaths from COVID-19	14043	463	2020-06-28 08:34:51	Bill Gates to Spend Billions on Coronavirus Vaccine Development	14014	1094	2020-04-06 18:25:51	That Discomfort You’re Feeling Is Grief: The coronavirus pandemic has led to a collective loss of normalcy.	13931	760	2020-03-25 20:43:18	