title	score	num_comm	created	contentSouth Korea developed an entire testing infrastructure that gets results in 6 hours and is able to test 20,000 people a day. And they did it in 17 days. All we had to do was copy it.	52194	225	2020-03-15 18:24:57	Study: 71 percent of jobless Americans did not receive their March unemployment benefits	52184	496	2020-04-27 00:09:52	We Now Know Who Society’s Essential Workers Are. And They’re Among The Lowest Paid.	52133	1150	2020-03-28 17:35:24	3M asked to stop exporting N95 respirators to Canada and Latam by US government - they have politely and publicly said No	52040	1714	2020-04-03 19:28:29	White House abandoned plan to send 650 million face masks across the U.S. in April, report says	51923	1881	2020-09-17 23:01:03	"Fauci ""depressed"" U.S. can't get new coronavirus cases down: ""We're still in the first surge"""	51630	3263	2020-09-11 17:11:11	Fauci says it would be 'false statement' to say US has coronavirus under control	51207	1378	2020-04-05 19:37:00	This Alaskan man is making a 14-hour boat trip to Costco every week to supply his small city with groceries amid the pandemic	51145	868	2020-05-17 00:36:42	Coronavirus conference cancelled due to coronavirus.	51019	1039	2020-03-11 07:29:10	Nearly Half Of The Twitter Accounts Discussing ‘Reopening America’ May Be Bots	50934	2514	2020-05-21 22:42:19	Belgian prince travels to the south of Spain, violates mandatory 14 day quarantine, celebrates party violating social distancing, then tests positive for Coronavirus	50861	766	2020-05-30 17:13:20	Face masks could be giving people Covid-19 immunity, researchers suggest. Mask wearing might also be reducing the severity of the virus and ensuring that a greater proportion of new infections are asymptomatic	50752	2394	2020-09-13 05:50:12	One of the first ships to resume cruising is having a COVID outbreak	50617	2038	2020-08-01 04:54:28	andlord changes locks on California church after pastor said he'd continue to hold services	50108	1321	2020-04-07 04:53:18	U.S. Passes 1 million COVID Cases	50061	1242	2020-04-27 23:05:37	Missouri nurse who raised concerns about lack of protective gear dies of coronavirus a week before her retirement	50051	1120	2020-04-27 15:10:12	#StayTheFuckHome - A Movement to Stop the COVID-19 Pandemic	50016	3074	2020-03-11 15:01:01	Wuhan tested the entire city of 9,899,829 people in 10 days, found no active case, 300 asymptomatic carriers.	49959	2771	2020-06-02 16:06:59	White House economic advisers warned investors about pandemic, but not American public	49714	1263	2020-10-15 16:36:46	More than 600,000 people sign petition demanding hazard pay for U.S. Postal Service employees	49669	1477	2020-04-15 18:21:14	Ukrainian MP claimed “there is no coronavirus” in his speech, tested positive for COVID-19	49467	61	2020-03-23 13:31:11	"All People In Illinois Have Been Ordered To Stay Home To Stop The Coronavirus From Spreading: ""I fully recognize I am choosing between saving people's lives and saving people's livelihoods,"" Gov. J.B. Pritzker said, ""but ultimately you can't have a livelihood if you don't have a life."""	49432	2067	2020-03-21 01:06:44	U.S. cities fear protests may fuel new wave of virus outbreaks	49313	3849	2020-05-31 02:31:59	"Fauci: ""WHO 'not correct' in suggesting asymptomatic spread of Covid-19 is very rare"". Fauci said WHO ""walked that back because there's no evidence to indicate that's the case,"" and explained evidence shows between 25% to 45% of infected people likely are without symptoms."	49290	2051	2020-06-10 16:46:14	"WhiteHouse seeks to discredit Fauci in memo leaked to reporters Administration sources say he's sometimes referred to as ""Dr. Gloom and Doom."""	49255	2742	2020-07-13 16:38:02	Texas Medical Center (Houston) has officially reached 100% ICU capacity.	49241	3874	2020-06-25 22:36:35	'People are dying every night': Staff at overwhelmed Wisconsin hospital urge people to take coronavirus seriously	49233	2864	2020-10-20 16:29:14	The US record 71128 new cases, crossing 70k daily cases for the first time	49223	5241	2020-07-11 03:59:22	Mitt Romney proposes ‘patriot pay’ boost of $12 more per hour for frontline workers	49141	508	2020-05-02 02:35:32	Japan suicides decline as Covid-19 lockdown causes shift in stress factors	49009	1523	2020-05-15 15:09:50	BBC News - Coronavirus: Oxford vaccine can train immune system	48948	2833	2020-07-20 17:39:40	32 prominent economists from both parties sign letter arguing that saving lives from coronavirus would also save the economy	48915	230	2020-03-25 23:54:24	Staggering Surge Of NYers Dying In Their Homes Suggests City Is Undercounting Coronavirus Fatalities	48912	2063	2020-04-07 18:07:12	"PlayStation employees will work from home through April 30 due to coronavirus. Workers will continue to be paid ""regardless of ability to perform remote work"" or not. Sony is also issuing a stipend of $1,000 for purchasing equipment to enhance their ability to work from home"	48901	747	2020-03-29 02:54:54	If someone asks: What's the evidence for mask wearing? Here is a list of *SEVENTY* papers, including reviews/meta-analysis and individual studies, in reverse chronological order.	48879	1862	2020-07-09 18:26:55	"Detroit man with virus symptoms dies after 3 ERs turn him away, family says: ""He was begging for his life"""	48872	1816	2020-04-22 19:55:00	Former White House employee who served 11 presidents dies of coronavirus at 91	48601	823	2020-05-21 05:43:42	Oklahoma student who ‘knowingly had COVID-19’ attends first day of school	48589	2324	2020-08-15 11:43:48	GE workers walk off the job and demand they build ventilators	48559	984	2020-03-31 02:00:01	'I cry before work': US essential workers burned out amid pandemic	48550	2950	2020-09-25 02:33:43	Coronavirus face coverings under the nose equivalent to ‘not wearing a mask’: experts	48543	2934	2020-09-29 17:03:01	Italy just announced new form of lockdown. All commercial activities besides pharmacies and grocery stores are now closed. The 8th biggest economy is officially paralyzed.	48140	2192	2020-03-12 00:54:47	Oxford University's team 'absolutely on track', coronavirus vaccine likely to be available by September	47993	3572	2020-07-19 21:23:41	Fauci: ‘I Don’t Think You Can Say We’re Doing Great. I Mean, We’re Just Not.’	47974	1908	2020-07-10 02:13:58	New York man refuses to let son back in house after taking spring break trip amid coronavirus outbreak	47900	1767	2020-03-31 09:13:37	"'I've run out of tears': Arizona man has lost 5 family members to COVID-19 | “How many more people got to die before he does something about it?"" Ricardo Aguirre said"	47890	1956	2020-06-14 00:33:28	'Don't they care?': Europeans astonished as U.S. hits 5 million cases	47852	4080	2020-08-09 20:41:24	USPS drivers bringing mail to areas hardest hit by coronavirus demand hazard pay	47833	1441	2020-04-05 01:26:10	UPDATE: Number of new coronavirus deaths in the U.S. surpasses 1,000 for the 2nd day in a row	47803	4012	2020-07-23 03:36:30	Wedding planner gets $39.1 million contract to give food to needy during pandemic and hasn't delivered a box yet - San Antonio Express News - May 24, 2020	47795	1640	2020-05-27 04:53:24	CDC website no longer reports the number of confirmed cases in each state.	47792	2949	2020-03-03 21:48:31	Dr. Fauci says: ‘If people are not wearing masks, then maybe we should be mandating,’ as new U.S. COVID-19 cases hit 85,000	47611	2776	2020-10-24 15:27:48	US cases of depression have tripled during the COVID-19 pandemic	47516	2760	2020-09-19 16:19:47	Target, CVS to also require masks at stores nationwide, following Walmart and other retailers as COVID-19 cases rise	47422	1643	2020-07-16 20:00:58	US to halt funding to WHO over coronavirus	47247	2968	2020-04-15 02:35:34	GameStop closing all stores as of March 22 due to coronavirus	47247	2270	2020-03-22 03:59:01	65% of Americans would rather return to lockdown if coronavirus cases spike	47240	2751	2020-06-24 20:55:33	Representatives Tim Ryan and Ro Khanna Introduce Legislation to Send Americans Additional Cash Payments ($2000/month)	47097	4190	2020-04-15 16:36:22	"Anthony Fauci: ""Helpless Means You Can't Do Anything. There's a Lot We Can Do."""	46830	1188	2020-08-23 17:46:56	Kentucky has had 913 more pneumonia deaths than usual since Feb 1, suggesting COVID has killed many more than official death toll of 391. Similar unaccounted for spike in pneumonia deaths in surrounding states [local paper, paywall]	46636	2469	2020-05-26 19:05:48	[Rather] You know who are also heroes? Those working the checkout counters and stocking shelves at supermarkets and pharmacies. Their work, at some risk to their own health, is vital to the health and safety of our country.	46512	1398	2020-03-16 02:06:22	In the last 2 weeks, the Coronavirus emergency room in Parma (Italy) had over 50 patients. Today, for the first time since it was set up, the room is empty	46466	1356	2020-04-01 12:53:34	David Icke, man behind coronavirus 5g conspiracy, has Youtube channel shuttered for sharing misinformation	46322	2814	2020-05-03 16:29:45	A nurse without an N95 mask raced in to treat a 'code blue' patient. She died 14 days later	46263	1821	2020-05-11 03:46:00	Two weeks after court scraps Safer at Home, Wisconsin sets record for new coronavirus cases and deaths	46074	2983	2020-05-28 02:53:08	Miss England hangs up her crown to return to work as doctor during coronavirus pandemic	46063	904	2020-04-06 20:01:39	FBI serves warrant on Sen. Burr in investigation of sale of stocks during coronavirus outbreak	45701	1205	2020-05-14 07:23:32	Europe suppressed the coronavirus. The U.S. has not.	45671	3927	2020-06-21 17:46:55	More people have now died of COVID-19 (3,013) in America than as a result of 9/11 (2,996)	45637	1655	2020-03-31 03:19:47	Dr. Fauci says he doesn't think Americans should ever shake hands again to prevent spread of coronavirus	45469	4988	2020-04-08 15:32:50	Florida man buys $20,000 bottle of bourbon for $40,000 to help struggling restaurant stay afloat	45357	1436	2020-04-14 15:35:42	Austria bans gatherings of more than five people over coronavirus	45287	2039	2020-03-15 16:40:04	Positive COVID-19 patient was at crowded Lake of the Ozarks bars over Memorial Day weekend	45195	550	2020-05-30 03:10:27	COVID-19 is killing a Texan every 6 minutes, 16 seconds	45136	546	2020-07-29 06:07:03	Sophie Gregoire Trudeau, wife of Canadian Prime Minister Justin Trudeau, has fully recovered from Covid-19.	45129	926	2020-03-29 05:26:47	Seattle coronavirus survivor gets a $1.1 million, 181-page hospital bill | The Seattle Times	45121	1065	2020-06-13 16:10:42	Hundreds of conservation experts join forces to pressure WHO to force live animal markets to close	45082	1934	2020-04-07 15:35:51	Billie Eilish criticises peers for partying during coronavirus pandemic: 'I haven't hugged my best friends in six months’	44972	2018	2020-09-17 11:54:18	Kentucky puts ankle monitors on coronavirus patients who break quarantine	44808	1651	2020-04-02 06:04:56	A majority of Americans, 56%, conclude that the country is moving too quickly to re-open, new poll finds.	44684	1769	2020-06-26 13:39:28	OFFICIAL: The Prime Minister confirmed in a press conference that ALL Italy is on quarantine, not only the region of Lombardy.	44441	3731	2020-03-10 00:41:13	This week, the CDC has tested 77 people for coronavirus & the Utah Jazz have tested 58.	44443	2130	2020-03-13 16:25:32	Dr. Fauci says football is perfect environment to spread coronavirus	44401	3990	2020-05-11 16:33:32	‘How can I be sick?’ Woman who took hydroxychloroquine for 19 years to treat lupus still got COVID-19	44328	2234	2020-05-20 22:44:03	The Japanese government has announced that the reselling of masks for profit will become a crime punishable by a one-year jail term or a 1m-yen fine ((£7,320; $9,560) - or both.	44331	1673	2020-03-10 14:08:52	Grocery workers say morale is at an all-time low: ‘They don’t even treat us like humans anymore’	44318	2338	2020-08-13 01:28:59	Guidelines call for 14-day drop in cases to reopen. No state has met them.	44306	2179	2020-04-29 04:49:00	Twitter Removes White House Adviser's Tweet Saying Masks Do Not Prevent COVID-19	44218	1746	2020-10-18 15:41:58	POTUS disinfectant comments trigger manufacturer to warn people against injecting themselves with cleaning products	44202	1965	2020-04-24 15:55:59	New York City EMS received more than 6,400 medical 911 calls on Wednesday, surpassing the record set on September 11, 2001 - WaPo	44097	2117	2020-03-27 05:58:13	Costco to require all shoppers to wear face masks	44050	3212	2020-04-29 18:22:38	New York, New Jersey and Michigan saw 20,000 more deaths than average in March and April. These were on top of the deaths already accounted for by COVID-19 death counts. This leads researchers to believe the COVID-19 death count is actually much higher than is being reported.	44004	2220	2020-05-02 20:56:06	Sick People Across the U.S. Say They Are Being Denied the Coronavirus Test	43821	4390	2020-03-13 07:01:06	Masks should be mandatory to avoid becoming like the U.S., Toronto mayor says	43691	1621	2020-07-01 01:44:50	CDC Denies Native American Tribes’ Requests For Coronavirus Data That Is Freely Available To States	43668	789	2020-06-14 16:03:39	"Chinese electronics company Xiaomi donates tens of thousands of masks to Italy, and quotes Seneca: ""We are waves of the same sea, leaves of the same tree, flowers of the same garden""."	43665	1533	2020-03-09 12:15:19	School that Boris Johnson visited to show was ‘safe’ closes due to coronavirus days after visit	43311	807	2020-09-07 21:35:47	90 Yr Old Woman Dies From Coronavirus After Refusing Ventilator, Tells Doctor To Save It For Sick Younger People	43306	1443	2020-03-30 19:40:28	Apple donates over 9 million N95 masks previously stockpiled from California wildfires	43092	1125	2020-03-25 22:51:07	Bill Gates commits $750M to help Oxford vaccinate the world against COVID-19	42986	1753	2020-06-06 03:07:34	Analysis Finds True Pandemic Death Toll Is Much Higher Than 200,000 in US	42982	2231	2020-10-12 03:09:10	Florida reports over 15,000 COVID-19 cases in single-day record	42891	2984	2020-07-12 19:12:27	Gov. Cooper says ‘strong’ people wear face coverings as sign of compassion	42866	1182	2020-06-20 01:10:41	Russia smashes coronavirus single-day case record with more than 12,000 in 24 hours	42840	1673	2020-10-09 15:49:05	Boris Johnson says 'anti-vaxxers are nuts'	42761	1168	2020-07-24 13:57:08	These Arizona teachers shared a classroom for summer school. All 3 contracted COVID-19. 1 died.	42752	2756	2020-07-10 16:17:10	Bill Gates on Elon Musk’s controversial coronavirus comments: Stick with electric cars and rockets	42655	2616	2020-07-31 19:53:33	Florida beaches will close for Fourth of July weekend over coronavirus concerns	42560	1643	2020-06-29 14:44:28	Dr. Fauci says his kids aren't coming home for Thanksgiving as Americans 'sacrifice' holiday gatherings to stay safe from coronavirus	42522	2028	2020-10-15 01:27:01	New bill would withhold pay from senate until a coronavirus stimulus package passes	42516	661	2020-03-25 03:53:01	50-75% of COVID-19 cases are completely asymptomatic but contagious (a whole city got tested in Italy, ~3k population)	42364	3128	2020-03-17 03:14:03	12 Texas bars temporarily lose alcohol permits after violating COVID-19 health protocols, officials say	42323	1012	2020-06-22 03:07:19	Because of Coronavirus fears, 93% of people interviewed in Hong Kong, Myanmar, Thailand and Vietnam would support their government closing all illegal and unregulated markets selling animals from the wild in their country.	42295	818	2020-04-09 21:12:30	Fauci said he thinks it's 'inconceivable' that he's received death threats 'when you are trying to promote public health principles to save people's lives'	42184	1916	2020-08-12 10:54:18	Tom and Rita Hanks have been released from the hospital!	42177	1167	2020-03-17 07:27:24	Tennessee judge rules state must let all registered voters cast ballots by mail amid coronavirus	42171	358	2020-06-05 06:49:50	"Fauci: If Covid-19 mitigation efforts started earlier, ""you could have saved lives"""	42141	3024	2020-04-12 18:17:29	'I don't wish this on anyone:' Young single mother of three dies from COVID-19	42062	2607	2020-07-29 16:41:51	The US records over 28,000 cases in 1 day, the most since the beginning of May as all 50 states reopen	42027	4039	2020-05-22 04:59:06	Amazon has suspended 6,000 seller accounts globally for coronavirus price gouging	41854	1329	2020-04-16 17:10:05	Italy reports 5,986 new cases of coronavirus and 627 new deaths, raising total to 47,021 cases and 4,032 dead	41637	4406	2020-03-20 21:09:31	New Orleans councilman: '﻿I would rather have students dumb and alive than have them educated and dead'	41573	1668	2020-08-04 14:37:13	Monkeys 'escape with COVID-19 samples' after attacking lab assistant	41411	2149	2020-05-29 17:09:16	Guy Fieri Raises More Than $20 Million for Restaurant Workers Affected by Coronavirus	41327	775	2020-05-10 19:24:05	'It's serious': South Carolina sees worst spike in COVID-19 cases since pandemic began	41173	3333	2020-06-11 05:15:36	Reporter: Just arrived at JFK from Paris. Zero screening, testing or even questions related to coronavirus	41011	2139	2020-03-12 23:12:20	Coronavirus homeschooling: 77 percent of parents agree teachers should be paid more after teaching own kids	41011	1976	2020-05-01 20:33:11	Prince Charles tests positive for the Coronavirus	40810	2391	2020-03-25 14:37:00	37-year-old Port Clinton war vet dies from COVID-19 complications on Fourth of July | Richard Rose in April posted on Facebook that he would not wear a mask. In an unlikely turn of events, he lost his battle with COVID-19 three months later	40727	2838	2020-07-11 15:54:57	Churches Were Eager to Reopen. Now They Are a Major Source of Coronavirus Cases.	40692	2400	2020-07-08 15:12:41	South Florida bars packed after Gov. gives OK for reopening	40643	3530	2020-09-27 16:08:05	Almost half of Americans say that presidential coronavirus briefings are not an important source of information, poll shows	40438	2011	2020-04-29 22:36:21	PM Johnson admitted to hospital over virus symptoms	40407	1618	2020-04-06 00:16:50	"Fauci says ""anti-science bias"" is a problem in the US"	40198	1649	2020-06-18 20:08:10	Fauci holds up New York as model for fighting coronavirus — 'They did it correctly'	40146	2959	2020-07-18 19:23:34	Media Watchdog Names Sean Hannity as a Chief Source of Coronavirus Misinformation	39941	486	2020-04-12 07:43:08	Los Angeles Mayor Garcetti announces DWP will shut off water and power to nonessential businesses that don’t close	39942	1814	2020-03-25 05:07:39	Senate leaves until September without coronavirus relief deal	39829	2146	2020-08-14 00:06:34	Shutdowns prevented 60 million coronavirus infections in the U.S., study finds	39804	2133	2020-06-08 14:44:26	The Pandemic Has Led to a Huge, Global Drop in Air Pollution. Reductions in traffic and industry have lowered nitrogen dioxide levels—offering an accidental glimpse into what a low-carbon future might look like.	39793	1780	2020-04-05 10:05:26	White House Blocked C.D.C. From Requiring Masks on Public Transportation	39653	1356	2020-10-10 02:36:32	The first coronavirus case in the U.S. and South Korea was detected on the same day. By late January, Seoul had medical companies starting to work on a diagnostic test — one was approved a week later. Today, the U.S. isn’t even close to meeting test demand	39524	2381	2020-03-19 14:06:16	US reaches 1% of its population officially being confirmed as infected with coronavirus.	39454	3116	2020-07-11 19:35:13	"Fauci: ""What keeps [me] awake at night? Well, it's irrelevant because I don't sleep anymore."""	39458	1353	2020-04-08 06:56:41	Fauci says we aren't winning against coronavirus, calls it health experts' 'worst nightmare'	39323	2228	2020-07-23 15:58:42	New York City Without Coronavirus Deaths for First Time Since Start of Pandemic	39245	1500	2020-07-12 22:31:14	Amazon suspends almost 4,000 seller accounts for ‘unfairly priced’ products during virus pandemic	39197	1030	2020-03-24 05:51:05	Pastor who decried 'hysteria' dies after attending Mardi Gras	39118	119	2020-04-06 03:16:23	Amazon to start paying US warehouse workers double time for all overtime hours	39004	1372	2020-03-21 20:52:31	Fauci: Real coronavirus death toll 'almost certainly' higher than official 80,000 count	38937	2340	2020-05-12 19:42:46	Oxford Expert Claims Their COVID-19 Vaccine Gives Off Long Term Immunity With Antibodies 3X Higher Than Recovered Patients	38751	2383	2020-07-03 13:43:40	Mask wearers are “dramatically less likely” to get a severe case of Covid-19	38735	1495	2020-08-31 21:47:49	Bill Gates says it’s ‘outrageous’ that Americans still can’t get coronavirus test results in 24 hours	38543	1552	2020-09-20 22:11:17	In the early days of the pandemic, the U.S. government turned down an offer to manufacture millions of N95 masks in America	38497	1294	2020-05-09 21:22:20	#FloridaMorons trends as people flock to the beach after coronavirus restrictions are lifted in parts of the state	38471	1285	2020-04-18 21:11:18	U.S. ‘wasted’ months before preparing for virus pandemic	38371	20	2020-04-05 16:44:55	Number of patients in intensive care in Italy drops for the first time.	38306	1021	2020-04-04 20:23:11	Bill Gates Says Majority of U.S. Coronavirus Testing Is a 'Complete Waste' Because It Takes Too Long	38278	2841	2020-07-28 18:07:55	"CDC Adviser: ""It’s a lot easier to wear a mask than a ventilator"""	38248	975	2020-06-30 14:51:28	New York Governor signs executive order that allows store owners the right to ban any customer that enters without wearing a mask.	38227	1267	2020-05-28 20:02:47	People who social distance may be more intelligent, study says	38140	2464	2020-07-15 07:45:11	California's COVID-19 positivity rate drops below 3% for the first time	38145	1311	2020-09-22 04:57:17	Dr. Fauci says all the ‘valid’ scientific data shows hydroxychloroquine isn’t effective in treating coronavirus	38087	2067	2020-07-29 20:58:23	Coronavirus Update: Poll finds 81% of Canadians think Canada-U.S. border should stay closed	38067	759	2020-07-08 03:52:43	CDC director warns America is in for the ‘worst fall…we’ve ever had’	38012	2563	2020-08-14 14:32:33	Colorado suspends license of Castle Rock restaurant that defied coronavirus public health order	37942	2272	2020-05-12 01:13:07	‘The US state of Arizona, is currently registering as many new cases of coronavirus as the entire European Union, which has a population 60 times greater.’	37926	3018	2020-07-12 14:45:52	America has one of the world's worst coronavirus responses	37844	2677	2020-03-20 14:18:27	Dr. Anthony Fauci says coronavirus turned 'out to be my worst nightmare' and it 'isn't over'	37481	1914	2020-06-09 22:44:48	US reports 50,298 cases today so far, highest on record	37483	3535	2020-07-02 04:25:26	Maryland governor says now is 'the worst possible time' to lift coronavirus restrictions	37408	557	2020-04-17 00:17:51	Cheap steroid cuts death rates significantly for seriously ill Covid-19 patients in intensive care, drug trial finds	37321	1158	2020-06-16 16:04:10	‘The beginning of a horror movie’? Disney World slammed as doors reopen amid spiking coronavirus cases	37282	2821	2020-07-13 04:31:02	Google says most employees will work from home until 2021 amid pandemic	37270	1921	2020-05-08 21:19:03	NY Governor says protesters should 'assume' they have been 'infected' with coronavirus	37218	1645	2020-06-04 22:25:08	Dr. Anthony Fauci: ‘We will have coronavirus in the fall’	37108	2615	2020-04-23 16:16:04	Why scientists change their mind and disagree: changing your mind based on new evidence is a badge of honor in the scientific community. The situation is complicated by the fact that pre-print research is often being debated in public on social media	37063	1449	2020-05-28 15:10:38	Chicago nurse told friend she was ‘scared to death.’ Within weeks, she and her son were dead from COVID-19, and her husband barely survived.	37054	1823	2020-04-26 00:10:52	Colorado girl who pioneered medical marijuana for seizures dies after battling coronavirus	37037	742	2020-04-08 18:38:48	New York City reported zero COVID-19 deaths for three straight days	37033	1398	2020-08-05 18:51:44	Google to Keep Employees Home Until Summer 2021 Amid Coronavirus Pandemic	37029	1604	2020-07-27 17:00:49	Spanish princess Maria Teresa is world's first royal to die from the coronavirus	37000	2614	2020-03-28 23:20:05	Vitamin D levels appear to play role in COVID-19 mortality rates: Patients with severe deficiency are twice as likely to experience major complications	36828	2492	2020-05-13 15:40:27	Plague Inc. Getting New Mode That Lets You Save the World From a Pandemic, Not Destroy It	36819	715	2020-03-24 17:28:17	750 Arizona teachers have quit. More than 40% of those teachers say COVID-19 is the reason they chose to resign or retire.	36812	1748	2020-09-18 23:39:59	NEW: The U.S. Pres. says he has been tested for coronavirus, and he is awaiting the results of the test.	36624	600	2020-03-14 20:34:04	A patient diagnosed with pneumonia near Paris on 27 December actually had the coronavirus, his doctor has said.	36492	2375	2020-05-05 12:34:23	An Italian town tested all 3,300 residents, found 3% positive and 1.5% asymptomatic. After quarantining them and their contacts, it cut new COVID-19 cases to zero.	36388	1242	2020-03-19 09:19:16	