title	score	num_comm	created	contentEffects of Aging and Lifelong Aerobic Exercise on Basal and Exercise-Induced Inflammation in Women	19	2	2020-10-18 21:53:24	
NAD+ Binds to and Inhibits a Protein that Promotes Degeneration of Neurons	25	2	2020-10-25 08:25:13	
Two Studies Show COVID-19 Antibodies Persist for Months	17	3	2020-10-20 17:52:38	
Solving the Problem of Slippery Train Tracks Due to Fallen Leaves	17	9	2020-10-20 15:47:37	
Microplastics in take-out food containers	18	8	2020-10-20 00:10:41	
Important to address the risk factors to reduce the burden of diseases, nationally, regionally, and globally.	15	2	2020-10-23 09:33:30	
The Subdivision of NAD+ into Cell Compartments is Critical to Mammalian Life	16	1	2020-10-23 09:08:26	
Scientists find that seismic ripples in the surface of the sun, dubbed sunquakes, are associated with solar flares. The researchers hope the discovery will lead to accurate predictions of the timing and intensity of future solar flares.	16	2	2020-10-19 21:19:40	
Tetrahedra may explain water's uniqueness	13	0	2020-10-19 11:24:57	
In collaboration with Pfizer, IBM scientists have developed a potential AI model that could help predict Alzheimer’s disease’s before it develops.	16	6	2020-10-22 20:25:02	
A bioarchaeological study of African American health and mortality in the post-emancipation U.S. south found that whereas urban adults had higher midlife mortality and reduced longevity compared to their rural counterparts, both rural and urban children experienced poor health.	10	0	2020-10-23 21:45:56	
Changing diets and traditional lifestyle of Siberian Arctic Indigenous Peoples and effects on health and well-being	14	1	2020-10-22 04:03:35	
Interactions of DNA and proteins have deep-seated propensities to form higher-ordered structures such as those which allow the extreme packaging of DNA in cells. This new understanding of biopolymeric self-organisation may be important for understanding how life self-organised to become living.	13	0	2020-10-19 20:00:41	
Pilot study: Inflammatory Biomarkers be Used to Spot Respiratory Viral Infections	11	1	2020-10-23 20:35:15	
Cellular optogenetics uses light to control cell signaling in space and time, making it an invaluable technique for disease research. Scientists developed a way to make these tools much easier to monitor and apply, and demonstrated their use in studying cellular side effects of cancer medicines.	11	1	2020-10-22 16:47:14	
Forelimb force direction and magnitude independently controlled by spinal modules in the macaque	12	1	2020-10-20 04:37:19	
NASA’s OSIRIS-REx spacecraft lands on asteroid in bid to collect samples	12	0	2020-10-22 06:08:24	
Interacting Infrastructure Disruptions Due to Environmental Events and Long‐Term Climate Change	12	1	2020-10-19 16:54:57	
Language prediction mechanisms in human auditory cortex	12	0	2020-10-19 15:29:57	
Catalytic upcycling of high-density polyethylene via a processive mechanism	8	0	2020-10-18 21:02:54	
No Evidence That Salt Water Ingestion Kills Adult Mosquitoes (Diptera: Culicidae)	10	1	2020-10-21 17:13:50	
Agency in the fentanyl era: Exploring the utility of fentanyl test strips in an opaque drug market	11	0	2020-10-21 01:31:57	
Estimation of change in house sales prices in the United States after heat pump adoption	9	2	2020-10-20 21:01:42	
Cross‐sectional biomarker comparisons in asthma monitoring using a longitudinal design: The eNose premise	9	1	2020-10-23 20:50:23	
HSB-1/HSF-1 pathway modulates histone H4 in mitochondria to control mtDNA transcription and longevity	6	0	2020-10-23 05:49:25	
Seeking Solar System’s Secrets, NASA’s OSIRIS-REX Mission Touches Bennu Asteroid	8	0	2020-10-22 19:14:54	
Recurrent processing via prefrontal cortex, necessary for quick visual object processing in primates, provides a key insight for developing brain-like artificial intelligence	9	1	2020-10-21 17:19:23	
Lorises use their venom against each other, finds Current Biology study	8	3	2020-10-20 03:33:16	
Beta-Adrenergic Receptor Stimulation Modulates the Cellular Proarrhythmic Effects of Chloroquine and Azithromycin	8	0	2020-10-22 11:25:36	
Limited climate benefits of global recycling of pulp and paper	7	1	2020-10-21 22:04:30	
Providing a hybrid data exploration setup with an AR headset and a regular computer can help data analysis purposes as confirmed by CERN scientists	8	1	2020-10-20 15:34:50	
Retrospective valuation of experienced outcome encoded in distinct reward representations in the anterior insula and amygdala	9	0	2020-10-20 05:18:30	
Wild boar rooting affect spatial distribution of active burrows of meadow-dwelling voles	6	0	2020-10-19 00:14:29	
Recent archaeological excavations on the Peru's south coast provides new evidence of Inka ritual practices that included the dedicatory sacrifice of domesticated animals, such as llamas.	12	0	2020-10-25 04:19:00	
Influence of NAD+ as an ageing-related immunomodulator on COVID-19 infection	10	1	2020-10-24 05:54:54	
Utica Shale Play Oil and Gas Brines: Geochemistry and Factors Influencing Wastewater Management	7	0	2020-10-19 20:54:49	
Stable carbon and nitrogen isotope data of bone collagen of 105 human and 50 animals from the 5th millennium BC to the Sarmatian period indicate dietary variation among the cultural entities as well as regarding age, sex and archaeologically indicated social status is only weakly reflected.	7	0	2020-10-22 06:18:34	
Key details about broadly neutralizing antibodies provide insights for universal flu vaccine: The research is inspired by the limited efficacy of the annual flu vaccine, which must be adjusted each year to provide the best protection against commonly circulating strains of the virus	42	0	2020-10-25 13:10:25	
eNose breath prints as a surrogate biomarker for classifying patients with asthma by atopy. - Abstract	4	2	2020-10-23 21:03:00	
The yeast mating-type switching endonuclease HO is a domesticated member of an unorthodox homing genetic element family	4	0	2020-10-21 07:02:54	
Simulation of high-output and lightweight sliding-mode triboelectric nanogenerators	5	0	2020-10-21 02:27:56	
Spatial ultrasound modulation by digitally controlling microbubble arrays	6	1	2020-10-21 02:26:04	
Enzyme Regulating NAD+ Keeps Mouse Cells Replicating Under Stress	3	0	2020-10-20 08:50:35	
Bridging the Gap Between Biofuels and Biodiversity Through Monetizing Environmental Services of Miscanthus Cultivation	4	0	2020-10-20 20:13:03	
Fasting Drives Nrf2-Related Antioxidant Response in Skeletal Muscle	15	6	2020-10-25 13:56:58	
Researchers from Switzerland recently developed a new approach for generating high-energy, ultrashort pulses with single-mode beam quality: nonlinear beam cleaning in a multimode laser cavity.	1	0	2020-10-21 19:41:33	
Aqueous Film-Forming Foams Exhibit Greater Interfacial Activity than PFOA, PFOS, or FOSA	3	0	2020-10-19 21:04:09	
A Municipal-Scale Analysis of Historic Preservation, Flood Hazards, and Planning	2	0	2020-10-19 20:05:28	
Potential for Powered Flight Neared by Most Close Avialan Relatives, but Few Crossed Its Thresholds	6	1	2020-10-25 12:12:06	
The New Generation Planetary Population Synthesis (NGPPS): III. Warm super-Earths and cold Jupiters: A weak occurrence correlation, but with a strong architecture-composition link	1	1	2020-10-23 19:06:38	
Global burden of disease 👉 204 countries 369 diseases and injuries between 1990–2019.	1	0	2020-10-23 09:28:32	
Lithium-ion capacitor based on nanoarchitectured polydopamine/graphene composite anode and porous graphene cathode	11	5	2020-10-25 13:25:39	
The ecological and evolutionary consequences of systemic racism in urban environments	0	4	2020-10-21 20:04:19	
