title	score	num_comm	created	contentMore than 1,300 prisoners have escaped from a jail in eastern Democratic Republic of Congo's Beni city after suspected Islamist rebels attacked the facility, officials have said.	24	2	2020-10-20 17:40:37	
"UK plans COVID-19 ""challenge"" trials that deliberately infect volunteers"	23	7	2020-10-20 16:34:51	
Man denied German citizenship for refusing to shake woman's hand at naturalization ceremony	25	5	2020-10-20 14:13:58	
Bolivians Return Evo Morales’s Party to Power One Year After a U.S.-Applauded Coup	25	7	2020-10-20 00:53:49	
Japan Disclose Its Latest Hunter-Killer Powered By Lithium-Ion	25	8	2020-10-19 19:09:46	
Under attack and losing hope, Iraqi activists flee abroad	24	1	2020-10-19 17:29:39	
Got any signal up here? Nokia to build mobile network on moon	23	15	2020-10-19 15:47:49	
‘Ignition of new war:’ Sudan political parties reject Israel deal	27	2	2020-10-25 01:13:01	
Arab trade groups boycott French products over insults	28	27	2020-10-24 21:39:22	
Six Nations council calls for land claim talks with Ontario and Ottawa amid tension	24	0	2020-10-24 21:34:48	
Estonia bans entry to Hezbollah members, sanctions terror group	20	3	2020-10-23 23:17:49	
Report: Hamas uses secret base in Turkey to carry out cyberattacks	23	2	2020-10-23 16:58:26	
A woman will oversee global trade for the first time	20	13	2020-10-22 06:39:35	
"China's influence operations offer glimpse into information warfare's future — Intelligence experts are monitoring the ""competition between democratic systems and autocratic systems of government."""	21	4	2020-10-22 00:38:16	
Nigeria president calls for calm amid reports of protesters shot dead in Lagos	24	1	2020-10-21 17:31:31	
Taliban conflict: Afghan fears rise as US ends its longest war	22	20	2020-10-21 15:07:42	
Australia to join India, US, Japan in large naval exercises	21	8	2020-10-20 16:02:19	
Bolivia: Arce's First Measure: Anti-Hunger Bonds For Poor	23	0	2020-10-20 05:03:57	
Trump says Sudan to be removed from terrorism list	23	19	2020-10-20 01:43:11	
UK accuses Russian intelligence of targeting Tokyo Olympics	24	1	2020-10-19 21:03:06	
40 Million Coronavirus Cases Are Now Reported Worldwide	22	4	2020-10-19 18:42:29	
North Korea Treats Detainees 'Less Than Animals' as They Are Tortured, Abused and Raped	23	4	2020-10-19 17:00:27	
Strengthening Quad: Eye on China, India invites Australia to join Malabar drill	24	0	2020-10-19 16:19:13	
IS attacks Gulf states and calls for strikes on 'Saudi economic interests'	22	1	2020-10-19 15:11:10	
Car bombing in western Afghanistan kills 13, wounds 120 | Attack carried out near entrance to provincial police chief's office and other nearby government buildings	25	1	2020-10-18 22:41:34	
School meals: Pressure mounts on government to reverse decision	43	3	2020-10-25 09:13:31	
Ukrainian Law on Intelligence Required by NATO Comes Into Force	25	1	2020-10-25 04:37:56	
Six killed in Ivory Coast town ahead of presidential election	21	2	2020-10-24 14:27:21	
Wales lockdown: Pubs and restaurants shut as Wales lockdown begins	21	0	2020-10-24 01:50:00	
Golden Dawn's Pappas on the run as colleagues start jail terms	23	2	2020-10-23 21:45:02	
Ontario reports 826 new COVID-19 cases, testing rises to 40K	21	0	2020-10-23 19:37:01	
Coronavirus: France puts 46 million under night curfew	21	0	2020-10-23 17:15:17	
Covid-19 vaccine trials not designed to detect risk reduction: expert	21	4	2020-10-23 12:17:12	
Goldman Sachs agrees to pay more than $2.9 billion to resolve probes into its 1MDB scandal	21	8	2020-10-22 20:12:40	
Preventable environmental factors to blame for 15% of deaths across Mediterranean, UN says	22	1	2020-10-22 17:29:01	
Race to Become WTO Leader Narrows to the Final Two Candidates	22	7	2020-10-22 06:24:17	
Iran holds massive air defense war games after rise in border tensions and lifting of arms sale ban	24	9	2020-10-21 23:16:37	
‘Multiple deaths’ as Nigerian soldiers fire on End Sars protesters in Lagos	22	1	2020-10-21 22:53:02	
China Backs Off From Fight With K-Pop Fans	20	6	2020-10-21 20:23:37	
11 arrested, dozens of weapons confiscated in east Jerusalem	21	2	2020-10-20 15:42:04	
Taiwan says it won't be intimidated by China's 'hooligan' diplomats	24	1	2020-10-20 10:29:02	
Greece finalizes plan to build wall on border with Turkey	20	7	2020-10-20 09:49:27	
Revealed: chaining, beatings and torture inside Sudan's Islamic schools	22	5	2020-10-19 17:16:23	
UK government refuses to assist Police Scotland investigation into US torture and rendition	23	6	2020-10-19 17:16:14	
India to return Chinese soldier who 'strayed' across LAC | India News - Times of India	22	2	2020-10-19 15:21:37	
Central Vietnam flooding death toll rises to 88	22	4	2020-10-19 15:03:36	
Indonesians Satisfied with Gov’t Handling of Pandemic despite Surge in Cases	23	3	2020-10-19 02:41:56	
Thousands Protest for Democratic Reforms in Thailand	23	1	2020-10-18 22:33:52	
Palestinians displaced from Syria's Yarmouk camp to finally go home	22	4	2020-10-18 22:13:53	
Afghan forces say they killed senior al-Qaeda terrorist Abu Muhsin al-Masri	35	2	2020-10-25 09:19:42	
Guinea presidential rivals both claim victory	20	1	2020-10-25 04:34:55	
‘Ignition of new war:’ Sudan political parties reject Israel deal - Sudanese demonstrate in the capital against the deal	19	6	2020-10-25 01:43:22	
US issues more threats to NATO ally Turkey after Erdogan confirms tests of Russian-made S-400 systems	21	0	2020-10-24 23:26:48	
Paraguay authorities find at least seven bodies in fertilizer shipment	23	2	2020-10-24 22:30:58	
€2.1mn stolen from Kosovo state treasury, one person detained	22	4	2020-10-24 19:13:36	
Hariri named as Lebanon's new prime minister	21	2	2020-10-24 15:02:29	
UK ‘has launched clandestine attacks on Russia’, former national security chief claims	20	3	2020-10-24 15:02:14	
Palestinians condemn ‘shameful’ Israel-Sudan accord	23	5	2020-10-24 09:46:44	
Pakistan stays on global terrorism financing 'grey list'	20	1	2020-10-24 02:44:01	
Nigeria protests: President Buhari says 69 killed in unrest	23	5	2020-10-23 23:32:32	
Turkish lira hits new record low as central bank holds rates - The currency tumbled after policy-makers disappointed expectations they would raise the benchmark rate, while geopolitics and the possibility of new coronavirus measures hitting the economy also weigh on the embattled lira.	21	2	2020-10-23 20:23:29	
Malaysia set for emergency measures to avert snap polls amid Covid-19 pandemic	24	2	2020-10-23 15:41:00	
US and allies prioritize Indonesia as potential counterweight to China	19	23	2020-10-23 02:15:36	
Fires burn in Lagos after Nigerian soldiers shoot anti-police protesters	21	1	2020-10-22 23:22:17	
Kenya's lakes rise to destructive highs	20	0	2020-10-22 19:47:12	
Australia Post boss told to stand aside after executives given $3k Cartier watch bonuses	23	4	2020-10-22 08:30:17	
AstraZeneca COVID-19 vaccine trial Brazil volunteer dies, trial to continue	22	5	2020-10-22 02:42:58	
Coronavirus: Spain passes one million Covid-19 cases	21	4	2020-10-22 01:00:17	
A midwife, a Covid-19 expert and a refugee: some of New Zealand's new MPs.	22	2	2020-10-21 21:38:32	
"Armenian PM Sees No Quick Diplomatic Solution in Nagorno-Karabakh, says ""Everything that is diplomatically acceptable to the Armenian side is not acceptable to Azerbaijan any more."""	23	9	2020-10-21 19:31:51	
Ex-Mexican defense secretary is denied bail on drug charges	21	2	2020-10-21 17:59:44	
As Covid-19 causes mortality rates to spike around the globe, NZ sees dramatic drop (by 13% in June/July) in deaths	21	4	2020-10-21 11:12:13	
Italy's Campania region to impose nightly curfew as COVID-19 cases surge	23	1	2020-10-20 17:19:39	
Nokia to build 4G network on the moon for NASA	20	7	2020-10-20 15:49:45	
Argentina tops 1 million Covid-19 cases	22	1	2020-10-20 10:27:32	
Israel, UAE agree on 28 weekly direct flights between Emirates, Tel Aviv	20	6	2020-10-19 14:42:12	
Almost 2,500 COVID-19 patients in Belgian hospitals (On Tuesday 13 October there were 12,051 positive cases)	23	0	2020-10-19 13:51:41	
Israel, Bahrain sign deal establishing formal ties	21	2	2020-10-19 10:59:02	
China becomes first major economy to recover from Covid-19 pandemic	23	60	2020-10-19 09:27:49	
Lopez Obrador criticizes DEA role in Mexico after ex-army chief's arrest	23	0	2020-10-19 05:59:58	
Libya's rival forces sign permanent ceasefire at UN-sponsored talks - Deal includes departure of all foreign fighters for at least three months and prisoner exchange	20	5	2020-10-25 03:36:07	
U.S. wades in cautiously to Armenia-Azerbaijan peace effort	20	2	2020-10-24 01:12:54	
"Iran says it's ""not interested in entering the debate"" after Joe Biden warns it will ""pay a price"""	19	26	2020-10-24 00:32:02	
Czech PM tells health minister to quit after lockdown violation	21	0	2020-10-23 14:11:48	
France teacher attack: Seven charged over Samuel Paty's beheading	19	6	2020-10-22 23:05:34	
Putin Says He Believes Nearly 5,000 People Killed in Nagorno-Karabakh Conflict	21	2	2020-10-22 20:41:08	
U.S. State Department approves $1.8 billion in potential arms sales to Taiwan - Pentagon	20	4	2020-10-22 19:16:43	
Spain has now surpassed 1 million Covid-19 cases	18	2	2020-10-22 15:35:30	
FBI says Iran and Russia have US voter information	21	5	2020-10-22 06:59:49	
Dozens Killed in Afghan Stampede While Waiting for Pakistan Visas	20	3	2020-10-21 19:10:52	
Taliban ambush kills dozens of Afghan forces in northern province	21	4	2020-10-21 18:36:25	
G20 women's forum urged to press hosts Saudi on rights	21	3	2020-10-21 17:03:52	
Palestinian Officials Accuse Hamas of Obstructing Elections	19	3	2020-10-21 05:14:50	
Indigenous groups demand meeting with Colombia's president	20	1	2020-10-20 18:08:33	
Van Damme saves life of chihuahua after row over fake passport	17	7	2020-10-20 07:37:26	
NASA's OSIRIS-REx poised to reach out and touched an asteroid.	20	2	2020-10-20 04:57:37	
Tropical Storm Epsilon has formed today and is the 26th named storm of the Atlantic hurricane season. Epsilon is heading for a potential impact on Bermuda late this week, while strong rip currents will spread towards the East Coast of the United States.	19	5	2020-10-20 03:31:36	
N.S. calls on Ottawa to define a 'moderate livelihood,' as fishing dispute boils over | Comments came after multiple acts of violence against Indigenous fishers in southwestern Nova Scotia - A lobster pound in Middle West Pubnico, N.S., was burned to the ground early Saturday, destroying the lobster	19	1	2020-10-19 18:42:03	
New Zealand journalist feted for brutal takedown of minor party politician	20	8	2020-10-19 12:03:00	
Northern Cyprus: Right-wing nationalist Ersin Tatar elected president	20	2	2020-10-19 10:22:21	
Treasury yields climb as stimulus hopes return to the fore	20	1	2020-10-19 10:15:53	
Chileans clang pots, rally in Santiago to mark anniversary of 2019 protests	21	1	2020-10-19 00:59:34	
Bolivia election: Voters head to polls for presidential race	21	1	2020-10-19 00:19:28	
Czech Police Clash With Protesters Opposing Covid-19 Curbs	19	1	2020-10-18 22:36:36	
Sick with COVID-19, Saeb Erekat’s organs start to deteriorate	19	2	2020-10-24 09:51:09	
IMF concerned over post-COVID social unrest across Latin America	19	7	2020-10-23 06:50:32	
TV streaming service shuts down after burning through $2 billion in six months	19	11	2020-10-23 00:55:25	
No Irish unity referendum for five years because of Brexit	21	7	2020-10-22 21:05:29	
Sakharov Prize: Belarus' opposition wins EU human rights award	20	2	2020-10-22 15:52:39	
Scientists find new organ in throat while testing for prostate cancer | World News	17	12	2020-10-22 14:16:33	
Hundreds rally in support of Estonia's LGBT community	21	4	2020-10-22 11:37:38	
Coronavirus spreads in Nagorno-Karabakh as Azerbaijan attacks the region	20	3	2020-10-22 07:00:49	
Met police apologise over errors in racist attack investigation | Metropolitan police	20	1	2020-10-21 22:05:16	
Turkey says it will send troops to help Azerbaijan if requested	19	9	2020-10-21 22:01:04	
Gunmen take up to 20 hostage in Georgian bank, demand $500,000	19	5	2020-10-21 17:26:28	
Nigeria protesters break curfew amid gunfire, chaos in Lagos	19	1	2020-10-21 15:07:41	
Thailand protests: court orders news outlet to close as PM accuses it of 'inciting unrest'	17	3	2020-10-21 13:59:35	
Taiwan upset at U.S. for the inclusion of Taiwan-caught fish in its list of goods produced by forced labor	19	0	2020-10-21 07:39:05	
Person from Victoria (Australia) catches COVID-19 for a second time	20	3	2020-10-21 04:44:39	
European trade unions start action for More Democracy at Work	19	5	2020-10-21 00:24:39	
India's dreaded pollution season has returned as air quality in the capital Delhi and other northern cities rapidly deteriorated in the last two weeks.	21	6	2020-10-20 20:36:51	
EU launches legal action against Malta, Cyprus over ‘golden passports’	18	1	2020-10-20 17:49:23	
No tsunami threat to B.C. after 7.5-magnitude earthquake in Alaska	19	0	2020-10-20 03:02:41	
Pakistan reverses TikTok ban after only 10 days	19	7	2020-10-19 23:00:15	
North Korean detainees are treated as 'less than animals,' report alleges	17	2	2020-10-19 13:58:12	
Vaccine storage issues could leave 3B people without access	21	4	2020-10-19 12:50:53	
Chile protests turn violent on anniversary	19	1	2020-10-19 08:05:25	
Protests in Chile turn violent with church set on fire and police using tear gas	19	0	2020-10-19 07:34:40	
Senior PLO official Erekat taken to hospital after COVID-19 condition worsens	21	1	2020-10-19 03:27:26	
Turkish president questions French president’s mental health: ‘We are not accepting insults'	19	5	2020-10-25 01:20:54	
Polish president Andrzej Duda tests positive for Covid-19	22	3	2020-10-25 00:09:37	
Prince Charles wrote to support historic Australian PM sacking - reports	19	13	2020-10-24 12:41:44	
Europe warned COVID spreading more quickly, further curbs loom	17	1	2020-10-23 19:36:42	
Chile prepares for charter referendum | Voters to decide fate of dictatorship-era constitution drawn up four decades ago	18	0	2020-10-23 18:25:32	
Warring Libya rivals sign truce but tough political talks ahead	17	0	2020-10-23 18:00:51	
Police arrest six alleged murderers of journalist in West Sulawesi	18	0	2020-10-23 09:55:03	
Cuba says U.S. sanctions have caused nearly $5.6 billion in losses	19	10	2020-10-23 01:55:07	
Sudan premier ready for Israel ties if parliament approves	17	2	2020-10-22 20:45:03	
Four newborn babies die in South Australia after being denied lifesaving medical care due to travel restrictions	20	2	2020-10-21 21:42:48	
UK Allocated £450,000 To Opponents of Venezuela's Government | The British funding's beneficiaries have been promoting 243 projects whose details remain hidden from the public. The results of their actions, however, are reported quarterly to the U.K.embassy in Caracas.	20	1	2020-10-21 20:59:20	
Air pollution in India caused over 116,000 infant deaths in 2019: Study	19	1	2020-10-21 15:22:23	
Amnesty: Credible reports protesters shot dead in Nigeria	19	3	2020-10-21 12:18:11	
Aeroflot Airlines crew members suspected of helping smuggle $50 million worth of stolen iPads, iPhones, and more into Russia	18	5	2020-10-20 19:43:30	
UK festival not returning to Abu Dhabi over sexual assault claims | Middle East	18	2	2020-10-20 09:23:34	
South Korea Eases Coronavirus Restrictions, Touts 'Exceptional' Success	17	2	2020-10-19 23:06:10	
U.S. military defends air strikes that Taliban says violate troop pact	19	3	2020-10-19 17:14:35	
Japan, Vietnam reach broad agreement on transfer of defence gear	18	3	2020-10-19 09:55:43	
Large 2,000-year-old cat discovered in Peru&#x27;s Nazca lines	14	2	2020-10-19 04:58:52	
Guinea votes as president seeks to extend decade in power	16	1	2020-10-19 01:16:54	
Dozens of far-right protesters in Rome clashed with riot police during a demonstration against the curfew early Sunday, as Italy's government prepared to tighten coronavirus restrictions further. Some 200 masked militants belonging to neo-fascist group Forza Nuova hurled projectiles at police	31	5	2020-10-25 09:13:47	
Prince Charles's letter to John Kerr reportedly endorsing sacking of Whitlam condemned	17	4	2020-10-24 20:37:42	
Afghan bombing: Kabul education centre attack kills at least 13	18	1	2020-10-24 19:36:11	
Blast in Kabul	17	3	2020-10-24 18:24:04	
Czech Republic health minister forced to resign after breaking his own lockdown measures.	17	2	2020-10-23 17:26:16	
Free on bail, prominent Thai protest leader pledges to keep up campaign	17	1	2020-10-23 17:18:49	
Coronavirus: France puts 46 million under night curfew	18	2	2020-10-23 15:29:28	
SpaceX Starlink internet seeks final approvals to serve Australia	15	5	2020-10-23 00:23:10	
Rights group condemns Egypt’s mass executions	18	1	2020-10-23 00:21:18	
Arab Video Blogger Blasts Al Jazeera for Spreading 'Fake News' About Him and Israel	16	5	2020-10-22 01:59:43	
Afghanistan: Many killed and wounded in visa stampede	17	2	2020-10-21 13:14:52	
Nasa's Osiris-Rex probe touches asteroid Bennu in sample bid	17	1	2020-10-21 02:26:16	
India criticized by UN human rights chief for stifling freedoms	19	5	2020-10-21 01:05:26	
Second Temple period jars and complete clay objects unearthed in Beit El	16	2	2020-10-21 00:49:40	
Iron Dome shoots down rocket from Gaza hours after terror tunnel discovered	14	8	2020-10-21 00:47:57	
Scientists Identify the Smallest Amount of Time- Zeptosecond	17	27	2020-10-20 17:24:40	
Climate finance driving poor countries deeper into debt, says Oxfam | Countries that did least to cause crisis having to take loans to protect themselves, says charity	19	1	2020-10-20 16:45:26	
Venezuela's PDVSA to offload crude from idled floating facility, The Nabarima, amid environmental concerns.	17	5	2020-10-20 03:30:33	
China has history of 'observing' Taiwan National Day events: ex-diplomat	17	0	2020-10-19 22:36:54	
Singapore's world-first face scan plan sparks privacy fears	16	6	2020-10-19 21:14:49	
Iran hails lifting of 13-year UN arms embargo as ‘momentous day’. Immediate shopping spree is unlikely after end to military sanctions despite US protests.	17	1	2020-10-19 10:40:18	
Funding for Rohingyas dwindles amid pandemic	17	5	2020-10-19 05:01:12	
Erdogan attacks Macron over Islam	14	8	2020-10-24 21:20:20	
President Diaz-Canel condemns new US measures on remittances to Cuba	19	3	2020-10-24 18:38:00	
Trump suggests Egypt may 'blow up' Ethiopia dam	15	32	2020-10-24 09:32:29	
UK presses for use of faster passport gates at EU airports post-Brexit	18	18	2020-10-23 23:56:13	
'At least five more' Middle East countries to sign peace deals with Israel, Trump says	18	27	2020-10-23 22:32:14	
Protesters gather across Poland after court curbs abortion rights	15	0	2020-10-23 22:18:09	
Human Rights Watch Accuses Azerbaijan of Using Banned Cluster Bombs Targeting Civilian Areas	17	2	2020-10-23 22:09:03	
EU, UK slap sanctions on Russian spies for hacking German parliament	14	2	2020-10-23 09:51:54	
Facebook admits to incorrectly labeling #EndSARS content as misinformation	14	3	2020-10-23 01:55:18	
"U.S. national security adviser says China too tried to hack election, China said it ""doesn't interfere"""	18	2	2020-10-22 20:15:13	
Russia, U.S. global dominance in the past, says Putin	15	10	2020-10-22 20:09:52	
Poland abortion: Top court rules in favour of almost total ban	16	1	2020-10-22 18:52:54	
Australia aged care: Inquiry hears 50 sexual assaults happen each week	15	0	2020-10-22 12:03:04	
AstraZeneca Covid-19 vaccine trial volunteer dies: Brazil	14	13	2020-10-22 00:17:57	
U.S. Broadens Sanctions On Russia-Led Nord Stream 2 Pipeline.	16	1	2020-10-21 19:10:05	
Nigerian forces accused of killing anti-police brutality protesters	17	0	2020-10-21 17:47:59	
Russia planned cyber-attack on Tokyo Olympics, says UK	16	11	2020-10-19 21:08:05	
India army apprehends Chinese soldier amid military standoff	16	1	2020-10-19 18:50:46	
Half of Indians may have had coronavirus by February, government panel estimates	15	1	2020-10-19 15:45:43	
Crown Resorts: Australian casino operator faces laundering probe	16	2	2020-10-19 12:22:41	
Churches burnt as Chile anniversary rallies turn violent	15	2	2020-10-19 06:52:54	
Italy plans further curbs as coronavirus cases hit new record	22	1	2020-10-25 11:06:43	
'Eating rats': Myanmar's second lockdown drives hunger in city slums	27	7	2020-10-25 09:09:58	
Taliban Kills at Least 23 Afghan Soldiers in Latest Attacks	18	9	2020-10-25 04:11:15	
Worldwide coronavirus cases cross 42.36 million, death toll at 1,145,740	18	7	2020-10-25 02:14:52	
Cameroon: Children killed in attack on school in Kumba	18	3	2020-10-25 00:02:34	
Austrian coronavirus cases rise by a record 3,614 infections	18	1	2020-10-24 22:32:06	
Oreo stashed its cookies in a doomsday vault in preparation for the 'Election Day asteroid'	11	9	2020-10-24 14:41:28	
Nigerian president acknowledges 'many lives' lost but doesn't mention shootings by soldiers	17	0	2020-10-24 01:02:09	
Italy mulls extending special powers to block takeovers from EU companies	15	1	2020-10-23 18:23:33	
Kamchatka: Toxic algae blamed for mass marine death in Russia	17	2	2020-10-23 15:31:25	
Indja continues to block Kashmir press, seizes office of oldest daily paper	14	1	2020-10-23 14:06:09	
Israeli, Sudanese officials confirm talks in Khartoum, say normalization near	15	1	2020-10-23 04:53:34	
Conservative MP quits government job over free school meals	16	9	2020-10-22 14:00:32	
Taiwan says not seeking arms race with China after new U.S. arms sale	14	3	2020-10-22 11:07:37	
'McCarthyism' or 'to the point'? Australia's Chinese communities divided over Senator Abetz controversy	17	18	2020-10-22 00:10:42	
Canada PM Trudeau set to survive as New Democrats vow to avoid election	16	9	2020-10-21 21:51:45	
Elation as Nasa's Osiris-Rex probe tags asteroid Bennu in sample bid	14	2	2020-10-21 12:03:42	
China's billionaires see biggest gains ever	16	6	2020-10-21 08:47:08	
Nine Persons Reportedly Killed As Security Operatives Open Fire On Peaceful Protesters In Lagos	16	0	2020-10-21 00:17:06	
Danish submarine killer briefly escapes from prison	15	6	2020-10-20 21:34:19	
New name for a Canadian town called Asbestos	16	13	2020-10-20 18:52:36	
New Zealand's GCSB Minister Andrew Little surprised by 'shout out' to NZ over indictment of alleged Russian hackers	15	2	2020-10-20 10:54:27	
Argentina is 5th nation to pass 1 million coronavirus cases	15	2	2020-10-20 04:10:23	
UK refuses to restart Brexit talks despite EU accepting its demands	14	10	2020-10-20 02:37:03	
"Armenian leader accuses Israel of aiding 'genocide' against his people: Arayik Harutyunyan, the Armenian leader of the disputed Nagorno-Karabakh region, says Israeli authorities ""are also responsible for this genocide""."	17	14	2020-10-19 23:45:29	
Japan To Release Radioactive Fukushima Water Into Ocean	17	34	2020-10-19 20:21:43	
Global coronavirus cases surpass the 40 million milestone	13	3	2020-10-19 11:32:16	
Large 2,000-year-old cat discovered in Peru's Nazca lines	16	8	2020-10-18 23:39:09	
Eritrea shifts course on Egypt-Ethiopia dispute over Nile dam | a change of position in Eritrea, which had always backed Egypt in the Nile dam issue	19	2	2020-10-25 02:23:35	
Poland will convert Warsaw stadium into temporary COVID-19 hospital	15	0	2020-10-24 21:19:51	
Killing darkens shadow over France’s teachers	11	4	2020-10-24 11:09:00	
Britain and Japan sign post-Brexit trade deal	16	13	2020-10-23 15:39:06	
U.S. Secretary of State Mike Pompeo will visit Indonesia next week, his first trip to the country since its leadership rejected a U.S. proposal to host its spy planes.	15	9	2020-10-23 14:25:54	
18-year-old arrested on suspicion of plotting to attack Tel Aviv protesters	14	0	2020-10-23 07:03:32	
Two rockets fired from Gaza at Ashkelon, one intercepted; no injuries	13	0	2020-10-23 00:50:15	
Polish court ruling amounts to almost total ban on abortion	15	1	2020-10-22 22:18:44	
Polish court outlaws almost all abortions	15	5	2020-10-22 21:06:14	
Study finds AstraZeneca's COVID-19 vaccine follows genetic instructions programmed into it by its developers to successfully provoke a strong immune response, according to a detailed analysis carried out by independent UK scientists.	12	4	2020-10-22 19:00:54	
Taiwan says not seeking arms race with China after new U.S. arms sale	13	2	2020-10-22 08:29:22	
"COVID-19 Spreads in Nagorno-Karabakh Amid Heavy Fighting. Local Resident Claims ""We Just Don’t Have Time to Think About Coronavirus.”"	15	7	2020-10-21 20:55:46	
Pakistan army to probe opposition allegation of pressuring police. The arrest of former Prime Minister Nawaz Sharif’s son-in-law Muhammad Safdar earlier this week turns into a major political controversy.	16	1	2020-10-21 20:30:23	
Thai PM says to lift emergency amid protests	15	1	2020-10-21 17:02:44	
Sen. Markey Says ‘No Choice But to Recognize Artsakh’ Since Baku Continues ‘Illegal Use of Force’	14	0	2020-10-21 09:39:46	
Macron urges Russia to boost anti-Terror fight	14	1	2020-10-21 09:10:59	
Nigerian military opens fire on peaceful protesters in Lagos #EndSARS protests were subdued with violent tactics	16	2	2020-10-21 06:58:03	
Soldiers open fire on Nigerian protesters in Lagos: witnesses	15	2	2020-10-21 02:19:58	
Applications open to supply France with free medical cannabis via pilot program	14	3	2020-10-21 00:10:11	
In a world mired in recession, China manages a V-shaped recovery	13	19	2020-10-20 18:08:00	
