title	score	num_comm	created	contentSix Nations members expand road blockades around land reclamation camp in Caledonia, Ont. | A skirmish between some members of Six Nations and the OPP on Thursday afternoon by the back entrance to 1492 Land Back Lane led camp members to move to establish control over road and highway access points	48	13	2020-10-24 18:40:31	
Seven bodies found in fertilizer shipment from Serbia to Paraguay	54	8	2020-10-24 14:58:31	
Police arrest demonstrators at Melbourne protest against coronavirus lockdown restrictions	51	5	2020-10-23 09:30:28	
NASA makes history with sample of asteroid soil	46	5	2020-10-21 12:02:35	
Coca-Cola, McDonald's, Asahi and Tesla – international giants hold on to New Zealand Covid-19 wage subsidies	51	9	2020-10-20 19:04:28	
Nokia Wins NASA Contract Worth $14.1 Million To Set Up 4G Network On Moon	49	32	2020-10-20 15:09:15	
6 Russian military officers charged in vast hacking campaign	51	1	2020-10-20 01:27:56	
U.S. signs international declaration challenging right to abortion and upholding ‘role of the family’	47	32	2020-10-23 08:46:17	
Copenhagen Mayor Resigns Amid #MeToo Wave in Denmark	45	2	2020-10-23 00:13:55	
Pope endorses same-sex civil unions in new documentary film	51	9	2020-10-21 18:32:58	
EU plans to shut door to travel from Canada, sources say	50	15	2020-10-21 06:47:40	
U.S. charges Russian hackers with sweeping campaign of cyberattacks	50	8	2020-10-19 22:33:06	
U.S. military defends air strikes as Taliban warns of 'consequences'	46	17	2020-10-19 06:31:56	
Covid Puts a Spotlight on the Food Industry’s Role in Obesity	50	4	2020-10-22 10:58:56	
Russia Shot-Down A Total Of Nine Turkish Bayraktar Drones Near Its Armenia Military Base	45	6	2020-10-22 10:26:57	
U.S. tries to get Huawei blocked from Brazil's 5G networks with $1 billion financing pledge	47	3	2020-10-21 14:56:23	
Turkish central bank to hike rates 175 points to 12% amidst double-digit inflation and a record-low lira.	50	5	2020-10-19 22:54:54	
Poland's President Duda tests positive for coronavirus	45	5	2020-10-24 15:36:48	
French McDonalds employees give ‘chilling’ testimonies of discrimination and harassment	49	2	2020-10-23 19:24:54	
Trump administration notifies Congress of $1.8B in proposed weapons sales to Taiwan	43	1	2020-10-22 08:31:06	
Palestinians Accuse Sudan of 'Betrayal' for Israel Peace Deal	49	5	2020-10-24 03:06:16	
Holland releases 5,000 fleas to solve knotweed problem	43	14	2020-10-23 17:32:04	
Saudi women's summit accused of 'whitewashing' record on rights	45	3	2020-10-22 01:44:38	
Indonesia rejected US request to host spy planes	48	9	2020-10-21 08:02:27	
Farmers ask EU parliament to ban terms such as 'veggie burger'. Farmers say the measures are needed to protect consumers from being misled.	45	34	2020-10-19 21:19:47	
The UK has given training and support to Nigerian security forces, condemned for their brutal crackdown of protesters in recent weeks, The Independent can reveal.	46	1	2020-10-23 20:16:22	
Takata SEATBELTS may be faulty too, following airbag recall.	45	6	2020-10-23 12:40:30	
Germany Under Pressure to Take Sides in Nagorno-Karabakh Conflict Between Azerbaijani and Armenian Forces	42	22	2020-10-22 21:59:20	
Sudan will normalize ties with Israel	45	9	2020-10-22 11:11:49	
Demanding Investigation, Amnesty International and UN Official Condemn Killing of #EndSARS Protesters by Nigerian Forces	41	1	2020-10-22 07:34:41	
Wales to impose two-week deep firebreak: 'everyone must stay at home'	45	5	2020-10-19 20:38:10	
EU countries sound alarm about growing anti-5G movement: Updated figures from telecom industry lobby group GSMA showed there had been 221 arson attacks across 18 countries globally so far, with the U.K. (87), France (50) and the Netherlands (30) being most heavily hit	43	23	2020-10-19 20:10:31	
Thai protesters plan action after PM ignores deadline to quit	49	6	2020-10-25 02:03:43	
Epidemic of violence': Bangladesh approves death penalty for rape, but experts say crisis remains	46	5	2020-10-24 09:53:35	
North Korea says China dust could spread COVID-19, warns people to stay inside	45	12	2020-10-24 08:59:25	
Morgan Stanley expects SpaceX will be a $100 billion company thanks to Starlink and Starship	45	20	2020-10-23 10:33:25	
Asia suffering 'worst recession in living memory'	44	9	2020-10-22 14:22:38	
UK says China seeking biggest maritime fleet in the world	43	26	2020-10-21 18:46:12	
EU ministers to agree to make climate neutrality by 2050 binding	48	7	2020-10-21 05:09:29	
Armenia-Azerbaijan ceasefire proves short-lived again	46	10	2020-10-18 23:32:20	
114 dead, 21 missing in central Vietnam’s floods, landslides	39	1	2020-10-22 21:03:05	
Spain is first western European country to pass 1m Covid cases	47	2	2020-10-21 21:41:57	
Looters raid Nigeria food warehouse as unrest spreads	64	8	2020-10-25 06:55:42	
UN nuclear ban treaty to go into effect in 90 days	68	16	2020-10-25 06:09:45	
US calls Chinese visa offenders spies without showing evidence.	43	10	2020-10-24 03:05:49	
US sanctions Russian government institution tied to Malware	42	0	2020-10-24 02:31:47	
Goldman Sachs to pay $3bn over 1MDB corruption scandal	45	6	2020-10-22 23:06:08	
Spanish government considering nationwide state of alarm to implement a curfew	40	1	2020-10-22 13:18:48	
Taiwan official details China’s plan to solve Taiwan ‘problem’ by 2049: US military journal	41	9	2020-10-22 00:45:14	
"Bumblebees exposed to levels of radiation found within the Chernobyl exclusion zone suffered a ""significant"" drop in reproduction, in new research published Wednesday that scientists say should prompt a rethink of international calculations of nuclear environmental risk"	41	0	2020-10-21 17:35:43	
Thousands of retirees march in Belarus demanding Lukashenko’s resignation	39	5	2020-10-19 23:53:33	
Large 2,000-year-old cat discovered in Peru's Nazca lines	45	11	2020-10-19 20:49:52	
Over a dozen whales die after getting stranded on New Zealand beach	43	2	2020-10-19 15:05:25	
Islamic State calls on its fighters to target westerners in Saudi Arabia	42	9	2020-10-18 22:39:31	
18 dead, 57 wounded in suicide bombing at education centre in Afghanistan: officials	41	2	2020-10-24 23:58:51	
Fears mount as South Korea probes cause behind 36 people's deaths after flu vaccination	44	8	2020-10-24 07:26:01	
Poland's top court rules against abortions due to fetal defects	41	19	2020-10-23 01:20:58	
Greece asks EU to consider suspending customs union with Turkey	39	3	2020-10-20 21:28:18	
Thai authorities seek to censor coverage of student protests	38	1	2020-10-20 04:47:41	
Coronavirus: Germany bars entry to young au pairs	45	0	2020-10-19 19:08:03	
Germany, Spain, Italy, Hungary and Malta Blocked EU Sanctions Against Turkey	41	32	2020-10-19 18:57:32	
Police disperse fourth anti-lockdown march in London	44	3	2020-10-25 00:16:58	
Germany virus death toll passes 10,000: health institute	45	12	2020-10-24 21:15:29	
Vatican extends secretive deal with China on appointing bishops	45	4	2020-10-23 15:36:46	
France becomes 2nd Western European country to top 1M coronavirus cases	40	3	2020-10-22 20:29:17	
At least 12 civilians have been killed in an air strike on a religious school in northern Afghanistan. Officials said the strike on the village killed 11 children and their prayer leader. The Afghan government disputed the account, saying it had killed 12 Taliban fighters in the village.	44	7	2020-10-22 15:31:54	
Belgian foreign minister Wilmès in intensive care for Covid-19	39	1	2020-10-22 13:10:58	
Magazine reporter beaten by police inside Delhi police station | Reporters without borders	40	1	2020-10-22 01:09:43	
Belgium facing 'tsunami' of Covid infections, health minister says	43	1	2020-10-19 14:14:22	
Chinese diplomatic gatecrash incident alleged at Taiwan event in Suva, Fiji	38	6	2020-10-19 04:59:15	
Gunmen storm school in Cameroon, killing at least six children	42	8	2020-10-25 01:29:24	
MEPs accused of turning European agricultural policy into ‘extinction machine’	39	2	2020-10-24 16:16:19	
Goldman Sachs unit pleads guilty in Malaysian bribery case	39	1	2020-10-24 13:53:10	
Over 100 Dead as Vietnam is Hit With Most Severe Flood in Decades	38	1	2020-10-24 13:52:26	
Russia Continued Developing Novichok After Program's Official Closure, Investigation Says	43	2	2020-10-24 13:34:50	
Fatal poisoning of pair of peregrine falcons in North Yorkshire sparks police appeal	38	3	2020-10-22 21:14:15	
France teacher attack: Seven people to attend court over Samuel Paty's death	40	1	2020-10-21 13:14:30	
Beheaded Teacher To Posthumously Get France’s Highest Honor	39	5	2020-10-20 17:38:06	
Chinese scramble for Thailand's new special tourist visa	40	5	2020-10-20 12:12:17	
6 Russian military officers charged with a worldwide cyber attack	38	1	2020-10-19 23:15:42	
Senior al-Qaeda leader Abu Muhsin al-Masri killed in Afghanistan	55	13	2020-10-25 06:47:59	
Thailand protests snowball as rattled royalists blame a hidden foreign hand	37	3	2020-10-24 04:17:35	
Samuel Paty: French teacher's beheading directly linked to social media campaign, say prosecutors	35	2	2020-10-21 22:09:02	
Chile anniversary rallies turn violent as churches burned, police fire tear gas	37	0	2020-10-21 20:36:03	
Dozens killed and more wounded in peaceful protests by government forces in Nigeria	34	11	2020-10-21 05:42:42	
Kenya Sees New Surge of Coronavirus After Easing Restrictions	39	2	2020-10-20 03:39:01	
UN: Nuclear weapons ban treaty to enter into force	55	14	2020-10-25 04:54:21	
Afghanistan: 13 people killed, 30 injured in a suicide bomb attack outside an educational centre in Kabul	34	2	2020-10-24 18:29:49	
"China calls Russia's talk of possible military alliance ""positive"""	36	43	2020-10-24 02:25:01	
Fukushima: Contaminated water could damage human DNA, Greenpeace says	38	24	2020-10-23 15:32:41	
Golden passports': EU launches legal action against Cyprus and Malta	37	12	2020-10-21 23:02:48	
Chile puts its constitution on the ballot after year of civil unrest	41	1	2020-10-21 01:48:30	
Conjoined twins return home after successful separation	34	8	2020-10-20 13:33:58	
Thai authorities seek to censor coverage of student protests	36	2	2020-10-19 17:02:54	
Chile anniversary rallies turn violent as churches burned, police fire tear gas	39	2	2020-10-19 15:08:48	
Taiwan says diplomat sent to hospital after China spat in Fiji	35	5	2020-10-19 08:32:41	
Iran Announces Its COVID-19 Death Toll Passes 30,000	35	3	2020-10-19 07:22:07	
ISIS spokesman slams normalization with Israel and tells Muslims to attack oil pipelines in Saudi Arabia	35	11	2020-10-18 22:44:11	
France recalls envoy to Turkey after Erdogan questions Macron’s mental health	39	18	2020-10-24 21:25:44	
Asteroid samples leaking from jammed NASA spacecraft. The requirement for the $800 million-plus mission was to bring back a minimum 60 grams.	38	37	2020-10-24 13:14:56	
Far-right Vox party fails to get any other MPs to support no-confidence vote	36	0	2020-10-23 20:59:50	
French government blocks U.S. LNG deal as too dirty	35	2	2020-10-22 19:19:13	
Soldiers open fire on Nigerian anti-police brutality protesters in Lagos: witnesses	36	4	2020-10-21 02:47:23	
China says U.S. should stop meddling after exiled Tibetan leader visits State Department	33	41	2020-10-20 16:22:41	
Egypt says another trove of 80 ancient coffins found in Saqqara	33	7	2020-10-19 23:01:54	
Liberals and Greens win last two Australian Capital Territory election seats as Electoral Commissioner announces final results	36	0	2020-10-24 03:51:03	
China warns UK not to offer citizenship to Hong Kong residents	34	4	2020-10-23 14:42:48	
45 lawmakers urge US to boycott Saudi-hosted G20	31	5	2020-10-22 11:06:22	
The Canadian government is gearing up to review the effects legalizing cannabis has had on the country.	36	18	2020-10-21 18:02:00	
Policemen Open Fire On EndSARS Protesters In Abia State, Nigeria (Video)	32	0	2020-10-21 17:19:16	
Indonesia rejected US request to host spy planes	34	1	2020-10-20 15:35:40	
Dutch hospital airlifts patients to Germany amid virus surge	33	8	2020-10-25 01:54:52	
Johnson will wait for US election result before no-deal Brexit decision	35	23	2020-10-25 01:28:31	
China and Germany heading for superpower status as U.S. influence wanes, says Putin	35	40	2020-10-22 23:13:21	
Thailand lifts protest ban that backfired	34	1	2020-10-22 17:33:26	
Germany: Dresden knife attack likely motivated by Islamic extremism	36	9	2020-10-22 09:42:10	
European lawmakers call for release of Egypt's political prisoners	35	3	2020-10-22 00:41:34	
German health minister tests positive for COVID-19	38	0	2020-10-21 20:24:30	
Anger erupts in Iraq after mother throws children off bridge	35	5	2020-10-21 15:15:24	
Canadian town of Asbestos chooses new name	33	21	2020-10-20 23:48:39	
Philippine president Rodrigo Duterte has said he has no problem with being held responsible for the thousands of killings under his government’s war on drugs, adding that he was ready to face charges that could land him in jail, though not charges of crimes against humanity.	32	4	2020-10-20 15:03:19	
Canada-China spat heats up over ambassador's alleged threat	31	14	2020-10-20 08:07:12	
Japan to support the United Kingdom joining the Trans-Pacific Partnership	34	7	2020-10-19 19:13:00	
Azerbaijan claims 'full control' of border with Iran	32	34	2020-10-24 20:35:15	
Iran successfully launches homegrown missile defence system during military exercise	31	5	2020-10-23 11:15:02	
Putin Says Karabakh Conflict Started with ‘Brutal Crimes’ against Armenians	29	2	2020-10-23 09:41:47	
14 jihadists killed in US drone strike in Syria	34	5	2020-10-23 07:01:57	
Prison set on fire in Nigeria as protest death toll rises to at least 56	30	1	2020-10-22 23:00:42	
Chinese Army soldier captured in Ladakh's Demchok, was carrying military documents	35	4	2020-10-19 13:00:08	
E.U. Debates Whether a Veggie Burger Is Really a Burger	34	43	2020-10-23 13:06:37	
Azerbaijan: Cluster Munitions Used in Nagorno-Karabakh	32	7	2020-10-23 10:38:09	
Azerbaijan and Armenian: Nearly 5,000 dead in conflict, Putin says	35	10	2020-10-22 23:03:13	
Eyewitnesses report Nigerian armed forces open fire at protesters during anti-brutality protests in Nigeria	30	1	2020-10-21 22:11:16	
German Health Minister Jens Spahn tests positive for coronavirus	35	2	2020-10-21 21:52:26	
As U.S. presidential election enters final days, Canada braces for the fallout	32	19	2020-10-21 13:37:30	
Instagram investigated over alleged illegal processing of children's data	34	1	2020-10-20 03:53:09	
Abu Dhabi Tolerance Minister accused of sexual assault on UK festival staff	32	4	2020-10-20 03:13:00	
China's economy continues to bounce back from virus slump	30	64	2020-10-19 13:50:20	
"Croatian law-enforcement officials accused of ""extremely abusive"" treatment against migrants. Testimonies reveals people were stripped naked and forced to lie like ""logs stacked on top of each other."""	32	4	2020-10-23 18:26:15	
Police brutality is just tip of the iceberg for protesters in Nigeria	31	1	2020-10-22 23:40:25	
France will extend an overnight curfew to dozens more areas in a bid to slow the spread of coronavirus, as the country announced a record 41,622 new cases. The 21:00 to 06:00 curfew will come into force at midnight on Friday, and some 46 million people will now be affected by the measure.	31	1	2020-10-22 23:03:49	
Submarine killer caught escaping from prison	29	11	2020-10-20 15:05:53	
Polish woman's quest for abortion exposes conflicted society	31	14	2020-10-20 01:29:12	
‘We’ve been suffering for a long time’: Migrant workers struggle as company delays payments for almost a year - Doha News	35	1	2020-10-19 12:59:32	
Thousands protest across Poland against curbs on abortion access	27	8	2020-10-24 07:05:59	
Seven bodies found in fertilizer shipment from Serbia to Paraguay	31	3	2020-10-24 01:27:48	
Europe’s Jewish population down 60% since 1970, as low as it was 1,000 years ago	29	26	2020-10-23 15:36:46	
Majority of Europe’s Species, Ecosystems in Poor Condition, Report Finds: European ecosystems and wildlife are in “serious, continuing decline” due to unsustainable farming and forestry, urban sprawl, and pollution, according to a new report from the European Environment Agency.	32	3	2020-10-22 20:25:38	
Protesters wanted change but Lebanon's elite picks veteran Saad Hariri to lead crisis-wracked country	30	1	2020-10-22 15:41:22	
New Record For The Shortest Time Span Measured: Zeptoseconds	31	7	2020-10-18 20:19:28	
UN says nuclear weapons ban treaty to enter into force in 90 days	40	17	2020-10-25 05:17:08	
Naples Riots Against Lockdown Threat, Record COVID-19 Cases In Italy	31	8	2020-10-24 19:18:50	
Microplastics ‘Abundant’ in Remote Polar Seas	27	1	2020-10-24 02:42:22	
Five bodies found in fertilizer shipment from Serbia to Paraguay	26	4	2020-10-24 02:05:38	
Nine weeks of bloodshed: how brutal policing of Kenya's Covid curfew left 15 dead | Global development	29	1	2020-10-23 13:25:33	
Afghanistan conflict: 'Children among dead' in air strike on school	25	1	2020-10-22 17:31:30	
Iran, Russia obtained voter registration info to sow confusion in presidential election, US officials say	29	4	2020-10-22 06:48:55	
Armenian leader sees no quick diplomatic solution in Nagorno-Karabakh	27	10	2020-10-21 22:56:31	
Police investigate attacks on antique artworks on Berlin's Museum Island	30	0	2020-10-21 17:21:07	
Vietnam faces deadly flooding disaster - Red Cross	31	1	2020-10-21 15:36:01	
Orionid Meteor Shower will dazzle stargazers worldwide this week with up to 25 shooting stars an hour flying across the sky on Wednesday	29	6	2020-10-21 03:50:07	
IDF destroys cross-border terror tunnel from Gaza	26	38	2020-10-20 15:38:30	
Covid: Wales to go into 'firebreak' lockdown from Friday	30	1	2020-10-19 15:59:06	
Zookeeper mauled by bears in Chinese wildlife park in front of horrified visitors	31	7	2020-10-19 13:27:50	
Polls close in Bolivia’s high-stakes presidential election	33	8	2020-10-19 06:00:34	
China threatens retaliation over US-Taiwan arms sale | China	26	11	2020-10-24 12:24:23	
Thailand protesters ratchet up pressure on prime minister to resign	29	1	2020-10-24 12:10:33	
Guatemala declares Hezbollah a terror organization	26	4	2020-10-23 23:16:39	
U.S. urges nations to withdraw support for U.N. nuclear weapons ban treaty	28	16	2020-10-22 12:53:48	
Plan to release Fukushima water into Pacific provokes furious reaction	31	8	2020-10-22 07:22:47	
US officials link Iran to emails meant to intimidate voters	27	2	2020-10-22 05:40:22	
China says environment still grim despite 5 years of progress	29	16	2020-10-22 00:31:02	
Thailand protesters call on prime minister to resign in three days	27	2	2020-10-21 21:33:38	
Brazil's Bolsonaro rejects plan to buy China's Sinovac vaccine; health minister tests positive	25	8	2020-10-21 20:52:38	
Army arrests soldier who appealed to colleagues ‘not to kill #EndSARS protesters’	28	7	2020-10-21 19:34:27	
Kemi Badenoch: 'the [UK] Government stand unequivocally against critical race theory...any school that teaches those critical race theory as fact, or partisan political views such as defunding the police without offering opposing views, is breaking the law'	29	15	2020-10-21 17:56:19	
UAE submits proposal to open an Embassy in Israel.	32	1	2020-10-20 19:34:24	
6 Russian military officers charged with a worldwide cyberattack	31	1	2020-10-20 01:05:11	
Police given access to details of people told to self-isolate by UK government's system	30	1	2020-10-18 23:10:07	
Armenia and Azerbaijan truce breaks down within hours	28	31	2020-10-18 20:17:44	
Uruguay: slashing funds is no way to thank scientists for COVID success	32	0	2020-10-25 04:31:47	
Macron comments provoke Mideast ire, boycotts of French goods - France 24	31	22	2020-10-25 02:40:02	
Top children’s doctors attack Tories over free school meals | Education	29	10	2020-10-25 02:02:01	
Italy Mulls Partial Lockdown as Cases, Hospitalizations Jump	28	2	2020-10-24 22:00:31	
U.S. to base Coast Guard cutters in western Pacific in response to China	27	8	2020-10-24 05:37:15	
Coronavirus surge pushes Czech Republic into 2nd lockdown	29	1	2020-10-23 20:56:52	
Rwandan court denies 'Hotel Rwanda' hero Rusesabagina bail, extends detention	29	1	2020-10-23 18:34:19	
North Korea claims 'yellow dust coming from China' could bring coronavirus	24	6	2020-10-23 17:22:14	
Finland considers EU to be a means to foster security	29	0	2020-10-23 10:31:40	
Poland rules abortion due to foetal defects unconstitutional	29	12	2020-10-23 01:34:13	
The U.S. is secretly helping the Taliban fight ISIS in Afghanistan	30	18	2020-10-22 23:29:09	
Thai protesters march in show of strength against government	29	0	2020-10-22 01:30:07	
Greek Navy Forms Protective Wall Off Kastellorizo to Counter Turkish Threat	24	7	2020-10-21 18:53:01	
China has been a graveyard for Western retailers. One by one, big brands have withdrawn | Business News	26	8	2020-10-21 14:11:29	
Danish submarine murderer Peter Madsen caught after escaping prison	28	6	2020-10-21 08:16:36	
NASA makes history with sample of asteroid soil	29	1	2020-10-21 03:57:52	
US Secretary of State Mike Pompeo to host meeting with foreign ministers of Armenia and Azerbaijan amid deadly clashes	27	5	2020-10-19 22:42:25	
Taiwan official in hospital after alleged 'violent attack' by Chinese diplomats in Fiji | World news	29	2	2020-10-19 22:40:05	
Tesla to export China-made Model 3 vehicles to Europe	28	12	2020-10-19 20:48:51	
New Zealand's Ardern credits virus response for election win	27	3	2020-10-18 20:37:48	
Afghan bombing: Schoolchildren among those dead in Kabul suicide attack	29	1	2020-10-25 00:11:48	
German police investigating ancient artefact vandalism in Berlin museums	26	6	2020-10-24 14:48:31	
US suspends visa services in Turkey over possible attacks	23	2	2020-10-23 20:06:01	
Quebec is using long-term care homes to house COVID-19 patients who aren't residents	28	7	2020-10-22 21:14:03	
Australian outback cattle station to house world's largest solar farm, powering Singapore | Environment	24	4	2020-10-22 07:47:50	
End Sars protests: People 'shot dead' in Lagos, Nigeria	28	0	2020-10-21 13:13:42	
Russia inspiring election violence.	25	1	2020-10-21 00:35:15	
Armenian Mayor of Desolated Nagorno-Karabakh Village Vows to 'Rebuild Everything'	23	14	2020-10-20 22:53:13	
Car bombing in western Afghanistan kills 13, wounds 120	25	1	2020-10-20 19:16:16	
Syria Demands Sanctions Relief, US Troop Pullout in Return for Help with American Captives	26	2	2020-10-20 18:39:33	
Russia planned cyber-attack on Tokyo Olympics, says UK	26	2	2020-10-19 21:07:16	
A year after disputed ballot, Bolivians return to polls, and ex-president Evo Morales looms large	27	2	2020-10-18 23:52:44	
NSW records third consecutive day with no locally transmitted coronavirus cases	34	2	2020-10-25 08:49:20	
Brazil Approves Import of China’s Sinovac Vaccine	22	8	2020-10-24 06:52:37	
Libyan factions sign countrywide UN-brokered cease-fire	25	2	2020-10-23 22:38:26	
Kim Jong-un’s wife disappears from public view amid 'fears for her health'	26	14	2020-10-23 02:25:13	
Britain confirms details of visa offer for some Hong Kong citizens	26	2	2020-10-22 19:02:47	
Innocent man arrested after letting paedophile use his wi-fi	26	10	2020-10-22 15:10:49	
Eyewitnesses say Nigerian forces shot at protesters in Lagos	27	0	2020-10-21 04:38:56	
In ‘Lobster War,’ Indigenous Canadians Face Attacks by Fishermen	24	5	2020-10-21 02:53:15	
Belgium may need to return to full COVID lockdown: virologist	25	1	2020-10-20 13:41:15	
Bolivia's Mesa concedes election	24	20	2020-10-20 02:21:00	
Cuba Announces Clinical Trials Of New COVID-19 Vaccine | The first phase of the trials aims to evaluate the safety and immunogenicity of different vaccine formulations and dosage schedules.	26	2	2020-10-19 20:07:06	
EU investigates Instagram over handling of children's data	25	1	2020-10-19 18:28:13	
The mayor of Rome has ordered an investigation after a family of wild boar were shot and killed by police in a children's playground.	24	15	2020-10-19 17:46:57	
Covid-19: Top Palestinian official Saeb Erekat taken to Israeli hospital	23	10	2020-10-18 21:24:50	
Free rent until 2021: 'Once in a lifetime' rental market price drop leads to crazy incentives	29	5	2020-10-24 20:34:41	
U.S. to attempt mediation between Armenia and Azerbaijan	25	8	2020-10-23 21:07:09	
Israel, Sudan agree on steps toward normalization of ties	27	0	2020-10-23 19:48:31	
Israel, Sudan agree on steps toward normalization of ties, announcement expected Friday: U.S. source	26	3	2020-10-23 19:09:56	
NASA’s OSIRIS-Rex Mission Touches The Surface Of Asteroid Bennu	22	2	2020-10-23 09:47:51	
Taiwanese to march in support of detained Hong Kong activists	25	0	2020-10-22 22:15:07	
Taiwan urges Vatican to focus on religious freedom in China	25	0	2020-10-22 21:58:13	
President of Armenia visits the NATO Headquarters Amid Heavy Fighting in Nagorno-Karabakh	23	5	2020-10-21 21:09:43	
Deaths feared as west London building collapses after explosion	22	4	2020-10-21 19:08:35	
Armenian president to talk with EU and NATO about Nagorno-Karabakh	23	0	2020-10-21 14:36:14	
Danish submarine killer Peter Madsen caught after breaking out of prison	26	14	2020-10-20 18:19:57	
Royal commission files reveal previously unseen details about abuse by priests	22	0	2020-10-20 18:05:03	
