title	score	num_comm	created	contentArmenian president: 'Turkey has a completely destructive role in Nagorno-Karabakh'	189	80	2020-10-19 21:36:27	
London anti-lockdown protests: Thousands of anti-vaxxers march through capital on day one of Tier 2	188	74	2020-10-19 01:28:14	
Iran says U.S.-brokered Sudan-Israel deal secured by 'ransom'	193	81	2020-10-24 17:47:17	
Veggie Burgers Can Be Called Burgers, European Parliament Says	219	36	2020-10-24 22:52:59	
South African environmental activist shot dead in her home | South Africa	188	7	2020-10-24 02:16:20	
France to shut pro-Hamas group after murder; Macron vows action on Islamists	184	20	2020-10-21 00:49:00	
'Uninhabitable hell': Climate change and disease threaten millions, UN warns | The last two decades saw the number of disasters caused by extreme weather nearly double to 6,681, up from 3,656 between 1980 and 1999	184	31	2020-10-20 16:35:36	
Australia to rejoin 'quad' naval exercises in move certain to infuriate Beijing	182	32	2020-10-19 19:56:06	
Poland abortion: Top court to rule on almost total ban	184	46	2020-10-22 16:06:55	
Tory MPs block plan to extend free school meals over holidays	183	32	2020-10-22 03:00:31	
Donors pledge $597m in humanitarian aid for Rohingyas	176	7	2020-10-23 04:50:11	
Italy vetoes 5G deal between Fastweb and China's Huawei: sources	170	3	2020-10-23 20:39:03	
12 million people in Britain will struggle to pay bills, watchdog says	168	18	2020-10-22 09:09:13	
Cuban economy has lost $144 billion due to US trade restriction	169	108	2020-10-24 10:51:17	
Sex abuse royal commission finds Catholic church failed to act against Brisbane brother over abuse complaints	167	5	2020-10-22 16:36:17	
Half of all work tasks will be handled by machines by 2025 in a shift likely to worsen inequality, a World Economic Forum report has forecast.	161	31	2020-10-21 11:30:20	
Danish submarine killer Madsen caught in prison escape	163	30	2020-10-20 15:25:45	
Chinese soldier apprehended by Indian Army in Ladakh	161	26	2020-10-19 13:34:38	
Philippine Duterte supports recognition of same-sex civil union	159	31	2020-10-23 17:14:38	
Coronavirus: Germany improves ventilation to chase away Covid	155	14	2020-10-19 17:51:45	
Worldwide coronavirus cases cross 41.99 million, death toll at 1,140,145	158	53	2020-10-24 08:17:26	
A Dozen Protesters in Nigeria Reported Killed by Security Forces	155	2	2020-10-22 20:29:09	
Tens of thousands march in Belarus despite firearms threat	153	1	2020-10-18 22:40:23	
Canada-U.S. border to remain closed until Nov. 21, at least	147	61	2020-10-19 23:54:21	
Ireland To Impose 6-Week National Lockdown, Estimates 150,000 Job Losses	150	26	2020-10-21 00:43:32	
Satellites are mapping out every tree on earth using AI technology	149	11	2020-10-22 21:12:55	
EU promises ‘significant economic support’ if Belarusian people win	145	28	2020-10-19 00:50:43	
Mouthwashes, oral rinses may inactivate human coronaviruses, study finds	145	57	2020-10-21 01:04:14	
Canada's Trudeau survives latest confidence vote	144	65	2020-10-22 01:43:46	
Suicide bombing at Kabul education centre kills 18	151	45	2020-10-24 23:46:51	
Czech Health Minister photographed without a face mask outside Prague restaurant, faces calls to resign	135	20	2020-10-23 14:57:54	
Unrest flares again in Lagos after civilians fired on in anti-police demonstrations	136	1	2020-10-21 23:08:31	
French President: ‘Immediate action’ on Isllamic terroriism	139	79	2020-10-19 18:12:43	
Canada breaks record for number of new COVID-19 cases in a single day	139	56	2020-10-23 10:38:33	
China threatens retaliation after new U.S. arms sales to Taiwan	136	34	2020-10-22 17:43:39	
China approves new law to protect whistleblowers and prevent epidemics	138	42	2020-10-18 21:14:47	
U.S. warns of potential terrorist attacks, kidnap plots targeting Americans and other foreigners in Istanbul	134	21	2020-10-24 07:35:48	
"China to US, ""Stop making China an issue in the election"""	135	103	2020-10-24 00:30:36	
India-China dispute: India hands over soldier who crossed border.	134	28	2020-10-21 11:40:23	
Nokia selected by NASA to build the first cellular network on the moon as the U.S. space agency plans for future lunar settlements. The network will give astronauts voice and video communications capabilities, allow data exchange, as well as control of lunar rovers and other robotic devices.	135	38	2020-10-20 19:51:47	
Coronavirus: No new cases of COVID-19 in New Zealand	230	30	2020-10-25 04:21:30	
The women who brought down Greece's Golden Dawn	136	11	2020-10-23 13:54:36	
Melting glaciers threaten catastrophic consequences for humanity	132	16	2020-10-19 09:03:52	
Refugees allege physical, sexual abuse by Croatian authorities	162	8	2020-10-25 02:01:30	
Ex-Burundi president gets prison term for 1993 killing of victorious election opponent -- The attack triggered a 10-year civil war in which about 300,000 people were killed.	129	5	2020-10-21 01:08:12	
Swelled by rain and COVID curbs, locust swarms ravage Ethiopia	131	9	2020-10-20 14:46:03	
Brexit: Drugs industry appeals to Boris Johnson for urgent action to avoid no-deal medicine shortages	129	27	2020-10-19 13:43:52	
DNA analysis to determine genetic impact of Japan's atomic bomb victims	133	40	2020-10-24 11:21:44	
OPEC Is On The Brink Of A Crisis due to low oil prices	124	25	2020-10-20 05:08:23	
Poland’s President Duda tests positive for coronavirus	125	10	2020-10-24 12:24:59	
Anti-Corruption Police Nabbed Brazilian Politician With $6077 Stuffed In His Underpants	120	8	2020-10-23 16:07:48	
Protests in Poland due to strict abortion ban	127	3	2020-10-23 01:59:51	
Covid-19: 'Major outbreak' at Christchurch (NZ) isolation facility housing dozens of international fishermen	125	17	2020-10-20 06:52:44	
Armed militia groups control more than half the territory of Rio de Janeiro, installing a reign of terror in poor neighborhoods that are home to nearly 2.2 million people, according to a study published Monday	123	9	2020-10-20 02:00:41	
100,000+ Humans Displaced By Historic Vietnam Flooding	121	5	2020-10-21 19:34:46	
Russia’s COVID-19 Deaths Could Be The Worst In Europe, Death Numbers Need to be Tripled, Ex-State Demographer Warns	122	19	2020-10-21 00:58:23	
Archaeologists find huge 2,000-year-old cat image carved into Peru hillside	121	15	2020-10-20 01:47:15	
"Nearly One Year After 2019 'Right-Wing Coup,' Bolivians Head to the Polls for National Elections. ""It is very important that each and every one of us calmly wait for each and every vote to be counted,"" said Evo Morales, the nation's ousted democratically-elected leader, from exile in Argentina."	120	10	2020-10-18 20:50:41	
Attackers storm Cameroon school, kill several children	150	34	2020-10-25 02:58:05	
Asbestos, a Canadian Mining Town, Votes to Detoxify Its Name	123	16	2020-10-21 16:38:07	
France shuts Paris mosque in crackdown after teacher's beheading	120	12	2020-10-20 22:57:35	
Plans to seal records of Irish mother and baby homes draw concern and criticism	122	6	2020-10-23 11:30:33	
Trump announces that Israel and Sudan have agreed to normalize relations	118	39	2020-10-23 21:01:22	
Slovakia to test whole country for coronavirus	118	8	2020-10-18 20:58:32	
Taiwan charges Chinese fishing boat captain with the murder of four suspected Somali pirates	118	48	2020-10-20 21:39:50	
France: Head of pro-Hamas group and parent put fatwa on beheaded French teacher	116	13	2020-10-19 14:38:24	
New coronavirus restrictions in Europe; Merkel warns of hard days	115	7	2020-10-18 23:58:12	
Norway funds satellite map of world's tropical forests	115	4	2020-10-23 21:07:01	
French paper La Nouvelle Republique threatened after publishing Mohammad cartoons	114	12	2020-10-21 19:25:30	
Satellite images indicate Russia is preparing to resume testing its nuclear-powered cruise missile	115	24	2020-10-20 19:58:53	
Australia Bans Imports Of Hentai And Adult Anime Products From Japan	117	50	2020-10-23 01:05:57	
France beheading: Minister wants to dissolve Islamic NGOs after murder of teacher Samuel Paty	108	136	2020-10-19 18:42:54	
French dairy giant accused of polluting country's famous rivers for years	112	10	2020-10-23 19:59:44	
Greek court imprisons far-right Golden Dawn party leadership	110	7	2020-10-22 14:54:40	
US Air Force Confirms One Of Its RC-135W Spy Planes Flew Over Taiwan	111	25	2020-10-23 06:19:36	
EU awards human rights prize to Belarus opposition	111	5	2020-10-22 14:47:25	
Boris Johnson still refusing to restart Brexit negotiations despite ticking no-deal clock	104	30	2020-10-21 17:06:22	
Crown chairman Helen Coonan admits casino 'facilitated' money laundering	102	6	2020-10-20 16:34:29	
France surpasses 1 million confirmed virus cases amid spike, including 42,032 new cases reported in the past 24 hours	105	20	2020-10-23 23:15:22	
At least 11 women have been killed and many more injured in a stampede in a stadium in Afghanistan where people were applying for visas, officials say.	107	22	2020-10-21 14:42:58	
China approves new law to protect whistleblowers and prevent epidemics	101	32	2020-10-19 12:28:07	
Polluted air killing half a million babies a year across globe	101	9	2020-10-22 16:38:07	
Former government lawyer ‘ashamed’ of defending UK over Saudi arms sales	104	7	2020-10-21 23:48:36	
EU & UK Announce Sanctions Against Russian Officials Over Alexey Navalny Poisoning.	100	5	2020-10-18 23:00:46	
Farmers ask EU parliament to ban terms such as 'veggie burger'	105	104	2020-10-20 15:58:33	
'Savage' NZ interview of politician Jami-Lee Ross gains international audience	101	20	2020-10-19 09:53:54	
Europe becomes second region to cross 250,000 deaths as second COVID wave hits	117	32	2020-10-25 00:21:21	
Life-sized Godzilla theme park attraction launches in Japan	105	24	2020-10-22 01:50:10	
Tens of thousands march in Belarus despite firearms threat	100	3	2020-10-19 07:05:28	
At Least 18 Dead, Including Children, In Suicide Attack In Afghan Capital	103	5	2020-10-24 21:36:28	
Polish academics protest ‘fundamentalist’ education minister	101	3	2020-10-23 11:53:43	
Fukushima's Radioactive Water Containing Carbon-14 Can Damage Human DNA, Says Greenpeace	93	38	2020-10-23 18:43:34	
Japan to reduce greenhouse-gas emissions to net zero by 2050	97	15	2020-10-21 18:38:00	
Thailand lifts protest ban that backfired	102	1	2020-10-24 15:47:45	
Long-term heart damage likely in some Covid-19 survivors, review finds	98	4	2020-10-20 09:15:51	
India Considers Taiwan Trade Talks as Both Spar With China	92	4	2020-10-21 07:25:02	
Over 27 Million people have recovered from COVID-19 globally	94	20	2020-10-22 11:12:22	
Chance for Chile to forge new path in vote to scrap Pinochet-era constitution	92	11	2020-10-22 18:23:14	
New measurements of the solar spectrum verify Einstein’s theory of General Relativity: An international team of researchers has measured, with unprecedented accuracy, the gravitational redshift of the Sun, and their results verified one of the predictions of Einstein’s General Relativity	96	13	2020-10-19 11:25:03	
Poland abortion ruling: Protests spread across the country	93	2	2020-10-23 23:56:31	
U.S. Embassy in Turkey Issues Terrorism Alert and Halts Services	93	5	2020-10-23 23:39:49	
Greece: Convicted former Golden Dawn lawmaker on the run after being sentenced to prison	92	2	2020-10-23 13:29:23	
Brexit: Boris Johnson turns down EU offer to restart trade talks	91	43	2020-10-20 05:37:36	
Ireland has imposed a 6 week lockdown	94	12	2020-10-20 00:28:26	
EU removes Canadians from list of approved travellers, because of COVID-19	87	37	2020-10-21 19:09:43	
Fiancee of Khashoggi, human rights group sue Saudi crown prince in U.S.	93	4	2020-10-21 01:16:10	
NZ Prime Minister Jacinda Ardern says she's 'grateful just for being here again' in social media post	89	5	2020-10-19 17:12:36	
Thai protesters give PM three days to quit	86	5	2020-10-21 22:56:05	
Australia will resume a contentious naval exercise alongside India, Japan and the US, in a move set to antagonise China.	86	12	2020-10-20 04:45:22	
Poland moves to near-total ban on abortion, sparking protests	85	11	2020-10-24 00:35:24	
Oxfam: Rich countries are not delivering on $100bn climate finance promise	85	5	2020-10-20 13:59:44	
France mourns teacher Samuel Paty, as government mobilizes against Muslim groups	85	15	2020-10-21 16:22:51	
NASA chooses Nokia to build first mobile network on the Moon for future colony	81	17	2020-10-20 20:50:32	
Albania becomes first Muslim country to adopt anti-Semitism definition	93	15	2020-10-24 23:40:17	
A Venezuelan vessel carrying 1.3 million barrels of oil is tilting — and it could lead to a catastrophic oil spill	84	16	2020-10-22 11:50:57	
Russia says it's willing to freeze nuclear arsenal to extend arms treaty with the US.	79	41	2020-10-20 17:48:24	
Greek MEP Kaili Calls For New Visa Restrictions On Azerbaijanis, Dialogue For Abolishing Visas For Armenians	87	24	2020-10-20 00:27:45	
US Embassy in Turkey receives ‘credible reports’ of potential terrorist attacks and kidnappings	82	0	2020-10-23 17:45:06	
Thailand protests: State of emergency lifted after days of rallies	85	1	2020-10-22 13:47:29	
Brazilian agents intimidated government's own delegates at climate talks	81	0	2020-10-21 02:20:52	
Seven bodies found in fertilizer shipment from Serbia to Paraguay	81	19	2020-10-24 00:55:05	
Doctors in South Korea call for flu vaccinations to be paused after 25 deaths	81	17	2020-10-22 18:49:45	
World struggles as confirmed COVID-19 cases pass 40 million	79	22	2020-10-19 16:01:24	
Qatar's Al Meera removes French products amid growing boycott movement - Doha News	80	64	2020-10-24 18:09:52	
Toronto Mosque Threatened With ‘Christchurch Like Massacre’; Shut-Down Indefinitely	77	30	2020-10-21 22:18:08	
Taiwan donates 100,000 masks to Yazidis in Iraq	79	10	2020-10-19 08:10:32	
US urges countries to withdraw from UN nuke ban treaty	77	55	2020-10-22 07:58:25	
Prime Minister of Australia, Scott Morrison, names and shames Jehovah's Witnesses among four institutions for not joining National Redress Scheme and is finalising sanctions against them.	76	14	2020-10-22 05:32:34	
Air Pollution Killed Nearly Half a Million Newborn Babies Around the World in 2019: Report	77	8	2020-10-21 19:22:28	
Finger Pointed at Swiss Yodeling Concert as COVID Superspreader Event	76	12	2020-10-21 18:14:53	
Brazilian federal prosecutors and civil rights groups are opposing a project to build a grains railway in the Amazon rainforest, because of its potential impact on indigenous communities and the environment, potentially stalling the project.	86	3	2020-10-25 01:39:49	
EU cuts Canada from safe traveller list, adds Singapore	78	16	2020-10-21 21:48:28	
Iran To Import North Korean missiles In 25-Year Military Deal With China	80	10	2020-10-20 05:11:01	
Amid coronavirus, Day of the Dead in Mexico should be celebrated at home, officials say	75	5	2020-10-20 00:56:11	
"""Everyone is mortal, do not play with death,"" says The Prime Minister of Thailand; a message meant for the Thai protesters."	77	16	2020-10-19 17:05:38	
Cold water swimming may protect the brain from degenerative diseases like dementia, researchers from Cambridge University have discovered.	76	7	2020-10-19 12:37:56	
Israelis press ahead with weekly anti-Netanyahu protests	77	2	2020-10-25 00:18:51	
Final count gives Luis Arce a big victory in Bolivia election	75	14	2020-10-24 00:43:22	
Ultra-Orthodox wedding held in Arab town in effort to avoid detection	73	16	2020-10-23 16:54:43	
One in 10 UK workers asked to work by bosses during furlough	79	1	2020-10-23 11:42:55	
NASA mission to collect a sample on asteroid Bennu is ready for touchdown	76	3	2020-10-20 16:41:16	
ISIS attacks surge in Africa even as Trump boasts of a ‘100-percent’ defeated caliphate	74	10	2020-10-19 09:46:03	
Vietnam landslide hits army camp, buries 22 personnel	77	2	2020-10-18 23:37:01	
Japanese craft breweries are turning unsold beer into gin	78	7	2020-10-23 10:37:19	
China vows retaliation if US proceeds with Taiwan arms sale	78	32	2020-10-23 08:57:54	
Egypt: 49 executions carried out over 10 days in October	77	8	2020-10-23 03:40:15	
"27,000 Chinese ""retires"" to the Philippines"	74	29	2020-10-21 09:31:36	
UN stockpiling billion syringes for COVID-19 vaccine	74	4	2020-10-19 19:34:16	
North Korean detainees are treated as 'less than animals,' report alleges	71	9	2020-10-19 14:23:57	
Coronavirus: France extends overnight curfew as cases surge	72	1	2020-10-22 23:04:07	
Afghanistan conflict: Children among dead after air strike on school	73	9	2020-10-22 15:12:28	
Conjoined twins return home after successful separation	69	13	2020-10-20 00:03:53	
Venezuela's Maduro, citing Pope, asks congress to consider same-sex marriage	223	91	2020-10-25 07:05:22	
France recalls ambassador from Turkey	80	18	2020-10-24 22:36:16	
France becomes 7th country with more than 1 million COVID-19 cases	85	1	2020-10-25 02:39:49	
German man takes COVID-19 distancing rules to extreme with pepper spray	70	8	2020-10-20 18:11:34	
Sudanese protesters burn Israeli flag, reject normalization with Israel	128	27	2020-10-25 06:29:48	
U.S. suspends Turkey visa services after reports on potential attacks	69	0	2020-10-24 05:07:48	
Russia Poses Greater Election Threat Than Iran, Many U.S. Officials Say	65	4	2020-10-22 23:50:57	
Greece Finalizes Plan to Build Wall on Border with Turkey	69	46	2020-10-19 22:49:54	
World's coronavirus cases climbing at record level to 40 million	70	14	2020-10-18 22:22:45	
Czech health minister set to lose job after breaching his own Covid rules	67	2	2020-10-23 16:37:07	
China insists Indians vacate Chushul heights, India says clear Pangong north	70	6	2020-10-19 07:59:32	
Wikipedia and WHO Join Hands to Stop the Spread of Coronavirus Misinformation	70	9	2020-10-22 21:00:19	
Scientists discover possible new organ in the human throat	67	16	2020-10-23 09:58:04	
China blames Taiwan flag cake for provoking 'wolf warriors' in Fiji	68	15	2020-10-20 12:59:01	
Russia planned cyber-attack on Tokyo Olympics, says UK	65	2	2020-10-19 21:06:54	
French startup Ynsect to build world's biggest bug farm	69	7	2020-10-24 19:10:43	
As Indian government seals ‘Kashmir Times’ office with no notice, editor Anuradha Bhasin alleges vendetta for filing a SC petition against the communications blockade	64	2	2020-10-22 13:38:16	
Couple who sheltered Jewish filmmaker Roman Polanski during World War II named 'Righteous Among the Nations'	64	31	2020-10-20 16:19:52	
Kuwait takes French products off shelves in protest at anti-Prophet images	77	95	2020-10-25 04:38:20	
In Nicaragua, supplying beef to the U.S. comes at a high human cost. 'Dozens of companies import beef from Nicaragua, Thomas Foods is one of the largest, importing beef from some of the same slaughterhouses that Cunningham said are buying cattle from the ranchers attacking her community.'	63	5	2020-10-24 18:42:38	
Europe becomes second region to cross 250,000 deaths as second COVID wave hits	63	7	2020-10-24 16:27:15	
US designates six more Chinese media companies as foreign missions	62	0	2020-10-23 14:13:12	
Afghan forces kill top Qaida member al-Masri, one of US’ most wanted	268	20	2020-10-25 09:16:59	
France recalls Turkey envoy after Erdogan says Macron needs 'mental check'	154	15	2020-10-25 07:56:04	
Syrian ISIS terrorist 'who stabbed tourist to death in Germany' wanted to slaughter Christians and cut out their tongues - and was under observation on the day of the attack	73	41	2020-10-25 01:46:38	
Explosion onboard a Russian oil tanker, vessel sinking	70	11	2020-10-24 22:36:04	
10,007 Netherlands coronavirus infections for the day sets dismal record	61	4	2020-10-23 18:29:10	
Over 1 million people could come to UK from Hong Kong within five years -official estimate-	65	12	2020-10-22 17:37:10	
Ireland To Impose 6-Week National Lockdown, Estimates 150,000 Job Losses	60	1	2020-10-21 03:11:44	
‘From friends to family’: Israel and Bahrain establish diplomatic relations	60	27	2020-10-19 00:24:37	
Suicide bombing at Kabul education centre kills 18	63	5	2020-10-24 22:36:59	
Xi says China is ready for war after Trump, Biden take hard line on Beijing	61	113	2020-10-23 21:40:58	
Fake alcohol claims 71 lives in 2 weeks in Turkey	62	11	2020-10-23 17:37:59	
Poland abortion ruling: Police use pepper spray against protesters	60	0	2020-10-23 15:31:54	
India using vaguely defined laws to stifle voices of activists, says UN human rights chief	63	4	2020-10-22 11:29:23	
Study finds bottle-fed babies swallow millions of microplastics a day.	58	18	2020-10-19 21:28:38	
Wales to impose two-week deep firebreak: 'everyone must stay at home'	63	10	2020-10-19 20:00:28	
Chile anniversary rallies turn violent as churches burned, police fire tear gas	60	10	2020-10-19 05:58:40	
Stolen medical records used for extortion in Finland	66	2	2020-10-25 03:02:04	
Sudan formally recognizes Israel in United States-brokered deal to become third Muslim country to recognize Israel after United Arab Emirates and Bahrain	58	20	2020-10-23 22:15:43	
Ministry of Internal Affairs of Belarus promised to shoot at protesters “humanely”	58	11	2020-10-21 02:35:37	
Hong Kong democrats rally in support of Thailand protests as activists barred from consulate entry	55	1	2020-10-19 15:57:37	
U.S. intelligence agencies say Iran, Russia have tried to interfere in 2020 election	57	27	2020-10-22 07:41:44	
EU takes action against Malta, Cyprus for 'golden passports'	58	8	2020-10-20 16:00:41	
Ex-Hong Kong bishop calls Vatican line on China 'sickening'	56	10	2020-10-22 08:42:50	
Coronavirus: UK sees over 26,000 new Covid-19 cases, a new daily record	57	8	2020-10-22 05:15:38	
Trump Records Shed New Light on Chinese Business Pursuits	57	5	2020-10-21 08:38:37	
US sanctions six Chinese companies for trade with Iran	55	34	2020-10-20 20:57:59	
Trinidad and Tobago on alert for potential collapse of Venezuelan oil tanker. The tank carries more than a million barrels of oil and may overturn in the Gulf of Paria.	58	12	2020-10-19 21:06:27	
Covid-19: Italy tightens rules after coronavirus cases surge	60	1	2020-10-19 05:58:35	
Refusing to wear a mask in Ethiopia could cost you two years in jail	566	73	2020-10-25 09:55:41	
Polish President Andrzej Duda tests positive for COVID-19	67	4	2020-10-25 05:13:54	
Ethiopia blasts Trump remark that Egypt will 'blow up' dam	62	28	2020-10-24 22:06:19	
BBC apologizes for broadcasting appeal of convicted Hamas terrorist	60	25	2020-10-24 19:31:17	
"A new electron microscope provides ""unprecedented structural detail,"" allowing scientists to ""visualize individual atoms in a protein, see density for hydrogen atoms, and image single-atom chemical modifications."""	57	2	2020-10-22 12:37:48	
Seven people will appear before an anti-terrorism judge as part of an investigation into the beheading of a school teacher in France. The two minors who are set to appear in court are suspected of having taken money in exchange for information on Mr Paty.	59	3	2020-10-21 20:17:00	
Berlin: vandalism of museum artefacts 'linked to conspiracy theorists'	55	6	2020-10-21 10:19:22	
Nigeria protests: Anti-riot police to be deployed nationwide	57	9	2020-10-20 21:31:27	
A second wave of covid-19 sends much of Europe back into lockdown	55	0	2020-10-23 10:03:15	
Poland Court Ruling Effectively Bans Legal Abortions	53	8	2020-10-22 18:25:47	
Police in Paraguay have found a record 2.3 tonnes of cocaine hidden among a charcoal shipment destined for Israel. They said the drugs had an estimated street value of $500m (£383m). It is the largest drugs seizure police have made in the South American country.	57	15	2020-10-21 16:18:40	
Venezuela is positioning a US-sanctioned crude tanker to unload a stricken offshore storage vessel threatening to spill oil into the Gulf of Paria while Eni says it is still awaiting US clearance to help transfer the oil out of the listing vessel	55	18	2020-10-20 23:08:34	
Elon Musk's SpaceX gets CRTC application approval for Starlink satellite internet	55	15	2020-10-20 15:46:07	
Bolivia election: exit polls suggest thumping win for Evo Morales' party	56	2	2020-10-19 15:29:49	
Nigeria's President Breaks His Silence to Threaten Protesters	52	6	2020-10-23 09:45:07	
A stranded oil tanker at risk of spilling in the Caribbean looks to be safe — for now	53	5	2020-10-23 08:02:04	
Goldman Sachs unit pleads guilty in Malaysian bribery case	52	4	2020-10-23 00:23:38	
Golden Dawn leadership heading to jail after court ruling	51	5	2020-10-22 15:53:27	
Sahel region is 'canary in the coalmine' on climate, says UN official	56	6	2020-10-19 08:27:27	
U.N. arms embargoes on Iran expire despite U.S. objections	53	0	2020-10-18 23:53:32	
"Justin Trudeau's Liberals threaten to call election if Parliament votes to form ""anti-corruption"" committee"	55	31	2020-10-21 20:44:07	
Azerbaijan, Armenia say U.S. to host talks over territorial dispute	51	14	2020-10-20 18:23:24	
Operation Chinchilla Is a Go. Twenty-five of the endangered rodents are living on top of a multibillion-dollar Chilean gold reserve. Miners are going to great lengths to relocate them	48	8	2020-10-20 07:53:30	
Anti-lockdown demonstration turns violent in Prague	55	4	2020-10-19 01:13:55	
Tectonic fault line that runs through Ladakh not inactive as was thought. It's moving north, Study says.	51	1	2020-10-18 20:39:39	
