title	score	num_comm	created	content	sources
"CDC Adviser: ""It’s a lot easier to wear a mask than a ventilator"""	38248	975	2020-06-30 14:51:28	None	None

New York Governor signs executive order that allows store owners the right to ban any customer that enters without wearing a mask.	38227	1267	2020-05-28 20:02:47	None	None

People who social distance may be more intelligent, study says	38140	2464	2020-07-15 07:45:11	None	None

California's COVID-19 positivity rate drops below 3% for the first time	38145	1311	2020-09-22 04:57:17	None	None

Dr. Fauci says all the ‘valid’ scientific data shows hydroxychloroquine isn’t effective in treating coronavirus	38087	2067	2020-07-29 20:58:23	None	None

Coronavirus Update: Poll finds 81% of Canadians think Canada-U.S. border should stay closed	38067	759	2020-07-08 03:52:43	None	None

CDC director warns America is in for the ‘worst fall…we’ve ever had’	38012	2563	2020-08-14 14:32:33	None	None

Colorado suspends license of Castle Rock restaurant that defied coronavirus public health order	37942	2272	2020-05-12 01:13:07	None	None

‘The US state of Arizona, is currently registering as many new cases of coronavirus as the entire European Union, which has a population 60 times greater.’	37926	3018	2020-07-12 14:45:52	None	None

America has one of the world's worst coronavirus responses	37844	2677	2020-03-20 14:18:27	None	None

Dr. Anthony Fauci says coronavirus turned 'out to be my worst nightmare' and it 'isn't over'	37481	1914	2020-06-09 22:44:48	None	None

US reports 50,298 cases today so far, highest on record	37483	3535	2020-07-02 04:25:26	None	None

Maryland governor says now is 'the worst possible time' to lift coronavirus restrictions	37408	557	2020-04-17 00:17:51	None	None

Cheap steroid cuts death rates significantly for seriously ill Covid-19 patients in intensive care, drug trial finds	37321	1158	2020-06-16 16:04:10	None	None

‘The beginning of a horror movie’? Disney World slammed as doors reopen amid spiking coronavirus cases	37282	2821	2020-07-13 04:31:02	None	None

Google says most employees will work from home until 2021 amid pandemic	37270	1921	2020-05-08 21:19:03	None	None

NY Governor says protesters should 'assume' they have been 'infected' with coronavirus	37218	1645	2020-06-04 22:25:08	None	None

Dr. Anthony Fauci: ‘We will have coronavirus in the fall’	37108	2615	2020-04-23 16:16:04	None	None

Why scientists change their mind and disagree: changing your mind based on new evidence is a badge of honor in the scientific community. The situation is complicated by the fact that pre-print research is often being debated in public on social media	37063	1449	2020-05-28 15:10:38	None	None

Chicago nurse told friend she was ‘scared to death.’ Within weeks, she and her son were dead from COVID-19, and her husband barely survived.	37054	1823	2020-04-26 00:10:52	None	None

Colorado girl who pioneered medical marijuana for seizures dies after battling coronavirus	37037	742	2020-04-08 18:38:48	None	None

New York City reported zero COVID-19 deaths for three straight days	37033	1398	2020-08-05 18:51:44	None	None

Google to Keep Employees Home Until Summer 2021 Amid Coronavirus Pandemic	37029	1604	2020-07-27 17:00:49	None	None

Spanish princess Maria Teresa is world's first royal to die from the coronavirus	37000	2614	2020-03-28 23:20:05	None	None

Vitamin D levels appear to play role in COVID-19 mortality rates: Patients with severe deficiency are twice as likely to experience major complications	36828	2492	2020-05-13 15:40:27	None	None

Plague Inc. Getting New Mode That Lets You Save the World From a Pandemic, Not Destroy It	36819	715	2020-03-24 17:28:17	None	None

750 Arizona teachers have quit. More than 40% of those teachers say COVID-19 is the reason they chose to resign or retire.	36812	1748	2020-09-18 23:39:59	None	None

NEW: The U.S. Pres. says he has been tested for coronavirus, and he is awaiting the results of the test.	36624	600	2020-03-14 20:34:04	None	None

A patient diagnosed with pneumonia near Paris on 27 December actually had the coronavirus, his doctor has said.	36492	2375	2020-05-05 12:34:23	None	None

An Italian town tested all 3,300 residents, found 3% positive and 1.5% asymptomatic. After quarantining them and their contacts, it cut new COVID-19 cases to zero.	36388	1242	2020-03-19 09:19:16	None	None

‘Do Not Invite Anyone Over’ to Your Home, Chicago’s Top Doctor Urges	36286	2560	2020-10-19 20:50:04	None	None

Pope Francis said we have all gone ahead “at breakneck speed”, ignoring the wars, injustice, and cries of the poor and our ailing planet. “We carried on regardless, thinking we would stay healthy in a world that was sick.”	36261	163	2020-03-28 07:44:34	None	None

Canada Reports Zero COVID-19 Deaths for First Time Since March	36257	1139	2020-09-12 05:29:23	None	None

White House head of security is 'very ill' with coronavirus, report says	36204	1261	2020-10-08 20:09:58	None	None

Study: Middle and high schoolers can spread coronavirus as effectively as adults	36135	1552	2020-07-19 15:36:44	None	None

Over the past 24 hours, the U.S. reported 26,885 new cases of coronavirus and 1,029 new deaths, raising the total to 215,429 cases and 5,068 dead. This is the first time any country has reported more than 1,000 new deaths in one day	36062	4220	2020-04-02 10:46:08	None	None

CDC continuing to deny expanded testing. There are 7 private labs ready to start COVID-19 testing in New York that could process up to 2,000 more tests per day -- if they had CDC approval, Gov. Cuomo says	36019	1230	2020-03-08 19:34:29	None	None

Wilmington Hospital nurse walks off job after being forbidden from wearing N95 mask to treat COVID-19 patients	35900	1800	2020-04-15 21:54:03	None	None

80 percent of workers would not feel safe if their state reopened now, survey reveals	35861	1475	2020-04-28 03:01:25	None	None

Italy's daily coronavirus recoveries surpass new cases for the first time since the outbreak began	35781	510	2020-04-24 13:18:38	None	None

Coronavirus: Parents sending sick, symptomatic kids to school, health officer says	35756	2163	2020-09-23 17:10:36	None	None

Game of Thrones actor Kristofer Hivju confirms he is COVID-19 positive	35741	1006	2020-03-17 00:59:27	None	None

Elizabeth Warren’s oldest brother dies of coronavirus in Oklahoma	35690	150	2020-04-23 18:30:17	None	None

Princeton University has reversed their plans, undergrads may no longer return to campus this year due to COVID-19	35684	1132	2020-08-08 03:32:59	None	None

Wearing a mask to protect others is an intentional act of kindness	35624	519	2020-05-25 08:13:49	None	None

FDA tells Alex Jones to stop promoting unapproved, misbranded coronavirus cures online	35370	479	2020-04-10 05:08:55	None	None

The inventor of N95 masks, which integrate virus-blocking technology into their design, has come out of retirement to find ways to disinfect the masks for reuse, amid the coronavirus pandemic.	35344	939	2020-04-19 05:58:12	None	None

30 year old Brooklyn teacher denied Coronavirus test three times is in serious condition on a ventilator	35288	1798	2020-03-29 22:03:59	None	None

More Than 150 Experts Urge the U.S. to Shut Down as Coronavirus Cases Surpass 4 Million	35121	2678	2020-07-25 23:06:46	None	None

Couple who insisted on 100 wedding guests are diagnosed with Covid-19	35079	1349	2020-07-28 00:49:09	None	None

The U.S. has the worst coronavirus outbreak in the world: 'The numbers don't lie,' Dr. Fauci says	35038	1946	2020-08-06 00:43:20	None	None

WHO urges China to close ‘dangerous’ wet market as stalls in Wuhan begin to reopen	35032	2123	2020-04-13 15:25:23	None	None

Jeff Bezos asking whole foods employees to donate sick leave to a each other.	34889	766	2020-03-14 08:43:11	None	None

A Georgia bar owner removed $3,714 worth of bills stapled to the walls to give to her unemployed staff	34779	1017	2020-04-09 14:44:39	None	None

'Pandemic pricing' is here. Rents are dropping across the US	34771	2539	2020-06-17 18:00:41	None	None

Things To Do In Dallas This Week: Stay The Fuck Home.	34694	1177	2020-03-16 15:39:44	None	None

'I'm fighting a war against COVID-19 and a war against stupidity,' says CMO of Houston hospital : After two hours of sleep a night for four months and seeing a member of his team contract the virus, Joseph Varon, MD, is growing exasperated.	34691	1541	2020-08-01 21:04:59	None	None

73% Of Inmates At An Ohio Prison Test Positive For Coronavirus	34635	1864	2020-04-21 01:31:44	None	None

U.S. Officially Has Worst Coronavirus Pandemic Day Yet	34615	3274	2020-06-26 02:52:29	None	None

N.J. restaurants NOT reopening for indoor dining this week after ‘knucklehead’ crowds at bars ruin it for everyone	34604	1573	2020-06-29 22:46:14	None	None

‘OSHA is AWOL’: Critics say federal agency is where workplace COVID-19 complaints go to die	34587	875	2020-07-17 15:47:54	None	None

'Scared and confused:' DHS says teachers shouldn't wear N95 masks; scientist says that makes 'no sense'	34576	2271	2020-09-02 16:54:30	None	None

Autopsy: Santa Clara patient died of COVID-19 on Feb. 6 — 23 days before 1st U.S. death declared	34506	2417	2020-04-22 09:58:45	None	None

Rite Aid Worker Says She Was Fired After Asking Mask-Less Customer to Leave Store: 'They're Punishing Me for Defending Myself'	34469	1532	2020-09-18 13:20:35	None	None

Hospitals say feds are seizing masks and other coronavirus supplies without a word	34209	1248	2020-04-08 03:05:09	None	None

"This ""Do's and Don't's"" List From the 1918 Pandemic Proves We've Learned Absolutely Nothing in 100 Years"	34177	544	2020-08-15 20:22:19	None	None

"NYC ER doctor: The lack of US testing is a ""National Scandal"""	34129	2454	2020-03-02 17:07:53	None	None

Sen. Klobuchar says her husband has coronavirus: “We just got the test results at 7 a.m. this morning ... He now has pneumonia and is on oxygen but not a ventilator.”	34107	66	2020-03-23 18:46:04	None	None

US critics of stay-at-home orders tied to fossil fuel funding	34087	1377	2020-05-23 19:03:48	None	None

Dr. Fauci Says Early Results from Coronavirus Vaccine Are 'Very Good News'	34036	1629	2020-08-02 19:58:10	None	None

NJ governor orders all flags across the state be lowered to half-staff indefinitely for lives lost to coronavirus	34017	953	2020-04-04 03:44:15	None	None

More than 100 Austrians ‘accidentally’ received US coronavirus stimulus money	33994	1305	2020-09-08 13:58:50	None	None

If you can punish a teenage girl for spaghetti straps, you can enforce a mask mandate	33861	1010	2020-08-12 00:31:35	None	None

'We need to close down' — Florida reports more than 10,000 coronavirus cases for fifth day	33794	2678	2020-07-20 03:09:12	None	None

California Gov. Newsom Signs Executive Order To Prevent Stimulus Money From Being Taken By Debt Collectors	33797	1045	2020-04-24 00:04:02	None	None

PhD: I’m in a high risk group for COVID-19. There is a good chance that if I get the disease, I will die. You can keep me - and millions like me - alive by staying home. Our lives are more important than your craft cocktail.	33754	823	2020-03-15 20:08:36	None	None

"Harvard expert: ""We may be done with the pandemic, but the pandemic is not done with us"""	33651	1406	2020-06-17 01:27:00	None	None

Japan to pay firms to leave China, relocate production elsewhere as part of coronavirus stimulus	33637	1589	2020-04-09 23:43:38	None	None

“Totally predictable”: State reopenings have backfired | Vox	33619	3290	2020-06-15 05:59:16	None	None

COVID-19 front-line workers deserve financial reward	33414	700	2020-03-23 18:02:33	None	None

Overwhelmed by cases, North Dakota tells residents with COVID-19 to do their own contact tracing	33320	1667	2020-10-23 14:59:55	None	None

"A nine-year-old Kenyan boy who made a wooden hand-washing machine to help curb the spread of coronavirus says he is ""very happy"" after receiving a presidential award"	33241	324	2020-06-02 22:20:50	None	None

Amazon fires warehouse worker who led Staten Island strike for more coronavirus protection	33177	368	2020-03-31 04:57:43	None	None

Kindergartner tests positive for COVID-19 on first day of in-person classes at League City school in Texas	33083	1419	2020-09-01 17:46:05	None	None

Matthew McConaughey delivers 110K face masks to hospitals in rural Texas	33076	811	2020-05-23 00:58:35	None	None

Millions Of Americans Skipping Payments As Tidal Wave Of Defaults And Evictions Looms	33075	2664	2020-06-03 16:02:17	None	None

Teacher creates national database of COVID-19-related school closings, cases and deaths	32953	569	2020-08-16 18:50:59	None	None

Every night at 8PM, the residents of Atlanta cheer for all the healthcare workers during change of shift	32731	886	2020-03-26 06:41:03	None	None

After 13 days since the ease of the lockdown, all 20 regions in Italy except Lombardy reported less than 100 cases each. Today's positive rate is 1,1%, lowest ever reported. More than 3M tests have been performed in total	32722	1417	2020-05-17 21:44:17	None	None

More than 2,000 students, 500 teachers in Mississippi in quarantine due to COVID-19	32710	1375	2020-08-18 14:24:37	None	None

Six campaign staffers working on Tulsa rally test positive for coronavirus	32707	386	2020-06-20 22:29:23	None	None

CDC is now reporting the number of reported cases for each state again. Good job with the petition guys.	32644	913	2020-03-04 21:26:03	None	None

Michigan has 14 school-related coronavirus outbreaks. State won’t say where.	32543	996	2020-08-20 16:24:10	None	None

3 doctors in Russia fall out of windows in 2 weeks. 2 dead. They warned about lack of means of protection in russian hospitals	32480	1184	2020-05-03 08:59:03	None	None

Lives Cut Short: Remembering Health Care Workers In Their 20s Killed By COVID-19	32471	1077	2020-08-17 15:58:15	None	None

"Sunday's front page of The New York Times is dedicated to those who died of COVID-19. ""The 1,000 people here reflect just 1 percent of the [U.S.] toll."""	32402	1327	2020-05-24 02:03:15	None	None

Essential workers are losing their hazard pay even though the hazard isn’t over	32302	2157	2020-05-16 15:24:03	None	None

Georgia teenager loses both parents to COVID-19 within a week	32277	1641	2020-08-03 14:45:17	None	None

Iran’s minister of communication gives each citizen a free 100GB internet to encourage people stay in their homes.	32249	1042	2020-03-08 01:36:44	None	None

97,000 children reportedly test positive for coronavirus in two weeks as schools gear up for instruction	32246	1416	2020-08-08 23:20:50	None	None

80% of Covid-19 Patients in ICU are overweight (Netherlands)	32216	3739	2020-03-30 13:10:14	None	None

'Heads we win, tails you lose': how America's rich have turned pandemic into profit | As 26 million Americans lose their jobs, the billionaire class has added $308bn to its wealth	32211	534	2020-04-27 08:54:59	None	None

Japanese island suffering second wave of coronavirus after lifting lockdown too early	32213	1611	2020-05-01 07:31:26	None	None

The U.S. was the world's best prepared nation to confront a pandemic. How did it spiral to 'almost inconceivable' failure?	32205	1898	2020-10-16 14:31:09	None	None

Social distancing one week earlier could have saved 36,000 US lives: study	32179	2382	2020-05-21 16:45:54	None	None

Florida coach wanted 90,000 fans at his home stadium, but now his players have COVID	32103	1242	2020-10-14 03:38:53	None	None

Swedish IKEA store finds 50,000 forgotten face masks, gives them to local hospital	32107	504	2020-03-17 22:05:52	None	None

Your Mask Cuts Own Risk by 65 Percent	32093	1758	2020-07-09 04:36:17	None	None

Fauci warns US needs to 'hunker down' for fall, winter: 'It's not going to be easy'	32061	2843	2020-09-11 01:55:39	None	None

Days after photos of packed hallways go viral, Paulding high school reports 9 COVID 19 cases	32005	1505	2020-08-09 05:03:51	None	None

US becomes first country to record over 2,000 coronavirus deaths in last 24 hours: Report	31834	3413	2020-04-11 07:33:51	None	None

Kimberly Guilfoyle, Don Jr.'s girlfriend, tests positive for coronavirus	31809	1445	2020-07-04 06:43:58	None	None

USS Theodore Roosevelt now has 416 coronavirus cases in wake of captain's firing	31755	1552	2020-04-10 13:55:00	None	None

Fauci calls for social distances until there is zero new cases, zero deaths	31710	1437	2020-04-03 22:52:19	None	None

The Intensive Care section of the hospital of Bergamo, Italy, which has been the most COVID-battered city in the world, is now COVID free.	31674	704	2020-07-08 19:53:53	None	None

Boy, 7, uses $600 of savings to make coronavirus care packages for seniors, feed 90 students	31669	757	2020-03-20 18:39:04	None	None

Obesity increases risk of Covid-19 death by 48%, study finds	31657	2247	2020-08-26 14:25:30	None	None

Doctors say they're dealing with significantly more patients who resist their advice because of misinformation they read online	31636	1242	2020-08-18 20:34:39	None	None

Wuhan will test its entire population of 11 million after reporting new infections for the first time since its lockdown was lifted	31582	1662	2020-05-12 11:59:08	None	None

Effects of Closing Schools During the 1918-1919 Influenza Pandemic: proactive closings had far better mortality rates than reactive closings	31392	1485	2020-03-05 08:21:56	None	None

California governor says schools will reopen when the data shows it is safe to do so	31388	1181	2020-07-09 00:44:06	None	None

After 7 weeks extreme lock down, Victoria (Australia) reduced the daily new cases from 725 to 11	31359	2203	2020-09-21 14:27:07	None	None

‘Stupid and crazy’: Local officials protest Gov. Kemp’s decision to reopen beaches in hard-hit Georgia	31354	1180	2020-04-06 15:05:42	None	None

The U.S. Pres. tests negative, White House says	31337	143	2020-03-15 03:21:49	None	None

Amazon notifies Canadian workers it is cancelling hero pay despite ‘heavy demand’ and positive COVID-19 cases at warehouses	31321	1908	2020-05-16 03:46:10	None	None

Coronavirus: Denmark’s government told private companies that it would cover 75% of employees’ salaries, if they promised not to cut staff.	31311	1199	2020-03-18 14:59:32	None	None

Bill Gates: ‘We underestimated the value of masks’	31300	1594	2020-09-16 15:58:36	None	None

Coronavirus: Vitamin D reduces infection and impact of COVID-19, studies find	31177	1704	2020-09-26 14:27:24	None	None

Zero! NZ has no Covid-19 cases	31177	974	2020-06-08 05:04:41	None	None

Shopper who stockpiled $10k of toilet paper, sanitiser refused refund	31141	1277	2020-04-16 11:58:00	None	None

NY Gov: ‘We’re seriously considering a quarantine’ for visitors from out of state	31042	1706	2020-06-23 17:12:07	None	None

Man loses both parents to coronavirus 6 minutes apart: ‘You don’t want this pain’	31030	1425	2020-04-03 23:49:35	None	None

Kennels go empty after every animal gets adopted at Colorado shelter amid outbreak.	31008	640	2020-03-28 02:47:42	None	None

White House ordered NIH to cancel coronavirus research funding, Fauci says	30995	66	2020-06-25 04:37:59	None	None

4 Tampa Bay FL Hospitals run out of ICU beds	30960	1872	2020-07-05 17:56:24	None	None

Risk of never fully recovering after coronavirus ‘very real,’ scientists say	30856	2161	2020-06-28 00:28:41	None	None

Oklahoma Gov. “Shocked” To Test Positive For COVID-19 Despite Not Wearing A Mask	30662	1108	2020-07-19 00:07:41	None	None

Delta Air Lines has put 240 people on ‘no fly list’ for not wearing masks, CEO says	30645	986	2020-08-27 19:02:55	None	None

A coronavirus cluster in New Jersey has been traced to a high school house party, and the teens and their parents are refusing to cooperate with contact tracers, officials say	30635	1135	2020-07-26 10:02:46	None	None

Texas Closes all Bars. Reduces Restaurant Capacity.	30578	2086	2020-06-26 18:05:34	None	None

Coronavirus testing in South Korea: 1. Drive to a testing station 2. Stay in your car 3. It takes less than 10 minutes 4. Results texted to you the next day , Done. Oh, and it's free.	30550	77	2020-03-15 18:27:17	None	None

New York City Reports No COVID Deaths in 24 Hours	30530	1336	2020-07-14 16:08:12	None	None

More Costco Employees Have Tested Positive For The Coronavirus Days After A Coworker Died From The Disease	30498	1185	2020-03-20 04:54:56	None	None

Utah students and staff who don’t wear masks in schools can be charged with a misdemeanor	30336	1006	2020-08-21 04:37:36	None	None

Taiwan today announced no new cases of coronavirus, meaning the country has gone 28 days without reporting a single local transmission.	30335	1119	2020-05-10 11:18:39	None	None

White House opposes requirement for passengers to wear masks on planes, trains	30155	1872	2020-08-02 12:05:28	None	None

We have surpassed 100,000 recovered cases worldwide	29904	902	2020-03-23 14:55:25	None	None

People with COVID-19 often lie about symptoms and distancing, according to research	29808	1474	2020-08-22 15:57:10	None	None

A School Reopens, and the Coronavirus Creeps In — as more schools abandon plans for in-person classes, one that opened in Indiana this week had to quarantine students within hours.	29719	1824	2020-08-01 14:48:45	None	None

States and Hospitals Are Essentially Smuggling PPE Because They’re Afraid the Feds Will Seize It	29681	345	2020-04-21 17:50:29	None	None

Reddit Sees Traffic Surge of 20-50% During Coronavirus Outbreak	29646	667	2020-03-18 02:21:52	None	None

New York shoppers hound customer out of grocery store for not wearing mask in viral video	29523	2569	2020-05-25 20:40:16	None	None

Elon Musk publishes list of hospitals Tesla sent ventilators to after claims none were delivered to California	29481	2428	2020-04-17 14:54:07	None	None

Assaulting a worker who's enforcing masks is now a felony under a new Illinois law	29447	514	2020-08-11 00:42:29	None	None

North Carolina textile mill ‘heeds call of nation,’ gears up to make 10 million face masks per week	29387	836	2020-03-23 03:47:02	None	None

Anthony Fauci Nominated for an ‘Oscar’ of Civil Service	29374	864	2020-05-04 04:07:48	None	None

We regret to inform you that your inflatable T. rex costume is not virus-proof	29308	760	2020-04-25 17:15:54	None	None

One trip per week. One person per household. That should be the law for grocery buying, union says	29274	3191	2020-04-18 16:55:34	None	None

The chinese doctors squad just arrived in Italy to help to fight the COVID-19 with their experience	29256	1352	2020-03-13 03:56:31	None	None

The United States President Has Declared A State Of Emergency	29204	6899	2020-03-13 23:36:07	"[CNBC](https://www.cnbc.com/2020/03/13/trump-will-hold-a-press-conference-at-3-pm-et-to-discuss-coronavirus-response.html)

[BBC](https://www.bbc.com/news/world-us-canada-51882381)

[CNN](https://www.cnn.com/2020/03/13/politics/states-coronavirus-fema/index.html)

[NBC](https://www.nbcnews.com/health/health-news/live-blog/coronavirus-updates-live-dow-plunges-white-house-grapples-spreading-crisis-n1157551)"	['https://www.cnbc.com/2020/03/13/trump-will-hold-a-press-conference-at-3-pm-et-to-discuss-coronavirus-response.html', 'https://www.bbc.com/news/world-us-canada-51882381', 'https://www.cnn.com/2020/03/13/politics/states-coronavirus-fema/index.html', 'https://www.nbcnews.com/health/health-news/live-blog/coronavirus-updates-live-dow-plunges-white-house-grapples-spreading-crisis-n1157551']

The first COVID-19 patient in New Jersey found out his test results were positive watching the news from his hospital bed	29176	828	2020-03-31 17:13:31	None	None

Houston ICU is 90% full and expected to exceed capacity in just 2 weeks	29108	3102	2020-06-24 04:53:54	None	None

Humanity wins: our fight to unlock 32,544 COVID-19 articles for the world. This petition is dedicated to the victims of the outbreak and their families. We fought for every article for every scientist for you.	29114	519	2020-03-07 04:48:25	None	None

Bolsonaro still has coronavirus after testing positive for the third time	29104	844	2020-07-22 16:31:35	None	None

Harvard expert: US would have a 'very different situation' with earlier testing, lockdowns	29029	2092	2020-04-01 16:41:58	None	None

I put together a Google Drive Folder with over 40 free mental health resources (books, worksheets, workbooks, guides) to help others cope with anxiety/fear, addiction, depression, suicidal ideation and stress.	28947	546	2020-03-30 17:56:36	None	None

New York state now has more confirmed coronavirus cases than any country in the world	28860	1955	2020-04-08 21:43:48	None	None

US sees record 88,973 Covid-19 infections for second day straight	28782	1863	2020-10-25 15:09:03	None	None

"New York Governor tells reopen protesters: ""You have no right to jeopardize my health"""	28580	2584	2020-05-03 18:48:23	None	None

U.S. reports at least 1,444 new coronavirus deaths, biggest one-day increase in more than 2 months	28526	2125	2020-07-30 06:26:14	None	None

U.S. Coronavirus Death Toll Hits 170,000 Ahead of Fall Flu Season	28518	1442	2020-08-17 03:57:49	None	None

Dr. Fauci: 'You don't make the timeline, the virus makes the timeline'	28467	1446	2020-03-26 08:30:50	None	None

Fauci says he was in surgery when task force discussed CDC testing guidelines	28297	349	2020-08-27 01:19:22	None	None

UK scientists create coronavirus antibody test with '99.8% accuracy and results in 35 minutes'	28233	786	2020-05-04 13:49:40	None	None

Death Count Expected To Soar As NYC Says It Will Begin Reporting Probable COVID Deaths In Addition To Confirmed Ones	28137	1740	2020-04-09 06:57:46	None	None

Frontier Airline gets rid of $39 “Social Distancing Upgrade” after heavy criticism.	28121	980	2020-05-07 18:10:21	None	None

Governor of Texas Issues Statewide Mask Mandate	28076	1876	2020-07-03 00:24:42	None	None

Asymptomatic spread of coronavirus is 'very rare', says WHO	28058	2642	2020-06-08 22:18:06	None	None

