title	score	num_comm	created	content	sources
Slovakia to perform a full-scale COVID-19 testing. The entire population of the country is to be tested over 2 weekends.	28043	586	2020-10-17 14:49:08	None	None

Boomers Are Ignoring Coronavirus Risks, and Their Millennial Children Are Scared	28020	4324	2020-03-13 02:56:46	None	None

Trump Being Transferred to Walter Reed Military Center	27994	3908	2020-10-03 01:14:54	None	None

Nick Cordero, Standout Actor in Broadway Musicals, Dies of COVID-19 Complications at 41	27966	1412	2020-07-06 05:12:34	None	None

Member of Pence’s staff tests positive for coronavirus	27962	246	2020-03-21 02:44:46	None	None

Medical supply company charging $786 for a box of 20 face masks (formerly $42) accused of exploiting coronavirus crisis	27922	127	2020-04-22 03:21:07	None	None

1918 pandemic. During a football game. Everyone is wearing a mask. 102 years ago.	27902	753	2020-08-02 23:31:43	None	None

Nurses Who Battled Virus in New York Confront Friends Back Home Who Say It’s a Hoax	27872	1261	2020-07-07 14:18:00	None	None

Fauci says it's 'very concerning' that Florida is re-opening bars and restaurants at full capacity	27831	1296	2020-09-28 22:01:57	None	None

"Italy is preparing countrywide ""immunity testing"" so that people with antibodies can go back to work"	27831	1619	2020-04-07 03:59:39	None	None

The U.S. has the world's highest coronavirus death rate at more than 5% - a number that reflects the country's lack of testing	27816	1835	2020-03-06 20:03:21	None	None

McConnell admits he was wrong to say Obama administration failed to leave pandemic playbook	27695	927	2020-05-15 05:11:06	None	None

A choir decided to go ahead with rehearsal. Now dozens of members have COVID-19 and two are dead	27689	461	2020-03-30 06:49:33	None	None

Dolly Parton donates $1m to finding a cure for deadly illness	27653	542	2020-04-02 02:45:51	None	None

Texas Gov. Greg Abbott Caught on Recording Saying Reopening Will Increase Spread of Coronavirus	27483	2316	2020-05-06 00:08:39	None	None

Massive Spike in NYC ‘Cardiac Arrest’ Deaths Seen as Sign of COVID-19 Undercounting	27463	1328	2020-04-11 00:22:37	None	None

Pastor again defies state order not to hold large gatherings. He says 1,000 people came to his church Sunday	27367	2445	2020-03-30 14:58:43	None	None

Vermont Goes 30+ Days with No COVID-19 Deaths	27343	904	2020-07-19 02:44:32	None	None

Entire fourth grade class in Mississippi sent to quarantine	27333	1272	2020-08-25 15:13:03	None	None

Brazil says a 28-year-old volunteer in AstraZeneca's COVID-19 vaccine trial has died of coronavirus complications. It's unknown if he received the vaccine or a placebo - G1	27254	1308	2020-10-21 21:11:02	None	None

'Close to 100% accuracy': Helsinki airport uses sniffer dogs to detect Covid	27237	679	2020-09-24 15:09:22	None	None

Mounting evidence shows masks may help avoid severe illness, even if you get COVID-19	27207	940	2020-07-26 17:57:55	None	None

Ted Cruz Under Investigation For Not Wearing A Mandatory Mask On Flight	27187	1008	2020-07-14 10:53:37	None	None

Oklahoma State linebacker says he tested positive for Covid-19 after attending protest	27123	1894	2020-06-03 07:43:10	None	None

Messaging about Covid-19 has changed too much and too often, quickly evolving from “flatten the curve” to something very different, so Americans aren't listening	27096	2760	2020-08-27 14:57:23	None	None

Fired scientist Rebekah Jones builds coronavirus dashboard to rival Florida’s | Fired scientist Rebekah Jones’ site shows thousands more people with the coronavirus, and hundreds of thousands fewer who have been tested, than the site run by the Florida Health Department	27039	796	2020-06-12 01:46:06	None	None

'OPEN IMMEDIATELY!': Wisconsinites head out to bars after state stay-at-home orders lifted	27006	5794	2020-05-14 16:10:18	None	None

Fauci tells MarketWatch: I would not get on a plane or eat inside a restaurant	26949	1361	2020-07-24 17:47:15	None	None

Tennessee 6-year-old with cystic fibrosis beats COVID-19	26840	366	2020-04-04 18:09:39	None	None

Madison County prosecutor: ‘We can only hope the deadly coronavirus strain spreads in riots’	26598	194	2020-06-02 02:04:03	None	None

"Truckers brave coronavirus outbreak to deliver goods: ""If we stop, the world stops"""	26562	986	2020-03-22 20:32:53	None	None

Teachers who are resigning and retiring across the U.S. blame remote learning frustrations, COVID-19 concerns	26521	1524	2020-08-30 02:06:32	None	None

Fauci said he tested negative for coronavirus Saturday	26453	718	2020-04-06 04:56:32	None	None

Coronavirus cases spike in Texas, Arizona, Florida after reopening	26431	1835	2020-06-05 15:19:48	None	None

'No mask. No ride': Uber will require drivers and passengers to wear face masks indefinitely	26357	533	2020-07-01 20:20:25	None	None

"Fauzi: USA tests are ""a week away"". They were ""a week away"" last week and ""a week away"" two weeks ago."	26362	1532	2020-03-13 15:16:17	None	None

USA, just killing it with public safety awareness	26353	3249	2020-03-03 12:51:30	None	None

Native American health center asked for COVID-19 supplies. It got body bags instead.	26200	901	2020-05-06 06:26:03	None	None

Georgia high school with viral hallway photo reopens again after 35 students, teachers catch COVID	26145	1422	2020-08-13 21:07:21	None	None

Resolution by 60 countries wants WHO to investigate origin of Wuhan coronavirus	26121	981	2020-05-17 13:10:36	None	None

12 states show record spikes in coronavirus cases	26087	1782	2020-06-22 17:26:13	None	None

Fauci warns reopening states: 'You can't just leap over things'	25999	2117	2020-04-30 19:45:12	None	None

"Italy: Giampiero Giron, 85 years old, Venetian anesthetist. ""They asked for my availability, and I said yes. When you decide to be a doctor in life, you get involved. I swore an oath. Afraid of getting sick? Then it is better not to be a doctor »."	25957	386	2020-03-22 20:11:44	None	None

Obama says coronavirus has exposed lack of leadership in US	25931	1345	2020-05-17 05:48:43	None	None

US coronavirus deaths projected to more than double to 410,000 by year's end	25890	1012	2020-09-05 15:28:44	None	None

The number of confirmed coronavirus cases around the world has reached 100,000	25818	567	2020-03-06 14:13:10	None	None

15 US states now hit by rare inflammatory syndrome impacting children	25806	1992	2020-05-13 20:59:39	None	None

Two 20-something New Yorkers have amassed an army of volunteers, 1,300 strong, to deliver food and medicine to the most vulnerable in the coronavirus outbreak.	25771	312	2020-03-18 23:32:09	None	None

Photo of indian man stranded in Delhi due to lockdown and crying after he couldnt meet his son before the son died gains global attention.	25770	207	2020-05-19 14:27:28	None	None

Fauci says he wasn't aware White House coronavirus briefings were returning	25713	699	2020-07-21 19:00:52	None	None

USA: Sikhs prepare over 30,000 free meal packets for Americans in self-isolation	25710	832	2020-03-24 02:02:29	None	None

Man, 39, faces 20 years in prison ‘for attempting to sell 125 million nonexistent face masks to the Department of Veterans Affairs worth $750M’	25705	646	2020-04-13 07:30:38	None	None

Anti-mask US senator who called coronavirus a hoax tests positive for Covid-19	25624	943	2020-07-28 06:22:07	None	None

Mississippi teacher's death during first week of school stokes COVID-19 fears	25520	1058	2020-08-07 05:01:23	None	None

France reports 41,622 new coronavirus cases, by far the biggest one-day increase on record.	25463	1781	2020-10-22 21:43:48	None	None

Inhaled Vaccines Aim to Fight Coronavirus at Its Point of Attack: Vaccines sprayed into the nose or inhaled through the mouth won’t require needles and could be easier to roll out. They may be more effective too.	25469	892	2020-10-11 15:02:30	None	None

Toronto hospitals reach new milestone: No covid-19 patients in the ICU	25439	771	2020-07-05 22:04:36	None	None

"Casino workers union calls Las Vegas mayor's push to reopen ""outrageous"""	25391	1196	2020-04-23 05:31:04	None	None

Liverpool FC manager Jurgen Klopp, when asked about coronavirus: “I don’t understand politics, I don’t understand the coronavirus. Why ask me? All I do is wear a baseball cap and I have a bad shave. Celebrities shouldn’t speak on these serious issues. Leave it to the experts.”	25378	688	2020-03-05 18:01:15	None	None

4 of 4 babies test negative for coronavirus after being born to mothers with the virus.	25377	607	2020-03-16 09:34:58	None	None

Sweden will not reach herd immunity in May only at 7% now with one of the highest death rates	25299	3649	2020-05-26 05:17:13	None	None

Rep Ro Khanna submits bill for $6,000 for any US citizen making below $130,000 last year.	25292	2315	2020-03-19 00:22:47	None	None

Man rode a bicycle for 130 km with his wife strapped to him with a rope, to get her to a hospital for her Chemotherapy. He 2as unable to find any other means of transportation due to the lockdown preventing all movement in India.	25267	687	2020-04-12 15:47:21	None	None

Covid-19 patients are not infectious after 11 days, even if they test positive, new study shows	25194	774	2020-05-24 14:05:38	None	None

Shame on you’: Protester interrupts coronavirus update, accuses DeSantis of ‘doing nothing’ as Florida cases surge	25111	1049	2020-07-14 01:58:55	None	None

U.S. COVID update: Hospitalizations at highest level since August	25107	1191	2020-10-21 02:49:37	None	None

Despite warnings for three years that something like this could happen, USA cut funding for pandemic, CDC and health preparedness. Now they are delaying the most recent report with same findings.	25063	629	2020-03-10 03:00:53	None	None

United States touches 33000+ new cases and 600+ new deaths on 3rd day of upward trend	25046	2183	2020-06-07 03:21:11	None	None

8 month fetus dies infected with Sars-Cov-2	25032	1644	2020-07-25 15:47:37	None	None

This is what Coronavirus looks like in an Italian hospital	25006	1708	2020-03-20 03:26:40	None	None

Dr. Helen Chu who violated CDC gag order should be Time person of the year. In a few months we'll realize her bold move saved the lives of millions.	24951	997	2020-03-11 19:19:02	None	None

Coronavirus spread would dramatically drop if 80% of a population wore masks, AI researcher says	24921	1658	2020-05-25 15:07:38	None	None

White House overrules CDC on banning cruise ships till 2021	24907	1115	2020-09-30 04:40:10	None	None

A second potential COVID-19 vaccine, backed by Bill and Melinda Gates, is entering human testing	24888	1144	2020-04-07 01:25:17	None	None

Northeastern University dismisses 11 first-year students for partying	24757	1152	2020-09-05 04:23:37	None	None

Kellyanne Conway's daughter the latest to test positive for COVID-19	24756	419	2020-10-04 23:56:20	None	None

'This isn't essential': Employees at Tyson dog treat factory plead with company to shut down plant after first Covid-19 death	24750	1334	2020-04-28 14:51:27	None	None

A new poll found 74 percent of registered voters either somewhat or strongly support a national quarantine to fight the spread of coronavirus.	24639	1003	2020-03-26 00:55:26	None	None

Masks, Social Distancing Will Likely Be Needed Until Late 2021, Fauci Says During Virtual Event In Md.	24434	2779	2020-10-06 15:08:32	None	None

White House to end COVID-19 screenings for international passengers	24427	1212	2020-09-10 16:16:44	None	None

TRANSLATION: In Malta, once the vaccine for COVID-19 is found, it will be given for free to everyone.	24366	1531	2020-05-02 13:39:19	None	None

CDC predicts up to 11,000 people will die every week this month from coronavirus	24353	1983	2020-08-03 04:38:55	None	None

Bill Gates says coronavirus will forever alter work, but face-to-face school is ‘totally irreplaceable’	24342	1511	2020-04-12 03:19:39	None	None

NBA players are donating money to cover salaries of arena workers amid the COVID-19 shutdown	24327	580	2020-03-14 14:17:51	None	None

"GOP Maryland governor warns state received ""hundreds of calls"" asking if it's OK to ingest Clorox after POTUS’ disinfectant remarks"	24303	1008	2020-04-26 20:33:06	None	None

Publicly traded firms paid dividends, bought their own stock after receiving PPP loans to pay employees	24244	1097	2020-09-25 15:53:21	None	None

China has been trying to avoid fallout from coronavirus. Now 100 countries are pushing for an investigation	24242	1510	2020-05-18 09:32:24	None	None

Coronavirus is the No. 3 cause of death in the U.S., after heart disease and cancer	24235	1600	2020-04-01 18:25:04	None	None

Medical professionals around the US say the officials are under-reporting the number of CoronaVirus deaths they're seeing on the front lines.	24078	1755	2020-03-27 15:23:19	None	None

Scientists outraged by White House appointees' meddling with coronavirus information: 'Outright egregious'	23985	702	2020-09-14 17:00:57	None	None

Overwhelming majority of Americans more concerned about coronavirus spreading further than economic damage, poll shows	23924	2166	2020-05-07 08:19:30	None	None

Disney theme park staff worry about Covid-19: 'I can't bring it back home	23852	1220	2020-07-21 14:38:44	None	None

POLAND: Government launches a public Minecraft server to encourage teenagers to stay home	23812	416	2020-03-22 14:00:36	None	None

Half of Fox News viewers think Bill Gates is using pandemic to microchip them, survey suggests	23722	2367	2020-05-23 08:05:29	None	None

3M sues distributor for alleged price gouging of N95 respirators in New York	23694	537	2020-04-10 20:50:41	None	None

New York City at 7PM from Manhattan during shift change.	23686	804	2020-04-13 07:10:30	None	None

86% of people with coronavirus are walking around undetected, study says	23622	1816	2020-03-17 20:20:59	None	None

Captain Tom Moore, the war veteran who raised millions for the NHS by walking laps of his garden, has been made an honorary colonel on his 100th birthday.	23595	302	2020-04-30 13:37:22	None	None

Exclusive: Walgreens Pharmacy coding error results in under-reporting of 59,000 COVID-19 test results statewide	23556	642	2020-08-18 00:45:08	None	None

New Study: Vitamin D reduces risk of ICU admission 97%	23503	717	2020-09-07 09:40:33	None	None

Wearing a mask can reduce coronavirus transmission by 75%, new study claims	23455	1134	2020-05-19 19:00:13	None	None

Fauci says new US coronavirus cases could hit 100,000 a day in stark warning to Senate – live	23397	1755	2020-06-30 20:31:12	None	None

AstraZeneca Covid-19 vaccine study put on hold due to suspected adverse reaction in participant in the U.K.	23355	1524	2020-09-09 01:25:57	None	None

Texas Roadhouse CEO gives up salary to pay front-line employees during COVID-19 outbreak	23328	694	2020-03-26 18:58:25	None	None

People are accidentally throwing out their stimulus check — because it looks like junk mail	23211	1187	2020-05-29 04:17:28	None	None

Masks can reduce Covid spread by 40%, German study suggests	23184	865	2020-06-12 14:23:01	None	None

Federal documents: more than 300,000 likely to die if restrictions are lifted	23005	2792	2020-04-21 21:14:14	None	None

Arnold Schwarzenegger donates $1,000,000 in masks and protective gear to hospital workers	22922	564	2020-04-02 03:01:44	None	None

The US isn't even close to getting Covid-19 down to where it needs to be by fall, medical experts say	22889	1840	2020-09-15 06:02:55	None	None

Eminem criticises non-mask wearers on new rap track	22870	949	2020-07-10 20:01:23	None	None

Online retailers spend millions on ads backing Postal Service bailout.	22866	772	2020-05-07 02:27:40	None	None

Oregon governor issues order to prevent debt collectors from seizing stimulus checks	22835	446	2020-04-18 17:22:10	None	None

Biden tests negative for COVID-19, campaign says	22746	489	2020-10-24 21:57:40	None	None

A majority of Americans say they won’t go to the gym or restaurants despite states’ new efforts to reopen the economy, a new national poll shows	22686	1960	2020-05-22 18:42:56	None	None

Canadians are vandalising cars with US plates in anger over border crossings to escape coronavirus	22616	2301	2020-08-11 20:44:18	None	None

ICU doctor fighting coronavirus denied green card: 'It's like a slap in the face'	22612	1050	2020-05-06 22:32:09	None	None

Fauci says there are early signs coronavirus outbreaks are brewing in Ohio, Indiana, Kentucky and Tennessee	22439	1633	2020-07-28 22:07:05	None	None

59-year-old Lawyer for Louisiana Evangelical Megachurch who Defied Social Distancing Orders Is In the Hospital with Coronavirus After Attending a Packed Palm Sunday Service – but he Insists he Has No Idea How he Tested Positive	22420	1368	2020-04-17 06:40:10	None	None

Megathread: President Trump announces 30-day Travel Ban between USA and Europe among other measures to curtail the Coronavirus Outbreak	22343	12335	2020-03-12 05:15:32	"President Trump on Wednesday said he would restrict all travel from Europe for the next 30 days in an extensive step to address the public health crisis caused by the coronavirus.

\_\_\_\_\_\_\_\_\_\_\_\_\_\_\_\_\_\_\_\_\_\_\_\_\_\_\_\_\_\_\_\_\_\_\_\_\_\_\_\_\_\_\_\_\_\_\_\_\_\_\_\_\_\_\_\_\_\_\_\_\_\_\_\_\_\_\_\_\_\_\_\_\_\_\_\_\_\_\_\_\_\_\_\_\_\_\_\_\_\_\_\_\_\_\_\_\_\_\_\_\_\_\_\_

[Official detailed proclamation from the White House regarding Travel Suspension](https://www.whitehouse.gov/presidential-actions/proclamation-suspension-entry-immigrants-nonimmigrants-certain-additional-persons-pose-risk-transmitting-2019-novel-coronavirus/)

\_\_\_\_\_\_\_\_\_\_\_\_\_\_\_\_\_\_\_\_\_\_\_\_\_\_\_\_\_\_\_\_\_\_\_\_\_\_\_\_\_\_\_\_\_\_\_\_\_\_\_\_\_\_\_\_\_\_\_\_\_\_\_\_\_\_\_\_\_\_\_\_\_\_\_\_\_\_\_\_\_\_\_\_\_\_\_\_\_\_\_\_\_\_\_\_\_\_\_\_\_\_\_\_

[All travel from Europe to US suspended for 30 days](https://www.rnz.co.nz/news/national/411566/all-travel-from-europe-to-us-suspended-for-30-days) | RNZ

[In prime-time address, Trump announces all travel from Europe to be restricted for 30 days](https://abcnews.go.com/Politics/president-trump-deliver-prime-time-statement-coronavirus/story?id=69543646&cid=clicksource_4380645_2_heads_hero_live_hero_related) | ABC

[Coronavirus: Trump halts travel from Europe to US](https://www.bbc.com/news/world-us-canada-51846923) | BBC

[Trump will suspend all US travel to and from Europe for next 30 days](https://www.cnn.com/world/live-news/coronavirus-outbreak-03-11-20-intl-hnk/index.html) | CNN

[Trump suspends travel from Europe amid coronavirus pandemic](https://www.nbcnews.com/politics/donald-trump/trump-make-prime-time-address-coronavirus-wednesday-night-n1155941) | NBC

[Trump suspends all travel from Europe to the United States to fight coronavirus](https://www.reuters.com/article/us-health-coronavirus-usa-trump/trump-suspends-all-travel-from-europe-to-the-united-states-to-fight-coronavirus-idUSKBN20Z04U) | Reuters

\_\_\_\_\_\_\_\_\_\_\_\_\_\_\_\_\_\_\_\_\_\_\_\_\_\_\_\_\_\_\_\_\_\_\_\_\_\_\_\_\_\_\_\_\_\_\_\_\_\_\_\_\_\_\_\_\_\_\_\_\_\_\_\_\_\_\_\_\_\_\_\_\_\_\_\_\_\_\_\_\_\_\_\_\_\_\_\_\_\_\_\_\_\_\_\_\_\_\_\_\_\_\_\_

Discuss this announcement and its implications here."	['https://www.whitehouse.gov/presidential-actions/proclamation-suspension-entry-immigrants-nonimmigrants-certain-additional-persons-pose-risk-transmitting-2019-novel-coronavirus/', 'https://www.rnz.co.nz/news/national/411566/all-travel-from-europe-to-us-suspended-for-30-days', 'https://abcnews.go.com/Politics/president-trump-deliver-prime-time-statement-coronavirus/story?id=69543646&cid=clicksource_4380645_2_heads_hero_live_hero_related', 'https://www.bbc.com/news/world-us-canada-51846923', 'https://www.cnn.com/world/live-news/coronavirus-outbreak-03-11-20-intl-hnk/index.html', 'https://www.nbcnews.com/politics/donald-trump/trump-make-prime-time-address-coronavirus-wednesday-night-n1155941', 'https://www.reuters.com/article/us-health-coronavirus-usa-trump/trump-suspends-all-travel-from-europe-to-the-united-states-to-fight-coronavirus-idUSKBN20Z04U']

Leader of U.S. vaccine push says he‘ll quit if politics trumps science	22310	392	2020-09-04 04:04:39	None	None

We need a country filter on this sub please. The sub has grown so much over the last week, which is great however now it has an overwhelming amount of US related posts. We need to remember that people are from all over the world seeking information for many locations. Not a dig just a request please	22266	758	2020-03-04 14:57:15	None	None

I made a dedicated U.S. coronavirus tracker that tells you if you are near confirmed cases, and the real-time count of cases and deaths in your county or state.	22224	1158	2020-03-08 23:12:29	None	None

‘Coronavirus Cooking Survey’ Finds That People Are Eating Healthier and Wasting Less Food	22197	654	2020-06-01 07:05:04	None	None

White House coronavirus adviser says she wishes US had locked down like Italy	22193	799	2020-08-19 01:08:38	None	None

Not a single shipment of medical-grade N95 masks arrived at U.S. ports during the month of March.	22160	1724	2020-04-10 08:26:41	None	None

Britain, France and Germany bypass US sanctions to provide Iran with medical aid	22017	1382	2020-04-01 14:15:04	None	None

"Florida judge denies request to block mask mandate in Palm Beach County, saying: ""We do not have a constitutional or protected right to infect others"""	21992	761	2020-07-27 19:28:18	None	None

Target, Trader Joe's to close on Easter to give employees working during coronavirus a break	21942	530	2020-04-02 01:09:41	None	None

History of Pandemics. (it will be another part of history)	21879	1168	2020-03-18 05:37:06	None	None

Dr. Fauci: Protests are ‘perfect setup’ for coronavirus spread	21765	2176	2020-06-05 19:15:16	None	None

Michigan is on track for COVID-19 containment, northern Michigan looks even better	21758	1137	2020-06-20 16:27:11	None	None

Unlike the United States, more and more countries are making masks mandatory	21714	1349	2020-07-20 16:00:17	None	None

CDC Data Shows 207,000 ‘Excess Deaths’ During Coronavirus Pandemic, Far Eclipsing 160,000 Confirmed Death Count	21708	1409	2020-08-08 18:31:28	None	None

San Francisco mayor says city's PPE orders have been diverted, confiscated: It 'blows my mind'	21669	1839	2020-04-25 08:18:16	None	None

'But there is no coronavirus,' shocked cynic told doctors, waking up in hospital	21649	1100	2020-10-07 14:00:01	None	None

Man gets 1 year in jail for holding large parties against COVID-19 rules	21627	829	2020-09-26 23:56:21	None	None

The U.S Pres.: “It’s important for the young and healthy people to understand that while they may experience mild symptoms, they can easily spread this virus and they will spread it indeed, putting countless others in harms way.”	21548	1960	2020-03-16 23:32:33	None	None

Mounting anger as workers demand protection from unsafe conditions: There is growing outrage among workers in the US and internationally over the fact that they continue to be kept on the job in nonessential industries and workplaces amidst the spreading coronavirus pandemic	21546	2340	2020-03-18 15:43:00	None	None

Dogs Trained to Detect Covid-19 Have 95% Success Rate in Early Trials	21519	606	2020-06-11 19:36:00	None	None

I'm 33 years old, healthy. I'm a runner, never had asthma, never smoked a cigarette. And I still at this point am not fully recovered. I have lingering pneumonia.	21485	1735	2020-05-26 09:10:24	None	None

China hid extent of coronavirus outbreak, US intelligence reportedly says	21348	1362	2020-04-01 20:34:07	None	None

Bill Gates calls U.S. response to COVID-19 crisis ’embarrassing’ compared to other countries	21352	1094	2020-06-27 10:08:00	None	None

Baltimore Mayor Begs Residents To Stop Shooting Each Other So Hospital Beds Can Be Used For Coronavirus Patients	21344	578	2020-03-19 00:57:35	None	None

r/coronavirus is now the fastest growing subreddit with over 100k new subs in the past day. With this growth comes a great burden on the mods and and even greater responsibility to the community to help. I appeal to the new members to help promote the truth and do your part to stop fear mongering	21334	989	2020-03-03 19:28:23	None	None

YouTuber pretends to enter the “Red Zone”, the area in lockdown in Lombardy, declaring that it’s easy to enter and easy to get out without being seen. Italian authorities press charges against him for “dissemination of false news likely to disturb public order”. 3 months of jail time.	21326	563	2020-03-02 22:30:01	None	None

Past Mistakes: The Spanish Flu that started on March 1918 was almost eradicated by December of the same year thanks to global lockdowns; But impatient countries lifted their lockdowns too soon, which resulted in a 3rd wave of the virus to hit, infected & killed thousands more and lasted until 1920.	21243	1079	2020-04-02 21:20:05	None	None

‘You are not listening,’ Fauci tells Sen. Rand Paul during a Senate hearing on the coronavirus	21248	999	2020-09-23 22:28:09	None	None

Workers who self-quarantine for coronavirus can sue employer if they’re fired, Case Western law professor says	21146	690	2020-03-18 20:48:25	None	None

Sen. Ron Johnson tests positive for COVID-19	21013	230	2020-10-03 17:16:57	None	None

Man Punches Teen Sesame Place Worker Who Reminded Him to Wear Mask, Police Say — The teen suffered a jaw injury and a damaged tooth	21010	920	2020-08-11 04:45:25	None	None

Texas, which began to open its businesses at the beginning of May, sees 1,000 new coronavirus cases 5 days in a row	20987	2532	2020-05-13 18:06:16	None	None

New Zealand introduces $300 instant fines for not wearing a mask on public transport	20966	655	2020-08-28 01:29:30	None	None

Doctor Runs 22 Miles Wearing Face Mask to Show it Doesn't Cut Oxygen Levels	20922	791	2020-07-24 06:04:38	None	None

Teachers Union OKs Strikes If Schools Reopen Without Safety Measures In Place	20824	979	2020-08-06 13:41:44	None	None

