title	score	num_comm	created	content	sources
U.S. Senator Ted Cruz says he will be staying home this week after a person he had a brief interaction with at CPAC tested positive for coronavirus	20734	767	2020-03-09 03:13:19	None	None

More than 40 employees lived at their plant for 28 days to make material to protect health care workers	20728	283	2020-04-21 19:11:01	None	None

China may have prevented 95% of virus cases if it acted on silenced whistleblower's warning	20621	784	2020-03-14 17:41:09	None	None

Naples, Florida to close beaches “until further notice” after re-opening earlier this week due to large crowds refusing to follow CDC’s social distancing/safety guidelines.	20498	1231	2020-05-10 05:00:31	None	None

80 Percent Of LA County Restaurants And Bars Are Not Following Coronavirus Guidelines	20462	716	2020-06-27 23:26:43	None	None

Iceland’s mass testing finds half of carriers show no symptoms	20447	1300	2020-03-25 19:31:09	None	None

Walmart enacts emergency leave policy for 1.4 million hourly workers. Allows for 2 wks paid time off for infection or quarantine	20435	851	2020-03-11 01:10:57	None	None

"Dr. Ashish Jha calls for a national quarantine. ""We have two choices ... we can either have a national quarantine now ... or we can not – wait another week, and when things look really terrible, be forced into it."""	20381	1646	2020-03-17 16:42:36	None	None

In-person voting was likely a 'disaster' for Wisconsin's efforts to flatten coronavirus curve, national experts say	20335	172	2020-04-09 18:54:09	None	None

After anonymous tip, 17 bodies found at nursing home hit by virus.	20314	926	2020-04-16 04:56:43	None	None

A Nurse Bought Protective Supplies for Her Colleagues Using GoFundMe. The Hospital Suspended Her.	20317	831	2020-04-07 19:09:10	None	None

College Students aged 18-24 who have been claimed as a dependent will not receive stimulus checks	20284	3295	2020-03-28 05:22:18	None	None

Dr. Anthony Fauci warns US could ‘be in for a bad fall’ if coronavirus treatments don’t work	20192	2004	2020-04-28 18:57:38	None	None

If Most Of Your Coronavirus Tests Come Back Positive, You're Not Testing Enough	20042	698	2020-03-31 20:31:54	None	None

Gresik residents made to dig graves as punishment for not wearing face masks - National	20005	679	2020-09-14 03:55:40	None	None

Lower cognitive ability linked to non-compliance with social distancing guidelines during the coronavirus outbreak	19984	1261	2020-07-11 18:19:31	None	None

"Chinese doctor in Italy say:the lockdown are not yet tight. People don't wear masks, there are still too many people around, public transport is still active and dinners and parties in restaurants and hotels. ""It is time to close economic activities prohibit the movement of people.We must hurry."""	19982	2514	2020-03-20 06:30:11	None	None

Sophie Trudeau has tested positive for Coronavirus	19913	1506	2020-03-13 05:50:11	None	None

The COVID-19 official death toll has now exceeded the maximum death toll estimate for the 2009 Swine Flu pandemic, making the current pandemic the most severe within the 21st century	19843	816	2020-07-14 07:13:00	None	None

Millions of Americans could lose their electricity as COVID-19 shutoff moratoriums expire	19789	1170	2020-08-28 21:02:20	None	None

Italy reports another 793 deaths in past day in world's worst coronavirus crisis	19780	2017	2020-03-21 21:06:10	None	None

We have now surpassed 300.000 cases worldwide. Only 3 days after we reached 200.000 cases	19736	1848	2020-03-21 22:11:42	None	None

Coronavirus deaths in the US top 45,000, doubling in a week	19712	2632	2020-04-22 06:13:05	None	None

Lana Del Rey criticized for wearing mesh mask while meeting fans at book signing	19548	1277	2020-10-06 08:55:51	None	None

Narcissistic personalities linked to defiance of coronavirus prevention guidelines and hoarding	19519	660	2020-07-22 00:44:23	None	None

Not 40 but 107 infected with COVID after Frankfurt Church service	19510	910	2020-05-24 17:36:57	None	None

Several states in Mexico are running out of death certificates due to COVID surges, 1.1 million additional certificates have been ordered in preparation - Bloomberg, Sept 5th, 2020	19499	763	2020-09-06 01:31:28	None	None

Korea finished developing the 10 minute Covid-19 diagnostic kit and is now ramping up production. They plan to export 300.000 test-kits per week	19491	821	2020-03-22 20:39:37	None	None

"""I'm sorry if feelings are hurt but people need information."" After witnessing the magnitude of uncertainty while shopping at Walmart, Central Florida Sheriff chooses to reveal the cities of presumptive/confirmed cases since the FDH refuses to. He is encouraging other authorities to do the same."	19475	1110	2020-03-14 20:41:01	None	None

Oil Companies Are Collapsing Due to Coronavirus, but Wind and Solar Energy Keep Growing	19457	704	2020-04-08 15:46:59	None	None

States accused of manipulating COVID-19 statistics to make situation look better	19427	1041	2020-05-20 02:18:30	None	None

Half of all 19-24 year old men in the UK have met friends or family members they do not live with during lockdown, compared to a quarter of women the same age	19432	1542	2020-05-09 14:19:52	None	None

Anesthesiologist Retrofits Ventilator, Now Usable for 9 Patients SIMULTANEOUSLY	19281	774	2020-03-21 17:04:39	None	None

NEW: Vietnam has reached 1 month without community transmission of coronavirus	19287	715	2020-10-03 18:13:47	None	None

Half of All Covid Tests Are Positive in Mexico, Highest in the World	19227	627	2020-07-02 02:07:01	None	None

Revealed: Amazon told workers paid sick leave law doesn't cover warehouses	19175	1115	2020-05-07 15:57:55	None	None

South Australia has reached 6 days straight with zero new cases, now down to only 14 active cases.	19153	768	2020-04-28 10:29:54	None	None

Truckers and grocery store employees could take home $25K in COVID-19 hazard pay under new ‘hero’ proposal	19091	1289	2020-04-07 22:22:13	None	None

From an ER doc in NYC today: “Today. Is. F’ing. Nuts. It kinda blew up here. And sending home lots of people undoubtedly positive because we don’t test on discharged patients. This has been spreading a long time.”	18999	1740	2020-03-17 04:17:54	None	None

GM’s CEO Offers to Make Ventilators in WWII-Style Mobilization	18910	1004	2020-03-19 02:47:11	None	None

Danish doctors message to everyone. Stay home please.	18859	347	2020-03-20 17:37:13	None	None

Texas school superintendent diagnosed with COVID-19 dies at 46	18741	1474	2020-08-06 06:27:51	None	None

“I Have No Ideology. My Ideology Is Health”: Dr. Anthony Fauci on the Tactics of Dealing With the Novel Coronavirus	18726	765	2020-04-01 02:00:11	None	None

Signs of depression have tripled in the U.S. since the COVID-19 pandemic got underway	18664	1003	2020-09-06 23:37:52	None	None

Between COVID-19 and layoffs, schools may not have enough teachers to get through the year	18637	935	2020-09-03 17:19:21	None	None

German Company Curevac doesn't want exclusive deal with the U.S. for potential vaccine against Covid-19 but rather develop it for all countries.	18616	118	2020-03-15 21:11:33	None	None

Instacart Workers Are Going on a Massive Strike Next Week: beginning March 30, workers will refuse to accept orders until Instacart concedes to a list of terms regarding coronavirus safety and sick leave.	18598	754	2020-03-28 04:47:52	None	None

After a suspected case from a northern village in Lebanon tested negative for coronavirus, literally 100s went to congratulate him and his family. The man later tested positive.	18590	519	2020-03-20 13:26:30	None	None

United States now has more than 300,000 confirmed cases (just 3 days after reaching 200,000) and more than 8,000 deaths	18553	1751	2020-04-04 21:58:52	None	None

Grand Canyon closes after Navajo Nation pleaded for weeks to stop tourists infecting them	18484	370	2020-04-04 02:03:58	None	None

You can help scientists beat coronavirus by playing this puzzle on Fold.it	18388	684	2020-03-03 12:22:22	None	None

Senate Democrats propose canceling $10,000 in student debt for all borrowers amid coronavirus	18331	1801	2020-03-19 23:40:23	None	None

Kutztown University professor regrets telling students to seek out COVID-19, 'get it over with' — Dr. Victor Massad says he's mulling retirement after 'huge lapse of judgment'	18287	694	2020-08-29 15:05:23	None	None

Over the past 24 hours, the U.S. reported 14,024 new cases of coronavirus and 265 new deaths, raising the total to 68,347 cases and 1,037 dead	18233	2666	2020-03-26 07:23:56	None	None

One State Is Requiring Its Students to Get Flu Vaccine by End of Year — and, Yes, It’s Legal	18159	427	2020-08-20 03:24:15	None	None

Portuguese government has decreed that all asylum seekers and all undocumented migrants with pending applications for residence are automatically granted and may access healthcare and benefits.	18153	797	2020-03-28 16:06:13	None	None

'Archbishop' of Florida church selling bleach 'miracle cure' arrested with son	18148	481	2020-08-12 21:29:15	None	None

4 In 5 Americans Want Cities Quarantined In Case Of Coronavirus Outbreak	18044	1967	2020-03-02 21:36:09	None	None

Nurses read names of colleagues who died of COVID-19 in protest outside White House	18040	273	2020-04-22 00:17:32	None	None

"75 women graduating today from Korea's National Army Nursing Academy will head immediately to Covid-19 epicenter Daegu, where nurses have been quitting en masse. ""My grandpa put his life on the line as a medic during the Korean War. For our citizens and servicemen, I'm willing to do the same now."""	17999	479	2020-03-03 07:15:21	None	None

Excellent news - 2 days in a row of fewer new Coronavirus cases in Italy!	17986	1057	2020-03-23 21:24:18	None	None

We Still Don't Know All the Long-Term Consequences of 'Mild' COVID-19	17944	353	2020-08-24 16:08:35	None	None

Alarm as FDA willing to issue Covid-19 vaccine before stringent safety testing	17895	1545	2020-08-31 11:20:38	None	None

Germany has performed a million tests so far, 93% negative	17809	928	2020-04-04 19:52:53	None	None

"Live animal ""wet markets"" in New York City face protests amid coronavirus pandemic"	17769	1345	2020-05-09 16:47:43	None	None

Turning Point USA deletes anti-mask meme after co-founder dies of coronavirus complications	17763	593	2020-07-30 20:51:56	None	None

'She was always there’: A nurse who brightened the hospital ward died alone, stricken by covid | Lisa Ewald, 53, told friends she wasn’t allowed to wear a mask at the Detroit hospital where she worked	17717	546	2020-06-13 06:31:57	None	None

Governor Cuomo: “Facts are empowering. Even when the facts are discouraging, not knowing the facts is worse. I promise that I will continue to give New Yorkers all the facts, not selective facts.”	17715	799	2020-03-26 19:42:29	None	None

Passengers Clap as Woman Kicked off Flight for Refusing to Wear Face Mask	17699	680	2020-07-24 01:09:34	None	None

Fauci: 'If it looks like you're overreacting you're probably doing the right thing'	17681	674	2020-03-15 20:29:25	None	None

Drive-in movie theaters are making a comeback thanks to the coronavirus	17666	580	2020-05-24 20:26:03	None	None

Obit of Texas man who died of COVID-19 includes ominous warning - “Dave did everything he was supposed to do, but you did not,” the obit reads. “Shame on you and may Karma find you all!”	17549	799	2020-08-04 08:49:58	None	None

Oregon to require masks everywhere indoors starting July 1	17482	724	2020-06-30 06:43:32	None	None

"GameStop just told its staff to keep their stores open even during state lockdowns, and to tell law enforcement that it's OK because they're ""essential retail"""	17464	1369	2020-03-20 01:30:38	None	None

Fines tripled, trains canceled in Salem ahead of Halloween to discourage crowds during COVID pandemic	17455	578	2020-10-22 15:47:40	None	None

8 in 10 Americans would wait to resume activities after government lifts coronavirus restrictions: poll	17446	1176	2020-04-14 15:49:51	None	None

CDC advises booting travelers who refuse to wear masks on planes, trains, buses, other transportation	17393	625	2020-10-20 01:54:47	None	None

Finland reports zero new infections today (2600 tests) for the first time since March (translation in comments)	17390	340	2020-06-04 14:49:41	None	None

Germany has a remarkably low coronavirus death rate — thanks largely to mass testing, but also culture, luck, and an impressive healthcare system	17381	885	2020-03-28 17:43:35	None	None

First U.S coronavirus case of unknown origin confirmed in Northern California, a sign the virus may be spreading in a local area	17342	1628	2020-02-27 02:51:50	None	None

‘We hear you, dad': A daughter stays on the phone for hours and hours as her father dies alone from coronavirus	17295	453	2020-04-19 18:21:33	None	None

Detroit health care worker dies after being denied coronavirus test 4 times, daughter says	17302	170	2020-04-25 19:38:57	None	None

Japanese students hold graduation ceremony in Minecraft amid school cancellation	17284	211	2020-03-16 16:15:40	None	None

Drugmaker caps insulin costs at $35 to help diabetes patients during Coronavirus pandemic	17268	436	2020-04-08 04:43:37	None	None

US reports most coronavirus deaths in one day as 1,224 die on Saturday	17269	2095	2020-04-05 05:51:01	None	None

Spread is slowing down in Italy. Today +13% cases, the lowest ever.	17226	825	2020-03-16 22:12:24	None	None

Volunteers 3D-Print Unobtainable $11,000 Valve For $1 To Keep Covid-19 Patients Alive; Original Manufacturer Threatens To Sue	17206	1014	2020-03-18 02:46:28	None	None

Nearly 11,000 people have been exposed to the coronavirus on flights, the CDC says	17155	1068	2020-09-20 16:43:28	None	None

Television stations owned by Sinclair Broadcast Group are set to air discredited conspiracy theory doc over the weekend that suggests Dr. Anthony Fauci, the nation's top expert on infectious diseases, was responsible for the creation of the coronavirus.	17144	1381	2020-07-25 18:07:00	None	None

Coronavirus killing three times more people than flu and pneumonia combined	17045	660	2020-10-08 13:25:21	None	None

Maryland Man Arrested for Having 60 People Over for Bonfire, Violating Social Distancing Orders	17037	686	2020-03-29 10:38:16	None	None

The U.S. has had the equivalent of 12 plane crashes a day for two months, but little sense of grief	17039	1213	2020-05-23 04:40:30	None	None

25,000 people now skiing in Sweden, organizers putting together after-ski parties for 499 people, getting around national ban on gatherings of 500+. Locals putting signs up at train station saying, “Think of those of us who live here, you egomaniacs.” (in Swedish)	17015	1104	2020-03-21 21:38:03	None	None

‘Women Will Not Be Forced to Be Alone When They Are Giving Birth’ | Gov. Andrew M. Cuomo will issue an executive order mandating that hospitals allow partners in delivery rooms	17016	1000	2020-03-28 23:43:41	None	None

Italy is registering 1 death due to coronavirus every 4 minutes	16981	1671	2020-03-16 04:53:45	None	None

Ex-N.J. Gov. Chris Christie remains hospitalized for COVID-19	16904	937	2020-10-07 16:48:02	None	None

Dr. Fauci says pause on trial is 'not uncommon at all' after major coronavirus vaccine trial placed on hold	16879	559	2020-09-09 18:56:03	None	None

Ab8 COVID-19 Drug Breakthrough: Tiny Antibody Component Completely Neutralizes the SARS-CoV-2 Virus	16829	597	2020-09-15 17:18:34	None	None

JAMA: Taiwan has tested every resident with unexplained flu-like symptoms for COVID-19 since Jan. 31, and tests every traveler with fever or respiratory symptoms. Taiwan has had only one death from COVID-19.	16816	786	2020-03-12 14:31:58	None	None

Surgeon general: 'This is going to be the hardest and the saddest week of most Americans' lives'	16803	2636	2020-04-05 17:35:06	None	None

Two makeshift hospitals in Wuhan to be closed today with further two being closed tomorrow due to all patients successfuly recovering	16743	913	2020-03-07 15:54:43	None	None

Bill Gates on coronavirus: We need an 'extreme shutdown' of 6 to 10 weeks	16738	1541	2020-03-27 10:05:38	None	None

Positive COVID-19 test rates top 25% in some U.S. Midwest states	16641	1153	2020-09-28 02:28:59	None	None

Argentina: a married woman came back from Spain with symptoms, met with a 'friend' and had sex. The 'friend' then returned to his hometown and went to a party with about 20 people. This resulted in the entire town of 2500 people being put in quarantine, as well as the woman and her husband.	16594	939	2020-03-17 23:54:53	None	None

How the Sturgis Motorcycle Rally may have spread coronavirus across the Upper Midwest	16570	910	2020-10-18 03:09:59	None	None

A distillery in Minnesota converted from making alcohol to making hand sanitizer. They're giving it away free.	16525	308	2020-03-19 15:23:36	None	None

"Dee Snider blasts unmasked protesters for using ""We’re Not Gonna Take It"""	16491	409	2020-09-20 06:07:14	None	None

Doctor's message to her kids: 'If they lose me to COVID I want them to know Mommy tried really hard'	16423	459	2020-04-03 21:44:11	None	None

Bolsonaro experiencing Covid-19 symptoms, says CNN Brazil	16408	147	2020-07-07 03:15:20	None	None

Til in 2018, the CDC had to cut its global disease prevention preparedness by 80%	16347	417	2020-03-13 17:48:24	None	None

We are a team of medical experts following COVID-19's progression closely. Ask Us Anything.	16344	4151	2020-03-04 19:06:36	"News about the coronavirus outbreak that started in Wuhan, China, is changing rapidly. Our team of experts are here to break down what we know and how you can stay safe.

Answering questions today are:

* Neha Pathak, MD, DipABLM: [https://www.webmd.com/neha-pathak-md](https://www.webmd.com/neha-pathak-md)
* Hansa Bhargava, MD: [https://www.webmd.com/hansa-bhargava](https://www.webmd.com/hansa-bhargava)
* Brenda Goodman, reporter: [https://www.webmd.com/brenda-goodman](https://www.webmd.com/brenda-goodman)
* Michael Mina, MD, PhD: [https://ccdd.hsph.harvard.edu/people/michael-mina/](https://ccdd.hsph.harvard.edu/people/michael-mina/)
* Isaac Bogoch, MD, SM, FRCPC: [https://www.uhnresearch.ca/researcher/isaac-bogoch](https://www.uhnresearch.ca/researcher/isaac-bogoch)
* More about Carlos del Rio, MD: [http://vaccines.emory.edu/faculty-evc/primary-faculty/del\_rio\_carlos.html](http://vaccines.emory.edu/faculty-evc/primary-faculty/del_rio_carlos.html)
* More on WebMD's coronavirus coverage: [https://www.webmd.com/lung/news/20200124/coronavirus-2020-outbreak-latest-updates](https://www.webmd.com/lung/news/20200124/coronavirus-2020-outbreak-latest-updates)
* Proof: [https://twitter.com/WebMD/status/1233482007897923584](https://twitter.com/WebMD/status/1233482007897923584)

**Edit:** We are signing off! Thank you for joining us. "	['https://www.webmd.com/neha-pathak-md', 'https://www.webmd.com/hansa-bhargava', 'https://www.webmd.com/brenda-goodman', 'https://ccdd.hsph.harvard.edu/people/michael-mina/', 'https://www.uhnresearch.ca/researcher/isaac-bogoch', 'http://vaccines.emory.edu/faculty-evc/primary-faculty/del_rio_carlos.html', 'https://www.webmd.com/lung/news/20200124/coronavirus-2020-outbreak-latest-updates', 'https://twitter.com/WebMD/status/1233482007897923584']

Millennials and the Economy: Coronavirus Is the Second Setback in a Generation	16335	1444	2020-09-30 15:18:02	None	None

White House rejects bailout for U.S. Postal Service battered by coronavirus	16320	533	2020-04-11 20:42:20	None	None

James Dyson designed a new ventilator in 10 days. He's making 15,000 for the pandemic fight	16268	734	2020-03-26 17:20:45	None	None

Zookeepers self-isolate in a wildlife park for 12 weeks to look after the animals	16234	253	2020-03-31 06:23:16	None	None

‘How is this possible? What are the odds?’ | The novel coronavirus put two teenage brothers on life support, shaking a Virginia family.	16220	1093	2020-08-24 02:57:58	None	None

Teenager issued with huge £10,000 fine for hosting house party in Lenton	16188	792	2020-09-13 16:32:53	None	None

Majority of Americans say that federal government not doing enough to prevent second wave of virus: poll shows	16169	928	2020-05-12 21:57:55	None	None

Landlord says he won't collect rent because of coronavirus outbreak, urges others to do the same	16119	947	2020-03-16 18:42:20	None	None

Norway enters third day without deaths, no exponential growth.	16101	836	2020-03-22 16:30:14	None	None

Yale’s rapid COVID-19 saliva test receives FDA emergency use authorization	16099	479	2020-08-16 05:22:57	None	None

Fauci warns against rush to reopen and asks 'how many deaths are you willing to accept?'	16050	1903	2020-05-05 19:09:16	None	None

Even though there are no confirmed cases of Covid-19, El Salvador declares national quarantine, forbids anyone but Salvadoran nationals or diplomats to enter the country and closes all schools and universities for the next three weeks.	16031	500	2020-03-12 03:01:50	None	None

Brazil’s Jair Bolsonaro has tested positive for coronavirus - CNN Brazil	16022	121	2020-07-07 19:15:28	None	None

'We're heroes, too:' Hospital janitors risk lives to stop spread of COVID-19	15927	259	2020-06-16 00:49:59	None	None

California Governor Orders Second Shutdown of Restaurants	15924	1063	2020-07-07 04:19:23	None	None

Similarly to Patient 31 in South Korea, one reckless infected person was solely responsible for a major Covid19 infection in Uruguay. She was not feeling well after coming home from Italy and Spain and still attended a wedding on March 7th with 500 other people. She is currently being sued. [ENG]	15881	617	2020-03-20 04:00:25	None	None

Denver requires mask-wearing outdoors, limits gathering to five people as coronavirus cases rise	15882	707	2020-10-17 00:18:21	None	None

1.2 Million member we can do this guys. Open source 3d printed ventilator.	15847	712	2020-03-18 05:44:58	None	None

Sailors cheer Navy captain who was removed after pleading for help with coronavirus outbreak	15805	962	2020-04-03 17:01:28	None	None

Restaurant staffers in quarantine after working Τrump fundraiser	15720	315	2020-10-06 18:20:36	None	None

"CA Governor Gavin Newsom tells reporters @ElonMusk has delivered a thousand ventilators to the system today. ""They arrived in Los Angeles, and Elon Musk is already working with a hospital association and others to get those ventilators out in real time, it’s an heroic effort."""	15709	1079	2020-03-24 05:02:24	None	None

The True Coronavirus Toll in the U.S. Has Already Surpassed 200,000	15692	935	2020-08-13 09:27:05	None	None

The United States surpasses 80,000 COVID-19 Deaths	15652	2419	2020-05-10 03:07:06	None	None

“Nationwide, 200,700 more people have died than usual from Mar 15 to Jul 25, according to CDC estimates, which adjust current death records to account for typical reporting lags..54,000 higher than the official count of coronavirus deaths for that period.”	15626	978	2020-08-08 14:06:36	None	None

Smash Mouth plays to packed crowds at Sturges Ralley: Not the sharpest tool in the shed	15599	1118	2020-08-12 17:09:26	None	None

In just a single day, one thousand retired and private practice doctors and nurses answered City Hall’s cry for help, volunteering to join the Big Apple’s medical reserve and help treat their fellow New Yorkers stricken with coronavirus.	15599	346	2020-03-19 06:48:59	None	None

No COVID-19 bailouts for firms that use tax havens, Prime Minister Justin Trudeau says	15558	393	2020-04-29 06:26:36	None	None

Young and unafraid of the coronavirus? Good for you. Now stop killing people - Newsweek	15532	1504	2020-03-12 00:57:19	None	None

More than 11,000 children test positive for coronavirus in Florida	15483	1806	2020-07-10 22:53:00	None	None

Vitamin D determines severity in COVID-19 so government advice needs to change, experts urge	15477	1449	2020-05-25 02:50:05	None	None

New Zealand records four new cases of COVID-19	15470	1393	2020-08-11 13:38:59	None	None

France: Re-tested blood of 24 patients treated in December for pneumonia finds Covid-positive	15397	1087	2020-05-03 23:12:32	None	None

