title	score	num_comm	created	content	sources

Even if COVID-19 is unavoidable, delaying infections can flatten the peak number of illnesses to within hospital capacity and significantly reduce deaths.	133747	4438	2020-03-10 22:04:01	None	None

"Gino Fasoli was 73 years old. He was italian and he was a family doctor and an emergency room manager. In Africa they even kidnapped him to cure the sick. Then he retired. Days ago he received a phone call: ""Can you help us out?"".He came back. He was infected by Covid-19. He died like a true hero."	122967	1841	2020-03-22 19:41:45	None	None

Irish people help raise 1.8 million dollars for Native American tribe badly affected by Covid-19 as payback for a $150 donation by the Choctaw tribe in 1847 during the Irish Potatoe famine	122477	2356	2020-05-05 01:41:23	None	None

Arnold Schwarzenegger backs California face-mask order: ‘Anyone making it a political issue is an absolute moron’	115209	2940	2020-06-19 05:20:08	None	None

How to stop a virus from spreading	110034	2208	2020-03-22 21:38:24	None	None

All 11 Coronavirus patients in Greenland have now recovered. It is now the only affected country/territory with no active cases.	106705	2478	2020-04-09 00:14:57	None	None

An Italian hospital ran out of ICU valves. A local biz brought a 3D printer to the hospital, redesigned & produced the valves in a few hours. “At the time of writing, 10 patients are accompanied in breathing by a machine that uses a 3D printed valve.”	101347	1402	2020-03-16 05:52:17	None	None

Mark Cuban says bailed out companies should never be allowed to buy back their stocks ever again	101275	1284	2020-03-19 04:42:24	None	None

If you can’t wear a mask due to “medical” reasons, airlines are now telling these passengers to find alternate travel arrangements.	97727	3766	2020-07-24 01:24:12	None	None

Governor Cuomo: “My mother is not expendable. Your mother is not expendable. We will not put a dollar figure on human life. We can have a public health strategy that is consistent with an economic one. No one should be talking about social darwinism for the sake of the stock market.”	95140	3679	2020-03-24 19:44:13	None	None

Let’s be clear. Again. The virus does not spread. You spread it. Stay at home. Hospitals are not the solution. They are the war zone. Only you can defeat this disease. Stay at home. This is not flu. There is no cure. Stay at home. People are dying. Stay at home.	93184	3308	2020-03-23 21:57:55	None	None

Kentucky church fills Easter service to near capacity, while cops wait in parking lot with 14-day quarantines for all.	92487	3648	2020-04-13 00:10:28	None	None

101 year old man, born during the Spanish flu, has beaten Covid-19 in Italy	91081	1455	2020-03-26 18:13:28	None	None

Starbucks Employees Are Begging the Company to Shut Down Stores Because of Coronavirus: ‘Coffee Is Not Essential’	90070	6146	2020-03-19 17:45:18	None	None

Walmart says all customers will be required to wear face masks from Monday	89345	5667	2020-07-15 18:27:59	None	None

I’m Bill Gates, co-chair of the Bill & Melinda Gates Foundation. AMA about COVID-19.	87479	11710	2020-03-18 20:46:12	"Over the years I’ve had a chance to study diseases like influenza, Ebola, and now COVID-19—including how epidemics start, how to prevent them, and how to respond to them. The Gates Foundation has committed up to $100 million to help with the COVID-19 response around the world, as well as $5 million to support our home state of Washington.

I’m joined remotely today by [Dr. Trevor Mundel](https://www.gatesfoundation.org/Who-We-Are/General-Information/Leadership/Executive-Leadership-Team/Trevor-Mundel), who leads the Gates Foundation’s global health work, and [Dr. Niranjan Bose](https://www.linkedin.com/in/niranjan-bose-014b00/), my chief scientific adviser.

Ask us anything about COVID-19 specifically or epidemics and pandemics more generally.

LINKS:

My thoughts on preparing for the next epidemic in 2015: [https://www.gatesnotes.com/Health/We-Are-Not-Ready-for-the-Next-Epidemic](https://www.gatesnotes.com/Health/We-Are-Not-Ready-for-the-Next-Epidemic)

My recent New England Journal of Medicine article on COVID-19, which I re-posted on my blog:

[https://www.gatesnotes.com/Health/How-to-respond-to-COVID-19](https://www.gatesnotes.com/Health/How-to-respond-to-COVID-19)

An overview of what the Gates Foundation is doing to help: [https://www.gatesfoundation.org/TheOptimist/coronavirus](https://www.gatesfoundation.org/TheOptimist/coronavirus)

Ask us anything…

**Proof:**  [https://twitter.com/BillGates/status/1240319616980643840](https://twitter.com/BillGates/status/1240319616980643840)

**Edit**: Thanks for all of the thoughtful questions. I have to sign off, but keep an eye on [my blog](https://nam03.safelinks.protection.outlook.com/?url=https%3A%2F%2Fwww.gatesnotes.com%2F&data=02%7C01%7Cmeghan.groob%40gatesventures.com%7C89f158e82b9341664f3508d7c6de5283%7Ce38fdd56dd644d67b048e7c0ae321d11%7C0%7C0%7C637196530525855013&sdata=YtACH%2BwpPIG873%2FASg1mndyBEZr7SLbfOf5EIN9HYkg%3D&reserved=0) and [the foundation’s website](https://nam03.safelinks.protection.outlook.com/?url=https%3A%2F%2Fwww.gatesfoundation.org%2FTheOptimist%2Fcoronavirus&data=02%7C01%7Cmeghan.groob%40gatesventures.com%7C89f158e82b9341664f3508d7c6de5283%7Ce38fdd56dd644d67b048e7c0ae321d11%7C0%7C0%7C637196530525864971&sdata=VyEWUuDy6rZ8izGpate%2BhBd7SGCnADw6ywxsqBDuVW4%3D&reserved=0) for updates on our work over the coming days and weeks, and [keep washing those hands](https://www.reddit.com/r/perfectloops/comments/fku0ei/keep_washing_those_hands_a/).

&#x200B;"	['https://www.gatesfoundation.org/Who-We-Are/General-Information/Leadership/Executive-Leadership-Team/Trevor-Mundel', 'https://www.linkedin.com/in/niranjan-bose-014b00/', 'https://www.gatesnotes.com/Health/We-Are-Not-Ready-for-the-Next-Epidemic', 'https://www.gatesnotes.com/Health/How-to-respond-to-COVID-19', 'https://www.gatesfoundation.org/TheOptimist/coronavirus', 'https://twitter.com/BillGates/status/1240319616980643840', 'https://nam03.safelinks.protection.outlook.com/?url=https%3A%2F%2Fwww.gatesnotes.com%2F&data=02%7C01%7Cmeghan.groob%40gatesventures.com%7C89f158e82b9341664f3508d7c6de5283%7Ce38fdd56dd644d67b048e7c0ae321d11%7C0%7C0%7C637196530525855013&sdata=YtACH%2BwpPIG873%2FASg1mndyBEZr7SLbfOf5EIN9HYkg%3D&reserved=0', 'https://nam03.safelinks.protection.outlook.com/?url=https%3A%2F%2Fwww.gatesfoundation.org%2FTheOptimist%2Fcoronavirus&data=02%7C01%7Cmeghan.groob%40gatesventures.com%7C89f158e82b9341664f3508d7c6de5283%7Ce38fdd56dd644d67b048e7c0ae321d11%7C0%7C0%7C637196530525864971&sdata=VyEWUuDy6rZ8izGpate%2BhBd7SGCnADw6ywxsqBDuVW4%3D&reserved=0', 'https://www.reddit.com/r/perfectloops/comments/fku0ei/keep_washing_those_hands_a/']

White House advisor Dr. Fauci works 20-hour days and his wife reminds him to eat, sleep and drink water	85070	2910	2020-04-02 22:12:17	None	None

"Woman who designed Florida's COVID-19 dashboard has been removed from her position for refusing to ""manually change data to drum up support for the plan to reopen."""	84930	152	2020-05-19 06:10:01	None	None

Shopper who coughed on a cancer patient at Florida Pier 1 arrested on assault charge	84004	2606	2020-08-03 22:57:05	None	None

Arrest warrant issued for Tampa megachurch pastor for 'violating public health' orders with packed Sunday service	83579	1649	2020-03-30 21:31:52	None	None

Woman who purposefully coughed on $35K worth of grocery store food charged with four felonies	83446	2251	2020-03-27 23:12:50	None	None

"Man Who Called COVID a ‘Hoax’ Feels Guilty After He and 13 Family Members Test Positive — and 2 Die: ""The feeling that I have is kind of like what, I would say, a drunk driver would have if they killed their family,"" says Tony Green, who hosted the family gathering that led to their infections."	82038	5111	2020-10-14 16:07:02	None	None

Bill Gates says the US missed its chance to avoid coronavirus shutdown and businesses should stay closed	81418	3084	2020-03-24 22:20:07	None	None

Richard Burr sued for dumping stocks ahead of coronavirus panic	80616	1419	2020-03-25 17:37:46	None	None

"Bill Gates blames social media platforms for COVID-19 spread in U.S. The ""crazy ideas"" include misinformation convincing people to not wear masks, and conspiracy theories about vaccines to combat the disease."	80554	4102	2020-07-04 17:50:31	None	None

Hackers leak thousands of coronavirus research papers which were hidden behind paywalls	80164	2208	2020-04-15 05:45:23	None	None

For the first time in US history, every state is under a disaster declaration simultaneously	79454	3008	2020-04-11 22:41:29	None	None

President Donald Trump says he has tested positive for coronavirus	79238	9974	2020-10-02 08:58:13	None	None

Data shows Amazon raised prices during pandemic alongside sellers accused of price gouging	79180	2333	2020-03-28 16:22:45	None	None

Trump says he asked for coronavirus testing to be slowed down because there were so many cases	78912	1674	2020-06-21 04:52:59	None	None

White House blocks CDC from testifying on reopening schools next week	78810	4321	2020-07-18 02:18:22	None	None

Florida shatters records with over 10,000 new COVID-19 cases in single day	78552	6547	2020-07-02 18:50:47	None	None

Joe Biden has tested negative for coronavirus	77317	2106	2020-10-02 20:14:32	None	None

Connecticut issues an executive order. Essential employees who contracted covid19 are presumed to have contacted it at work and qualify for Workers Comp benefits	76347	1439	2020-08-19 16:23:41	None	None

Georgia second grader tests positive for coronavirus after attending the first day of school	75334	4420	2020-08-05 15:36:33	None	None

A mother of four died after coronavirus spread through her 911 dispatch center. Her mom died, also. Emergency 911 operators are some of the invisible first responders who couldn't sit home in self isolation when COVID-19 began to spread. Let's not forget them. Nikima Thompson, age 41.	74911	1044	2020-06-04 01:16:51	None	None

Mitt Romney: Every American adult should immediately receive $1,000 to help ensure families and workers can meet their short-term obligations and increase spending in the economy.	74345	3535	2020-03-16 19:58:19	None	None

I'd like to take a moment to thank all of the grocery store employees for remaining strong during these times of uncertainty. Many of us underappreciated and underacknowledge the sacrifice that these individuals are taking every day to ensure the health and safty of the American people.	74309	2294	2020-03-19 21:22:48	None	None

Facebook Will Remove Content Organizing Protests Against Stay-at-Home Orders, Zuckerberg Says	73921	2939	2020-04-20 20:46:44	None	None

Fr. Giuseppe Berardelli, has died from the coronavirus. He refused a ventilator, saying it should rather be given to someone younger than him. He was 72 years old, from Bergamo.	73351	1764	2020-03-24 03:54:10	None	None

As expected, Pornhub offers free Premium access to all Italian residents and donates all of March profits.	73165	1577	2020-03-12 15:18:23	None	None

Italy: Surgeon, anesthesiologist and nurse have risked being infected by a man, he has tested positive for coronavirus. He hid his symptoms, fearing that the rhinoplasty would be postponed. He's now risks 12 years in prison for an aggravated epidemic	72715	1447	2020-03-17 18:36:26	None	None

Maryland governor says coronavirus tests acquired from South Korea under guard at undisclosed location to protect the tests from seizure by federal government	71761	1413	2020-04-30 23:41:40	None	None

Missouri Walmart Coronavirus Licker Charged With 'Terrorist Threat'	71708	1858	2020-03-25 02:21:38	None	None

Private Jet with US tourists rejected at Italy’s borders	71515	2638	2020-07-03 21:13:48	None	None

South Korea was doing a fantastic job of controlling #COVIDー19 for the first 30 patients. Then #Patient31 came along, did not adhere to social distancing and caused 2 clusters that were responsible for 80% of South Korea's infections. Don't be #Patient31.	71207	2240	2020-03-15 22:42:42	None	None

Trudeau turns down White House invitation amid pandemic	70357	2322	2020-07-06 19:05:41	None	None

The Swiss cheese respiratory virus defense	69593	1140	2020-10-13 13:46:41	None	None

Dwayne Johnson, His Wife and Daughters, 4 and 2, Test Positive for COVID-19: 'A Real Kick in the Gut'	69399	3509	2020-09-03 04:32:23	None	None

Columbia Sportswear employees to receive regular pay as CEO cuts own salary to $10,000	68865	1510	2020-03-30 00:28:36	None	None

By the end of this weekend more Americans will have died from COVID-19 than were killed in combat during World War One.	68851	2293	2020-06-13 00:13:30	None	None

Boris Johnson tests positive for COVID-19	68184	554	2020-03-27 15:18:52	None	None

Just a reminder that during the Ebola crisis Dr. Fauci suited up personally to take care of an infected patient.	67441	1495	2020-04-03 01:33:02	None	None

Plague Inc. gives a quarter of a million dollars to fight COVID-19.	67169	1128	2020-03-24 13:56:49	None	None

CDC: If all Americans wore masks, the virus would be controlled in 6 to 12 weeks.	67110	5307	2020-09-17 03:47:35	None	None

New bill would forgive medical school debt for COVID-19 health workers	66765	4006	2020-05-06 17:54:43	None	None

Herman Cain Dies From Coronavirus at 74	66408	5745	2020-07-30 18:26:19	None	None

Good News: German company Bosch produces 95% accurate test with testing time under 2.5 hours and no laboratory required	66105	1790	2020-03-26 23:59:51	None	None

A Texas county judge’s letter prompted by the toxic response he’s received over a mandatory mask order: “When did it happen that we all became so focused on our rights and not our obligations to our fellow man and woman?”	65555	3243	2020-06-27 16:43:09	None	None

"Vice News Producer on returning to the US through JFK Airport from Italy after reporting on Coronavirus' outbreak epicenter - ""I walked right through US customs. They didn’t ask me where in Italy I went or if I came into contact with sick people. They didn’t ask me anything."""	65244	3081	2020-03-06 04:15:57	None	None

Elon Musk: We have extra FDA-approved ventilators. Will ship to hospitals worldwide within Tesla delivery regions. Device & shipping cost are free. Only requirement is that the vents are needed immediately for patients, not stored in a warehouse. Please me or @Tesla know.	65064	1514	2020-03-31 19:58:08	None	None

Governor Cuomo: “I hope NY doesn’t ultimately need 30,000 ventilators. But I don't operate on opinion and hope. I operate on facts and data and science. All the projections say we will need 30,000-40,000 ventilators. So that is what we will strive to have.”	64681	1193	2020-03-27 20:16:03	None	None

Pakistan hired 63,000 people, unemployed by COVID-19, to help plant 10 billion trees	64430	1187	2020-05-08 14:26:20	None	None

Europeans Say COVID-19 Revealed America as 'Fragile,' Inconsiderate	64418	3841	2020-08-10 18:06:59	None	None

The Sikhs Know How to Feed Crowds in a Protest or Pandemic: The Sikh Center of New York has served more than 145,000 free meals in the last 2 months, as part of their faith tradition of feeding anyone in need.	64300	1292	2020-06-09 15:22:31	None	None

Dr. Fauci Says, “With All Due Modesty, I Think I’m Pretty Effective.”	64110	1866	2020-07-17 03:52:35	None	None

Nearly 9,000 Florida Children Diagnosed With Coronavirus in Two Weeks as Schools Reopen	64073	3649	2020-08-26 01:38:41	None	None

In Northern Italy, 60 volunteers who thought they'd never suffered COVID-19 gave blood. 40 of them tested positive for antibodies to the virus.	64047	3413	2020-04-04 17:06:05	None	None

Fauci: “I have a reputation, as you probably have figured out, of speaking the truth at all times and not sugar-coating things. And that may be one of the reasons why I haven’t been on television very much lately”	63892	3432	2020-07-10 18:17:49	None	None

The EU plans to ban US travelers indefinitely after haphazard COVID-19 response	63778	3959	2020-06-23 23:39:27	None	None

"New York governor says failing to wear a mask is ""disrespectful"" to essential workers ""who gave their life"""	63532	2164	2020-06-14 21:32:31	None	None

Fewer than half of Americans believe their daily routine will return to normal by June, as fears over coronavirus rise	63287	5580	2020-04-03 14:47:18	None	None

Arizona Sheriff Who Refused to Enforce Lockdown Restrictions Has COVID-19	63134	1187	2020-06-18 04:29:20	None	None

Anger is growing at China over COVID-19 and its apparent cover-up attempt	62651	642	2020-04-01 01:18:47	None	None

The Latest: Fauci says reopening too quickly will backfire	62523	4148	2020-04-20 16:49:03	None	None

Bill Gates calls for nationwide shutdown: 'Shutdown anywhere means shutdown everywhere'	62518	4742	2020-04-01 07:53:48	None	None

A COVID-19 positive California woman was instructed to quarantine, isolate, and inform the people she had been in contact with. Instead she went to work while contagious, didn't tell her roommates, and infected all 16 people in her household.	62023	3709	2020-07-22 08:10:20	None	None

[Massengill] A school Superintendent said something profound in his address cancelling school for the next 3 weeks. “In the end, it will be impossible to know if we overreacted or did too much, but it will be QUITE apparent if we under reacted or did too little.” Hear those words my friends.	61843	982	2020-03-16 01:54:50	None	None

YSK of a country-wide event circulating Italian social media right now. Tomorrow at 12:00pm 14/3, Italians from all across the country are going to give a round of applause on their balconies and out of their windows to thank all hospital workers during this time of chaos.	61601	799	2020-03-13 22:41:07	None	None

Coronavirus: Rudy Giuliani has Twitter account temporarily blocked for spreading 'COVID-19 misinformation'	61574	130	2020-03-30 04:49:24	None	None

Tesla gave workers permission to stay home rather than risk getting covid-19. Then it sent termination notices.	61420	3277	2020-06-25 15:59:55	None	None

Coronavirus Has Killed More Americans than Vietnam, Korea, Iraq, Afghanistan and World War I Combined	61376	2504	2020-10-07 03:08:37	None	None

Texas judge rules all registered voters can vote by mail if they fear catching coronavirus	61221	279	2020-04-18 05:10:20	None	None

White House Completely Misused Rapid COVID-19 Tests to Avoid Face Masks	61104	2023	2020-10-04 17:08:22	None	None

"""You have helped us in the past,now it's up to us to reciprocate"" recalling the Italian government flight with 18 tons of medical supplies for the emergency in Wuhan. The Chinese Red Cross arrived in Rome with a load of 31 tons: lung fans, respirators, monitors, tens of thousands of suits and masks."	60991	2616	2020-03-14 03:14:56	None	None

It’s Official—Americans Won’t Be Allowed Into Europe When It Reopens	60878	4732	2020-06-28 19:30:04	None	None

The spread of covid-19 in the South shows the risks of anti-intellectualism	60621	2951	2020-08-04 23:49:31	None	None

Over 700 healthcare workers in the United States have died fighting the Coronavirus this year.	60603	1535	2020-07-05 00:58:09	None	None

Costco Is Refusing To Accept Returns For Toilet Paper Which Is Bad News For Panic-Buying Hoarders	60554	3512	2020-03-24 04:58:35	None	None

"Dr. Fauci has a security detail after death threats and harassment against his family: ""That's sad, the very fact that a public health message to save lives triggers such venom and animosity"""	60468	976	2020-10-19 07:09:03	None	None

U.S. reports 41,407 new cases of coronavirus so far today, the biggest one-day increase since the pandemic began	60091	6030	2020-06-27 02:12:16	None	None

Ohio man dies from COVID-19 after criticizing governor’s coronavirus lockdown as ‘madness’	59895	40	2020-04-23 01:34:27	None	None

The faster a country required masks, the fewer coronavirus deaths it had: study - National	59758	2415	2020-06-23 06:24:27	None	None

‘No thank you, Dr. Fauci.’ Texas Lt. Gov. Patrick says he won’t listen to nation’s top COVID-19 expert	59569	452	2020-07-01 16:44:34	None	None

Dr Drew Uses Copyright Claim to Takedown Supercut of Him Downplaying COVID-19	59449	2616	2020-04-06 07:37:52	None	None

Danish Store Ends Hand Sanitizer Shortage Due to Hoarding by Introducing Tiered Pricing: First Bottle $4, Second Bottle $95.	59327	1650	2020-03-22 08:22:36	None	None

Almost 90,000 dead and no hint of national mourning. Are these deaths not ‘ours’?	59284	4827	2020-05-18 02:26:08	None	None

"CDC director: U.S. could get coronavirus ""under control"" in 4-8 weeks if everyone wears masks"	59134	3225	2020-07-14 23:21:04	None	None

'We've been muzzled': CDC sources say White House putting politics ahead of science	59108	2714	2020-05-20 15:37:29	None	None

WHO classifies COVID-19 as a Pandemic. Finally.	59064	3651	2020-03-11 20:30:23	None	None

Tom Hanks 'has no respect' for people not wearing masks	58970	953	2020-07-07 20:59:47	None	None

In 1918, there was an anti-mask league in San Francisco, which objected to wearing masks to prevent the spread of influenza. They held meetings of thousands of maskless people. San Francisco was ultimately was one of the cities that suffered most from the Spanish Influenza pandemic	58719	1640	2020-04-19 02:35:01	None	None

1 wedding + 275 guests + 0 masks = 56 COVID cases in 9 Minnesota counties	58451	3174	2020-09-06 16:30:40	None	None

German government confirms attempts by Chinese diplomats to persuade German officials to make positive public statements about China's management of the pandemic	58426	89	2020-04-26 16:09:38	None	None

WATCH: Los Angeles Becomes The First Major City In The US To Offer Free Testing To Every Resident, Even Those With No Symptomss	58258	2031	2020-04-30 04:40:15	None	None

More Americans blame the U.S. government than foreign nations for the country’s coronavirus crisis	58244	1611	2020-10-05 21:55:51	None	None

American Airlines bans conservative activist who refused to wear a mask	57853	2140	2020-06-19 17:11:44	None	None

Lowe's shelling out $100M in coronavirus bonuses to hourly workers	57834	1537	2020-07-31 14:06:06	None	None

Austria Has 90% Drop in Coronavirus Cases After Requiring People to Wear Face Masks	57744	3052	2020-05-05 19:43:36	None	None

Leaving Your Nose Uncovered Defeats the Purpose of Wearing a Mask: Study Reveals	57653	2765	2020-07-25 02:02:48	None	None

Canada wants to extend U.S. travel ban	57497	5201	2020-05-15 00:23:39	None	None

U.S. reports more than 83,000 new coronavirus cases, biggest one-day increase on record	57428	4684	2020-10-24 02:55:51	None	None

Poll: 59 percent of voters more concerned about rolling back social distancing too soon than economic fallout	57349	2866	2020-04-11 03:46:23	None	None

56 people in a Starbucks in Paju, South Korea tested positive for COVID-19 after 1 infected patient visited the store. However, the workers all tested negative – why? Because they work a mask throughout the entirety of their shift.	57331	1754	2020-08-23 04:43:04	None	None

Masks don't merely help to protect the wearer, they limit the amount of virus exposure, which in turn limits the severity of symptoms should the wearer get sick. In locations with near 100% masks wearing, if an outbreak occurred, 95% of those infected were asymptomatic.	57242	1614	2020-07-21 03:50:40	None	None

Coronavirus Has Now Killed More People in US than 2018-2019 Flu Season	57221	3386	2020-04-19 21:10:02	None	None

China’s richest man (Jack Ma) donates 500,000 diagnostic kits and 1 million masks to the USA.	57197	2605	2020-03-13 11:28:19	None	None

Georgia's Governor Says He Didn't Know People Could Spread Covid-19 Without Symptoms	56999	1273	2020-04-02 15:53:46	None	None

US patient receives $840,000 bill for COVID-19 treatment -- He was in intensive care for two weeks	56160	336	2020-05-31 13:22:14	None	None

A 98-year-old patient recovered from coronavirus in China.	56092	1087	2020-03-03 02:20:02	None	None

President Trump wears mask in public for the first time during visit to Walter Reed Medical Center	56031	3842	2020-07-12 01:50:05	None	None

Almost 50 North Texans Drank Bleach This Month, Poison Center Warns ‘Stop, It Won’t Cure COVID’	55747	1219	2020-08-24 23:50:34	None	None

Kroger, the largest supermarket chain in the U.S., says all customers will be required to wear masks from July 22	55417	1982	2020-07-16 00:39:13	None	None

54 percent of Americans want to work remote regularly after coronavirus pandemic ends, new poll shows	55405	2920	2020-05-04 18:19:42	None	None

British Prime Minister, who is suffering from coronavirus, has been admitted to intensive care as his condition has worsened	55378	1461	2020-04-06 23:17:19	None	None

Chris Christie says he was in ICU for 7 days battling Covid-19, urges Americans to wear masks	55261	513	2020-10-16 02:53:52	None	None

Fauci: 'I don't understand why' every state hasn't issued stay-at-home orders	55215	329	2020-04-03 05:51:20	None	None

If 80% of Americans Wore Masks, COVID-19 Infections Would Plummet, New Study Says	55108	3921	2020-05-09 01:52:40	None	None

Trump suggests 'injection' of disinfectant to beat coronavirus and 'clean' the lungs	55003	902	2020-04-24 03:44:19	None	None

Actor Tom Hanks says he and his wife have tested positive for coronavirus	54865	3296	2020-03-12 05:18:45	None	None

ER doctor’s plea: ‘Stop going to politicians for news about science'	54728	1183	2020-06-28 21:53:02	None	None

Man who called coronavirus ‘fake crisis’ gets infected, wife in critical condition	54573	168	2020-05-18 20:59:21	None	None

Italy Is Reopening for Tourism in June, But Not for American Travelers	54469	1511	2020-05-31 22:39:28	None	None

