title	score	num_comm	created	content
"Man Who Called COVID a ‘Hoax’ Feels Guilty After He and 13 Family Members Test Positive — and 2 Die: ""The feeling that I have is kind of like what, I would say, a drunk driver would have if they killed their family,"" says Tony Green, who hosted the family gathering that led to their infections."	82040	5111	2020-10-14 16:07:02	
President Donald Trump says he has tested positive for coronavirus	79244	9974	2020-10-02 08:58:13	
Joe Biden has tested negative for coronavirus	77310	2106	2020-10-02 20:14:32	
The Swiss cheese respiratory virus defense	69591	1140	2020-10-13 13:46:41	
Coronavirus Has Killed More Americans than Vietnam, Korea, Iraq, Afghanistan and World War I Combined	61378	2504	2020-10-07 03:08:37	
White House Completely Misused Rapid COVID-19 Tests to Avoid Face Masks	61100	2023	2020-10-04 17:08:22	
"Dr. Fauci has a security detail after death threats and harassment against his family: ""That's sad, the very fact that a public health message to save lives triggers such venom and animosity"""	60465	976	2020-10-19 07:09:03	
More Americans blame the U.S. government than foreign nations for the country’s coronavirus crisis	58242	1611	2020-10-05 21:55:51	
Chris Christie says he was in ICU for 7 days battling Covid-19, urges Americans to wear masks	55267	513	2020-10-16 02:53:52	
White House economic advisers warned investors about pandemic, but not American public	49723	1263	2020-10-15 16:36:46	
'People are dying every night': Staff at overwhelmed Wisconsin hospital urge people to take coronavirus seriously	49234	2864	2020-10-20 16:29:14	
'I cry before work': US essential workers burned out amid pandemic	48548	2950	2020-09-25 02:33:43	
Coronavirus face coverings under the nose equivalent to ‘not wearing a mask’: experts	48546	2934	2020-09-29 17:03:01	
Twitter Removes White House Adviser's Tweet Saying Masks Do Not Prevent COVID-19	44222	1746	2020-10-18 15:41:58	
Analysis Finds True Pandemic Death Toll Is Much Higher Than 200,000 in US	42978	2231	2020-10-12 03:09:10	
Russia smashes coronavirus single-day case record with more than 12,000 in 24 hours	42843	1673	2020-10-09 15:49:05	
Dr. Fauci says his kids aren't coming home for Thanksgiving as Americans 'sacrifice' holiday gatherings to stay safe from coronavirus	42522	2028	2020-10-15 01:27:01	
South Florida bars packed after Gov. gives OK for reopening	40636	3530	2020-09-27 16:08:05	
White House Blocked C.D.C. From Requiring Masks on Public Transportation	39641	1356	2020-10-10 02:36:32	
‘Do Not Invite Anyone Over’ to Your Home, Chicago’s Top Doctor Urges	36292	2560	2020-10-19 20:50:04	
White House head of security is 'very ill' with coronavirus, report says	36212	1261	2020-10-08 20:09:58	
Coronavirus: Parents sending sick, symptomatic kids to school, health officer says	35753	2163	2020-09-23 17:10:36	
The U.S. was the world's best prepared nation to confront a pandemic. How did it spiral to 'almost inconceivable' failure?	32201	1898	2020-10-16 14:31:09	
Florida coach wanted 90,000 fans at his home stadium, but now his players have COVID	32108	1242	2020-10-14 03:38:53	
Coronavirus: Vitamin D reduces infection and impact of COVID-19, studies find	31178	1704	2020-09-26 14:27:24	
Trump Being Transferred to Walter Reed Military Center	27996	3908	2020-10-03 01:14:54	
Slovakia to perform a full-scale COVID-19 testing. The entire population of the country is to be tested over 2 weekends.	28042	586	2020-10-17 14:49:08	
Fauci says it's 'very concerning' that Florida is re-opening bars and restaurants at full capacity	27835	1296	2020-09-28 22:01:57	
'Close to 100% accuracy': Helsinki airport uses sniffer dogs to detect Covid	27236	679	2020-09-24 15:09:22	
Brazil says a 28-year-old volunteer in AstraZeneca's COVID-19 vaccine trial has died of coronavirus complications. It's unknown if he received the vaccine or a placebo - G1	27265	1308	2020-10-21 21:11:02	
Inhaled Vaccines Aim to Fight Coronavirus at Its Point of Attack: Vaccines sprayed into the nose or inhaled through the mouth won’t require needles and could be easier to roll out. They may be more effective too.	25464	892	2020-10-11 15:02:30	
U.S. COVID update: Hospitalizations at highest level since August	25115	1191	2020-10-21 02:49:37	
White House overrules CDC on banning cruise ships till 2021	24911	1115	2020-09-30 04:40:10	
Kellyanne Conway's daughter the latest to test positive for COVID-19	24748	419	2020-10-04 23:56:20	
Masks, Social Distancing Will Likely Be Needed Until Late 2021, Fauci Says During Virtual Event In Md.	24430	2779	2020-10-06 15:08:32	
Publicly traded firms paid dividends, bought their own stock after receiving PPP loans to pay employees	24243	1097	2020-09-25 15:53:21	
'But there is no coronavirus,' shocked cynic told doctors, waking up in hospital	21651	1100	2020-10-07 14:00:01	
Man gets 1 year in jail for holding large parties against COVID-19 rules	21627	829	2020-09-26 23:56:21	
‘You are not listening,’ Fauci tells Sen. Rand Paul during a Senate hearing on the coronavirus	21235	999	2020-09-23 22:28:09	
Sen. Ron Johnson tests positive for COVID-19	21019	230	2020-10-03 17:16:57	
Lana Del Rey criticized for wearing mesh mask while meeting fans at book signing	19553	1277	2020-10-06 08:55:51	
NEW: Vietnam has reached 1 month without community transmission of coronavirus	19287	715	2020-10-03 18:13:47	
CDC advises booting travelers who refuse to wear masks on planes, trains, buses, other transportation	17387	625	2020-10-20 01:54:47	
Coronavirus killing three times more people than flu and pneumonia combined	17044	660	2020-10-08 13:25:21	
Ex-N.J. Gov. Chris Christie remains hospitalized for COVID-19	16897	937	2020-10-07 16:48:02	
Positive COVID-19 test rates top 25% in some U.S. Midwest states	16645	1153	2020-09-28 02:28:59	
How the Sturgis Motorcycle Rally may have spread coronavirus across the Upper Midwest	16573	910	2020-10-18 03:09:59	
Millennials and the Economy: Coronavirus Is the Second Setback in a Generation	16336	1444	2020-09-30 15:18:02	
Denver requires mask-wearing outdoors, limits gathering to five people as coronavirus cases rise	15891	707	2020-10-17 00:18:21	
Restaurant staffers in quarantine after working Τrump fundraiser	15722	315	2020-10-06 18:20:36	
Trump Aide Hope Hicks Tests Positive For Coronavirus Infection	12140	1159	2020-10-02 04:19:28	
Number of Covid cases grows among people who attended White House ceremony	11639	718	2020-10-03 08:42:12	
Missouri governor, opponent of mandatory masks, has COVID-19	11594	619	2020-09-24 01:19:52	
Delta investigates maskless Sen. Wicker as other senators test COVID-19 positive	11588	397	2020-10-05 08:05:24	
NEW: France reports 16,972 new coronavirus cases, biggest one-day increase on record	11295	679	2020-10-03 22:54:30	
"The Netherlands: ""Urgent advice: Immediately wear a face mask in public areas in the whole country"""	11017	844	2020-09-30 18:34:08	
Coronavirus infections, hospitalizations keep decreasing across California	9820	308	2020-10-04 05:01:54	
White House Is Not Contact Tracing ‘Super-Spreader’ Rose Garden Event	9563	306	2020-10-06 02:32:08	
Pentagon risk grows as Marine Corps' No. 2 officer tests positive for coronavirus	9039	377	2020-10-08 17:15:12	
Coronavirus: World leaders must urgently phase out factory farming to cut future pandemics risk, says report	8937	785	2020-10-07 15:30:21	
Kellyanne Conway announces she tested positive for coronavirus	8871	644	2020-10-03 06:27:45	
Former NJ Gov. Chris Christie Tested Positive for COVID	8516	94	2020-10-03 19:42:50	
‘Why are we pretending it’s all over?’ Miami restaurants wrestle with new COVID rules	7961	831	2020-09-29 04:22:54	
Nine in ten recovered COVID-19 patients experience side-effects - study	7187	594	2020-09-29 13:15:44	
Italy reports more than 11,000 new coronavirus cases, biggest one-day increase on record	7154	702	2020-10-19 00:30:16	
BREAKING: Republican U.S. Senator Thom Tillis has tested positive for coronavirus	6990	407	2020-10-03 04:14:36	
More people have died from Covid-19 than in the past 5 flu seasons combined	6624	600	2020-10-06 18:04:05	
Chris Wallace, awaiting virus test, tells Fox News viewers: ‘Wear the damn mask’	6004	300	2020-10-02 22:56:19	
NEW: U.S. reports 68,124 new coronavirus cases, biggest one-day increase since July - Positivity: 5.9% - In hospital: 37,336 (+28) - ICU: 7,251 (+31) - Deaths: +877	5875	589	2020-10-17 02:59:39	
The US excess mortality rate from COVID-19 is substantially worse than Europe’s	5167	164	2020-09-30 17:57:21	
One arrested in threat to kidnap and kill Wichita mayor over COVID-19 mask mandate	5012	338	2020-10-17 05:08:17	
Mark Wahlberg donates 1.3 million face masks to U.S. schools	4770	147	2020-09-24 15:26:47	
COVID-19 cases in Arizona dropped 75% after mask mandates began, report says	4523	185	2020-10-18 18:49:44	
80-Year-Old Is Killed After Asking Bar Patron to Wear Mask	4431	467	2020-10-07 19:30:37	
Justin Trudeau: Canada-US border will stay closed until America gets COVID-19 under control	4437	453	2020-10-15 19:27:19	
The U.S. is 'not in a good place' as daily coronavirus cases grow beyond 40,000, Fauci says	4269	373	2020-09-28 23:01:09	
Fox News' Chris Wallace: First Family Declined Masks During Debate	4247	297	2020-10-02 19:39:22	
Man Killed After Confronting Fellow New York Bar Patron For Not Wearing Mask	4148	478	2020-10-06 13:58:10	
Fauci calls 'herd immunity' declaration embraced by White House 'ridiculous'	4135	666	2020-10-16 12:40:55	
COVID-19 is currently the 13th deadliest pandemic all-time in our world's history	4036	465	2020-10-20 21:56:44	
NSA director is in quarantine after potential coronavirus exposure	3986	189	2020-10-08 14:57:56	
Trey Songz Says He Tested Positive For COVID-19, Takes It Very Seriously: 'Don't Be Like the President'	3937	102	2020-10-07 00:16:09	
First lady: Barron Trump positive for COVID, no symptoms	3772	421	2020-10-15 00:14:48	
FDA releases high coronavirus vaccine standards despite White House resistance	3763	189	2020-10-07 04:05:54	
New York issues order putting halt to planned 10,000 person wedding in Brooklyn	3770	294	2020-10-18 02:13:52	
Negative Covid-19 tests not a substitute for 14-day quarantine	3724	177	2020-10-03 17:22:44	
Dr. Fauci: ‘This is an outbreak of historic proportions, the likes of which we’ve not seen in 102 years’	3555	413	2020-10-13 16:36:38	
FDA releases coronavirus vaccine guidelines, defying WH	3370	202	2020-10-06 20:56:04	
Bill Gates slams U.S. on Covid: Most governments listen to their scientists, not attack them	3340	241	2020-10-14 16:18:55	
MIT COVID-19 Test Could Be Made So Cheap That People Test Themselves Every Day	3226	182	2020-10-04 15:44:22	
White House turns down offers from CDC to help with contact tracing	3206	211	2020-10-06 18:45:58	
COVID Misinformation Is Killing People	3203	401	2020-10-11 23:25:56	
"Unemployment aid is running out for millions: ""People are going to become desperate"""	3166	477	2020-10-18 03:07:37	
Victoria, Australia records only 1 new infection in 24 hours after 100 days of one of the world’s strict lockdowns	3091	444	2020-10-17 02:21:47	
Moderna CEO says its coronavirus vaccine won't be ready until spring of next year	3074	294	2020-10-01 02:06:57	
Herd immunity strategy endorsed by White House a 'ridiculous' way to stop COVID, say scientists — it will just kill people	3060	619	2020-10-15 15:23:01	
Dr. Fauci says we should prepare to 'hunker down' again — here's how to mentally get through fall and winter	2956	788	2020-10-04 16:09:00	
Dogs detect coronavirus fast and reliably — why not use them everywhere?	3199	222	2020-10-21 18:11:14	
U.S. Political Figures COVID-19 Megathread	2932	4736	2020-10-03 21:37:00	"This megathread is for discussing all news related to President Trump’s positive Covid-19 diagnosis and treatment, as well as positive test results from senators and other political figures related to the current outbreak.

&#x200B;

**All discussion of this will be held here. As of now, several people have tested positive for Covid-19, including:**

President Donald Trump & Melania Trump

Senator Mike Lee (R-UT)

Senator Thom Tillis (R-NC)

Senator Ron Johnson (R-WI)

Bill Stiepen (Trump campaign manager)

Ronna McDaniel (GOP Chairwoman)

Hope Hicks (Trump political advisor)

Kellyanne Conway

Chris Christie

Nick Luna (Oval Office Operations Director & Trump's body man)

Kayleigh McEnany (White House press secretary) 

Chad Gilmartin (White House spokesman)

Karoline Leavitt (White House spokeswoman)

Admiral Charles Ray (U.S. Coast Guard second-in-command)

Jalen Drummond (White House spokesman)

Stephen Miller (White House Senior Advisor)

Rep. Salud Carbajal (D-CA 24th District)

&#x200B;

Live updates:

[ABC News](https://abcnews.go.com/Politics/live-updates/trumpcoronavirus/?id=73402267)

[CBS News](https://www.cbsnews.com/live-updates/president-trump-covid-19-positive-test-latest-news-2020-10-04/)

[CNN](https://www.cnn.com/politics/live-news/trump-covid-19-updates-sunday/index.html)

[New York Times](https://www.nytimes.com/live/2020/10/02/world/covid-19-coronavirus#covid-trump-aides-politicians)

[Washington Post](https://www.washingtonpost.com/elections/2020/10/04/trump-covid-live-updates)

&#x200B;

**Please remember all sub rules when commenting. Please be civil, and treat each other with respect. Thank you!**

&#x200B;

October 3rd Updates:

[Chris Christie has checked himself into a hospital as a precaution](https://www.cbsnews.com/news/chris-christie-tests-positive-for-coronavirus/)

[Trump addresses the nation from Walter Reed medical center](https://twitter.com/realDonaldTrump/status/1312525833505058816?s=20)

[Nick Luna, director of Oval Office Operations and body man to Pres. Trump, has tested positive](https://twitter.com/ABC/status/1312599828061401088?s=20)

[Notre Dame president who attended Rose Garden event tests positive](https://www.cnn.com/2020/10/02/us/notre-dame-president-covid-trnd/index.html)

October 4th Updates:

[Trump’s medical team says he could be discharged from Walter Reed as soon as Monday. He reportedly experienced significant oxygen drops on Friday and Saturday](https://www.washingtonpost.com/elections/2020/10/04/trump-covid-live-updates)

[Reports that Trump didn't disclose a positive rapid test while awaiting a second, more thorough test on Thursday](https://www.wsj.com/articles/trump-didnt-disclose-first-positive-covid-19-test-while-awaiting-a-second-test-on-thursday-11601844813)

[Trump goes for drive outside Walter Reed medical center](https://twitter.com/Breaking911/status/1312869216954077186?s=19)

[Attorney General Bill Barr is now self quarantining](https://twitter.com/yasminv/status/1312871726108356608?s=20)

[White House says it will not release the number of staffers infected with coronavirus, citing privacy concerns](https://twitter.com/BNODesk/status/1312895849802932225?s=20)

[Biden tests negative for a second time](https://twitter.com/mviser/status/1312896046733950977?s=20)

[White House gives New Jersey officials the names of at least 206 individuals who may have been exposed to Covid-19 at a Trump fundraiser last week](https://twitter.com/NJDeptofHealth/status/1312837141907542016?s=20)

October 5th Updates:

[White House press secretary Kayleigh McEnany tests positive for coronavirus](https://www.cnn.com/2020/10/05/politics/kayleigh-mcenany-coronavirus-white-house/index.html)

[White House spokesman Chad Gilmartin tests positive for coronavirus](https://twitter.com/BNODesk/status/1313153897658306560?s=20)

[White House spokeswoman Karoline Leavitt tests positive for coronavirus](https://twitter.com/BNODesk/status/1313155682191978498?s=20)

[Trump tweets he will be leaving Water Reed today](https://twitter.com/realDonaldTrump/status/1313186529058136070?s=20)

[Trump leaves Walter Reed medical center and returns to the White House](https://youtu.be/_aNkToDMoGs)

October 6th Updates:

[Top U.S. military leaders, including the chairman of the Joint Chiefs of Staff, are quarantining after being exposed to the virus](https://www.nytimes.com/2020/10/06/us/top-us-military-leaders-including-the-chairman-of-the-joint-chiefs-of-staff-are-quarantining-after-being-exposed-to-the-virus.html)

[U.S. Coast Guard second-in-command, Admiral Charles Ray, tests positive for coronavirus](https://twitter.com/BNODesk/status/1313516416633647113?s=20)

[White House spokesman Jalen Drummond tests positive](https://twitter.com/BNODesk/status/1313578111028662277?s=20)

[White House Senior Advisor Stephen Miller tests positive](https://thehill.com/homenews/administration/519897-stephen-miller-tests-positive-for-coronavirus-reports)

[Rep. Salud Carbajal has tested positive](https://www.cnn.com/2020/10/06/politics/salud-carbajal-tests-positive-for-covid/index.html)

[Megachurch pastor who attended Rose Garden event tests positive](https://www.sacbee.com/news/coronavirus/article246262305.html)

[White House says they have completed contact tracing](https://www.cnn.com/2020/10/06/politics/white-house-contact-tracing-done/index.html)

[Secret Service Agents Frustrated With Trump's Unnecessary Coronavirus Risks](https://www.npr.org/2020/10/06/920849439/secret-service-agents-frustrated-with-trumps-unnecessary-coronavirus-risks)

October 7th Updates:

[White House doctor says Trump has been Covid symptom-free for 24 hours](https://www.theguardian.com/us-news/live/2020/oct/07/donald-trump-coronavirus-covid-19-white-house-kamala-harris-mike-pence-debate-joe-biden-live-updates)

[Trump insisting on working from Oval Office despite isolation rules, infection risks](https://abcnews.go.com/Politics/trump-insisting-working-oval-office-quarantine-rules-infection/story?id=73472757)

[Trump returns to Oval Office, says it's a ""blessing from God"" that he got COVID-19](https://www.cbsnews.com/news/trump-still-recovering-from-covid-19-returns-to-oval-office/)

[White House security official is gravely ill with COVID-19 since September](https://www.bloomberg.com/news/articles/2020-10-07/white-house-security-official-contracted-covid-19-in-september)

October 8th Updates:

[Marine general has COVID after Pentagon meeting](https://apnews.com/article/virus-outbreak-archive-gary-l-thomas-coast-guard-59e19109d15d6f10eeb0417ec961d80d)

[Trump refuses to participate in virtual debate](https://www.cnn.com/2020/10/08/politics/second-presidential-debate-virtual/index.html)

&#x200B;

*Click [here](https://www.reddit.com/r/Coronavirus/comments/j4j8m6/us_political_figures_covid19_megathread/?sort=confidence) to sort comments by Best.*"
CDC: Teen gave COVID-19 to 11 relatives across 4 states, including Illinois, during a family vacation. Case is a cautionary tale as holidays approach, experts say.	2910	215	2020-10-13 07:36:33	
Florida drops Covid restrictions with 14,000 dead	2896	586	2020-09-26 16:40:26	
"Maskless woman on plane deliberately coughs on passengers: ""Everybody dies"""	2894	458	2020-10-19 21:20:54	
In a month, India’s coronavirus cases double from 3 million to 6 million	2847	272	2020-09-28 14:34:50	
More Evidence That Vitamin D Sufficiency Equals Less Severe COVID-19	2771	267	2020-10-01 01:39:48	
Miami Dolphins have been given clearance to go to full capacity of 65,000 fans at Hard Rock Stadium, per Gov. DeSantis	2733	458	2020-10-07 21:09:52	
All 62 residents at Kansas nursing home have COVID, 10 have died	2744	219	2020-10-20 14:07:56	
Microsoft reportedly letting employees work from home permanently	2716	343	2020-10-09 21:05:41	
Fact check: Positive coronavirus test followed by negative antibody test is not proof the virus is a lie - Reuters	2703	133	2020-10-19 02:56:47	
Dr. Anthony Fauci says he's 'not comfortable' with level of U.S. coronavirus cases	2669	254	2020-10-08 20:57:38	
Journalists who work at the White House are testing positive for Covid-19	2580	79	2020-10-03 13:25:21	
Military suicides are up as much as 20% amid COVID crisis	2543	361	2020-09-28 03:37:32	
Pandemic Historian Says Masks Aren't New And They Worked In 1918	2538	189	2020-10-20 12:14:08	
NEW: Poland reports more than 10,000 new coronavirus cases, biggest one-day increase on record	2537	247	2020-10-21 14:25:19	
The pandemic is plunging millions back into extreme poverty	2477	302	2020-09-28 04:55:57	
Kansas City hospitals overwhelmed, some forced to turn away ambulances as COVID-19 cases jump	2425	311	2020-10-17 20:02:04	
"Rural Midwest hospitals struggling to handle coronavirus surge: ""It just exploded"""	2411	370	2020-10-19 19:12:31	
Illinois Has Had COVID-19 Outbreaks in 44 Schools but Won’t Say Where They’ve Occurred	2334	89	2020-10-08 15:31:53	
New York reports 1,732 new coronavirus cases, biggest one-day increase since May. Yesterday saw the highest number of tests in one day.	2309	186	2020-10-03 23:38:16	
Coronavirus death toll hits 1 million	2308	396	2020-09-27 18:33:54	
Doctors monitoring Trump's lungs, giving steroid to fight COVID-19	2289	718	2020-10-04 23:16:47	
Experts warn of 'huge surge' in COVID-19 cases in fall and winter months	2295	310	2020-09-28 00:00:03	
Five Thousand Brazilians Have Tested Oxford Vaccine with No Severe Side Effects	2271	247	2020-10-05 00:34:32	
COVID-Positive Rabbi Held Large Indoor Service In Borough Park, Congregants Say	2243	153	2020-10-10 17:06:36	
CDC revises coronavirus guidance to acknowledge that it spreads through airborne transmission	2234	216	2020-10-05 22:00:57	
Fauci: Up to 400K Americans could die of coronavirus without safeguards	2235	279	2020-10-07 14:23:16	
Mortality in the U.S. was more than 280,000 higher during the first eight months of 2020 than any of the previous five years over the same period	2224	245	2020-10-11 23:50:37	
Refusals to wear masks in pandemic echo the fight to wear seatbelts	2177	255	2020-10-17 23:39:22	
COVID Patients Filling Wisconsin Hospitals As Virus Surges	2069	209	2020-10-01 00:45:10	
"I'm ""concerned. The forecast showed that the deaths are going to go back up... this is going to be a very difficult fall,"" says Bill Gates on Covid-19."	2058	377	2020-10-09 08:08:51	
COVID has killed more than one million people. How many more will die?	2031	372	2020-10-04 03:27:16	
Coronavirus: 'Dr Johnny Bananas' and 'Dr Person Fakename' among medical signatories on herd immunity open letter	2010	181	2020-10-10 11:40:27	
Confidential coronavirus outbreak data shows undisclosed incidents at prisons, workplaces, schools, meatpacking plants across Illinois	1999	162	2020-10-19 18:26:36	
Lowe’s to pay $100 million more in bonuses to hourly workers amid pandemic [again]	1923	128	2020-10-08 06:40:36	
Harvest Crusade pastor Greg Laurie says he has COVID-19 after White House visit	1903	119	2020-10-06 01:16:14	
Fauci: Even after a COVID-19 vaccine, masks and social distance still vital	1891	837	2020-09-27 21:13:13	
Man who thought coronavirus was 'bulls***' now in intensive care with virus	1889	323	2020-09-28 10:54:06	
Google Maps Will Now Show Coronavirus Outbreaks In Your Area	1886	66	2020-09-24 00:29:22	
Church in Bible Belt town Barneveld, Netherlands holding three church services today with 450 visitors each, despite urgent government call to limit to 30 people	1854	276	2020-10-11 14:24:10	
World Health Organization estimates that 10% of the world’s population has been infected by the coronavirus	1854	403	2020-10-05 15:51:54	
Mayor of Tennessee town that hosts Bonnaroo music fest dies of COVID-19, officials say	1845	112	2020-10-12 17:10:37	
"New Zealand's Deputy Prime Minister shuts down American Covid-19 denier at campaign event: ""We’ve got someone who obviously got an education in America - 220,000 people have died in the US"""	1845	250	2020-10-13 12:09:57	
'Frustrated and heartbroken': Health care workers say Wisconsin's COVID-19 spike is the result of people ignoring preventive steps	1832	173	2020-10-05 11:17:42	
Beijing passes law to protect medical whistleblowers	1830	236	2020-09-30 16:31:17	
Maynard James Keenan, lead singer of Tool, had COVID-19 in February, and is still recovering	1812	128	2020-10-09 20:32:17	
About 9% of Americans exposed to COVID-19 by midsummer. That's a long way from herd immunity.	1805	339	2020-09-28 17:45:15	
Poor should get Covid-19 vaccine first, Pope Francis says	1811	268	2020-09-25 20:06:47	
University of Notre Dame President John Jenkins, who attended Trump's SCOTUS announcement, has tested positive for coronavirus	1781	112	2020-10-02 20:46:41	
Garland Woman Dies From COVID-19 While on Interstate Flight, Dallas County Reports 592 Additional Cases Sunday	1787	199	2020-10-19 04:09:13	
West Virginia Covid-19 outbreaks linked to church services, governor says	1871	134	2020-10-21 17:35:23	
Wedding of 150 people, found by police helicopter, violates COVID-19 rule	1779	168	2020-10-18 21:41:49	
Florida governor says closing schools to stop spread of COVID-19 was a mistake - calls critics of campus reopenings ‘flat earthers’	1717	210	2020-10-03 21:47:45	
Fauci says 7 million U.S. COVID-19 cases, 200,000 deaths only the first wave as threat of second surge looms	1707	337	2020-09-26 17:00:26	
"Your ""cough cloud"" is 7 to 23 times larger when you're not wearing a mask"	1707	105	2020-10-20 19:06:01	
Bill Gates Warns There Are ‘Lots Of Additional Deaths Coming’ In America Unless Coronavirus Response Improves	1668	271	2020-10-12 00:45:43	
250 Green Bay doctors sign open letter to elected officials: “We are overwhelmed”	1669	87	2020-10-03 05:38:55	
