title	score	num_comm	created	content
383,359 new cases of coronavirus worldwide, the biggest one-day increase on record, according to WHO. 8,575 new deaths	523	105	2020-10-10 20:05:52	
New strain of coronavirus discovered in Trondheim, Norway	527	120	2020-10-19 14:18:57	
Labor secretary's wife, who was at Rose Garden event, tests positive for coronavirus	521	29	2020-10-14 06:07:23	
Childhood vaccinations, preventative care sharply decline during pandemic: study	520	37	2020-09-28 03:11:49	
US: Fauci calls White House event a coronavirus ‘superspreader’ | US & Canada	523	37	2020-10-10 12:45:30	
Coronavirus could drive the last nail into the mink fur trade	512	93	2020-10-19 21:41:13	
Younger People Now 68% Of LA County's New Coronavirus Cases	505	58	2020-10-20 13:35:17	
Florida confirms 4,044 new cases Saturday, largest single-day increase since late August	505	74	2020-10-17 23:52:37	
Hydroxychloroquine and chloroquine linked to severe heart problems • Bioscholar News	506	46	2020-09-24 20:01:43	
Boston researchers join letter in The Lancet rejecting herd immunity strategy	503	67	2020-10-15 03:28:13	
'My brain doesn’t work like it did': COVID-19 'long-hauler' describes persistent symptoms	495	82	2020-09-27 15:53:28	
Remote learning isn't new: Radio instruction in the 1937 polio epidemic	493	65	2020-10-06 12:15:47	
Authorities bust Queens indoor wedding with nearly 300 guests, owner and venue manager given summons	491	75	2020-09-27 07:31:50	
University of Florida head football coach Dan Mullen calls for crowd of 90,000 at next week’s game	494	157	2020-10-11 01:29:24	
Johnson & Johnson To Give Poor Countries 500M Free COVID Vaccines	487	24	2020-10-09 08:50:51	
Researchers call for loss of smell to be recognized globally as a symptom of COVID-19	489	20	2020-10-01 22:35:54	
Harris pauses campaign travel after aide tests positive for coronavirus	487	81	2020-10-15 17:49:55	
NEW: Coronavirus death toll hits 985,000. It's expected to reach 1 million by Monday	488	72	2020-09-25 20:50:21	
KC hospitals ‘bursting at the seams’ with record numbers of COVID-19 patients	480	76	2020-10-16 05:05:29	
Poor numerical literacy linked to greater susceptibility to Covid-19 fake news	481	93	2020-10-14 08:23:10	
'We should not pretend everybody is suffering equally': Covid hits Australia's poor the hardest	476	28	2020-09-27 13:21:04	
Wisconsin sets new record for positive coronavirus cases in single day	481	76	2020-09-27 03:55:51	
Lockdown or not, personality predicts your likelihood of staying home during the pandemic	481	99	2020-10-19 00:44:12	
'South Carolina is open for business’: S.C. restaurants allowed to operate at 100 percent capacity	487	95	2020-10-03 05:25:51	
The coronavirus vaccine will not be free: Americans have already paid for it — twice	481	90	2020-10-18 22:35:41	
Florida governor suggests scaling back frequency of reporting COVID cases	486	85	2020-10-20 06:51:39	
Factory farms are an ideal breeding ground for the next pandemic	517	81	2020-10-21 20:33:58	
Oxford-Astra Covid Vaccine Review to Start in Europe	474	187	2020-09-30 21:54:00	
NEW: UK reports nearly 27,000 new coronavirus cases, by far the biggest one-day increase on record - New cases: 26,688 - Positivity rate: 9.5% (+1.3) - In hospital: 7,420 (+521) - In ICU: 693 (+39) - New deaths: 191	505	118	2020-10-21 20:08:25	
Germany's Merkel pledges $100 million for COVID-19 vacine for poor countries	466	65	2020-10-01 13:58:12	
France reports 18,746 new coronavirus cases, the biggest one-day increase on record. Number in hospital rises to 7,536	467	83	2020-10-07 22:10:38	
"U.S. government tried to ""intimidate"" California county health department to keep poultry plant open after COVID deaths, director says"	462	9	2020-10-02 17:15:48	
HBCU students keeping COVID-19 count low at their schools	468	21	2020-10-19 16:40:49	
‘This is slowly grinding us into dirt’: An ER nurse reflects on the relentless pandemic	457	65	2020-10-15 18:36:31	
Coronavirus could kill more than 2 million people by the end of the year, researchers say	465	77	2020-10-06 14:29:56	
Titans have NFL's first COVID-19 outbreak, with 8 positives	460	56	2020-09-29 20:09:06	
Israel’s Hospitals Are at Brink of Collapse in Devastating Second COVID Wave	452	60	2020-10-04 13:49:03	
Choir practice in Spain infects 30 of 41 members with virus	456	62	2020-09-24 16:38:29	
U.S. COVID update: Highest death toll in nearly a month, more than 40,000 in hospital - New cases: 57,294 - Positivity rate: 6.6% (-0.1) - In hospital: 40,271 (+1,041) - In ICU: 8,182 (+4) - New deaths: 994 - Data: COVID Tracking Project	689	111	2020-10-22 03:16:50	
No mask, no custody. COVID-19 is a new factor in family law.	453	133	2020-10-01 21:23:59	
Heavier breathing, spewing droplets, poor ventilation add to gyms' superspreading risk	458	152	2020-10-15 23:28:58	
MLB promised free COVID-19 testing for essential workers. We're still waiting.	451	17	2020-09-25 16:44:39	
"Virologist Drosten: ""The pandemic will only really start now"""	452	171	2020-09-24 15:20:54	
Pennsylvania Cat Dies Of COVID-19, Officials Warn Pets At Risk	456	92	2020-10-21 07:45:14	
Mental illness tied to increased mortality in Covid-19	448	52	2020-10-06 15:47:28	
As Wisconsin coronavirus surge continues, U.S. Sen. Ron Johnson claims 'we've flattened the curve,' says virus isn't a death sentence	1584	352	2020-10-22 06:17:27	
US reports more than 50K COVID-19 cases for third straight day; 9 states set record	452	67	2020-10-11 00:43:50	
"Trump in video statement: ""I think I'm doing very well"""	447	275	2020-10-03 02:36:18	
Medieval Europeans didn’t understand how the plague spread. Their response wasn’t so different from ours now.	443	101	2020-10-15 21:43:28	
After a brutal first wave, Italy stands out as one of Europe's best performers	449	125	2020-09-29 11:30:09	
Dave Chappelle Cancels Shows, Potential COVID-19 Exposure	442	53	2020-10-07 08:06:32	
Some Signs of Recovery From Severe Covid Lung Damage	448	37	2020-10-20 00:30:48	
'Still killing us': The federal government underfunded health care for Indigenous people for centuries. Now they're dying of COVID-19	446	12	2020-10-21 04:23:03	
California kept prison factories open. Inmates worked for pennies an hour as COVID-19 spread	441	66	2020-10-12 00:17:14	
At Least 9 People At Trùmp Campaign Rally in Minnesota Tested Positive for COVID-19, Health Officials Say	443	21	2020-10-10 08:01:25	
Ohio reports highest one-day tally of coronavirus cases	434	71	2020-10-10 01:06:18	
Covid-19 Live Updates: U.S. Hits 7 Million Cases, Less Than a Month After Reaching 6 Million	445	63	2020-09-25 14:59:19	
61 people who went to Canadian spin studio get coronavirus despite adhering to public health guidelines	435	114	2020-10-15 01:16:08	
WHO estimates infection fatality rate from coronavirus is about 0.6%	440	299	2020-10-11 00:39:15	
Second virus wave could turn cracks in the hospital system into ‘earthquakes’	433	125	2020-09-26 15:31:59	
Florida Governor Ron DeSantis says he will stop cities from collecting fines against people who refuse to wear a mask	432	111	2020-09-25 22:15:13	
'Darkest part of the pandemic' is approaching, says public health expert	441	174	2020-10-20 17:36:06	
U.S. government won't say why it allows Canadians to fly to U.S. despite border closure	435	73	2020-10-12 02:11:48	
Rich get richer, poor poorer: Two reports say pandemic intensifying inequalities	431	78	2020-10-13 22:44:01	
'Brain fog': the people struggling to think clearly months after Covid	436	51	2020-10-10 09:27:10	
U.S. judge denies request to exempt Catholic churches from New York coronavirus limits	432	48	2020-10-17 11:33:20	
Czech Republic building field hospital in Prague amid surge in coronavirus cases. Hospitalizations have risen 160% in 2 weeks, or 778% from last month	435	105	2020-10-15 13:26:22	
Green Bay on ‘verge of a crisis’ as virus overwhelms hospitals, Wisconsin doctor says	435	72	2020-10-09 04:56:03	
Turkey admits not disclosing number of all Covid-19 cases	428	55	2020-10-01 15:57:57	
Spanish Government declares State of Emergency for capital Madrid	429	56	2020-10-09 14:58:51	
Small study shows Moderna vaccine creates antibodies in older patients	426	34	2020-09-30 19:40:25	
White House embraces declaration that opposes lockdowns and relies on herd immunity	427	275	2020-10-14 03:17:16	
Australia Likely To Be Closed Off To Tourists Until Late 2021	429	98	2020-10-08 19:57:27	
Dr. Fauci calls Great Barrington Declaration ‘ridiculous’ and ‘total nonsense’	428	149	2020-10-15 17:17:15	
Regal Cinemas Likely Suspending Operations at All U.S. Locations	419	114	2020-10-04 22:39:17	
‘We Are Losing Parts of Our Culture’: Virus Tears Through Choctaw Community	424	16	2020-10-08 14:22:28	
The FDA Is Slowing Down COVID-19 Vaccine Approval. That Could Be Good for Public Health	422	35	2020-10-08 13:26:47	
U.S. Sees Most New COVID Cases In Two Months; L.A. County Above 1,000 Again	416	59	2020-10-10 07:05:49	
Russians spread fake news over Oxford coronavirus vaccine	420	28	2020-10-17 23:33:27	
Face masks unlikely to cause over-exposure to CO2, even in patients with lung disease	416	65	2020-10-02 12:23:23	
Research suggests school reopenings contribute to rise in COVID-19 cases	416	96	2020-09-24 15:16:41	
United States reports only 324 deaths, lowest since July 5th	411	111	2020-09-29 05:25:16	
Miami Beach Will No Longer Enforce County-Wide Curfew, Opening Door For Clubs To Stay Open Until 5 AM	409	101	2020-10-18 15:39:53	
New Zealand refuses quarantine-free trips from Australia as Australian Capital Territory joins travel bubble: NZ PM Jacinda Ardern says her country will not open up until Australia records a month without community transmission of Covid-19	412	87	2020-10-03 23:08:18	
Trudeau announces purchase of 20 million doses of Oxford University COVID-19 vaccine	416	71	2020-09-26 04:45:27	
No COVID-19 related deaths in Arizona for 2nd day, 475 new cases reported	408	46	2020-10-13 02:31:31	
Plexiglass Barriers Won’t Stop the Virus at the Debate, Experts Warn	410	98	2020-10-07 22:59:39	
Italy to make masks compulsory outdoors	409	154	2020-10-07 16:01:47	
Wisconsin tops 2,000 COVID-19 cases for 4th straight day	406	44	2020-09-28 05:35:59	
Texas schools tell teachers with medical risks they must return to classrooms during the pandemic	410	80	2020-10-20 20:29:25	
Twenty-two US troops test positive for coronavirus after flying to South Korea from States	404	45	2020-10-13 12:34:47	
A third surge of coronavirus infections has now firmly taken hold across much of the United States.	413	220	2020-10-21 07:23:13	
Canada and U.S. border to stay closed to non-essential travel until November 21	405	109	2020-10-19 18:40:08	
Coronavirus: California's cases stay flat despite national surge	400	89	2020-10-17 02:48:17	
The 'shocking' impact of COVID-19: Americans, young and old, have lost 2.5 million years of life, Harvard researcher says	403	55	2020-10-21 04:15:46	
Trump COVID-19 live updates: President doing 'well,' no longer has fever, doctor says	401	453	2020-10-03 20:19:02	
Eight months in, California is containing COVID-19 as other states spike. Here’s why.	403	112	2020-10-18 19:15:41	
UK reports 12,594 new coronavirus cases, biggest one-day increase on record without a backlog	396	82	2020-10-05 20:08:52	
White House blocks CDC order to keep cruise ships docked	393	41	2020-09-30 21:07:56	
Lesson not learned: Europe unprepared as 2nd virus wave hits	394	116	2020-10-10 11:08:39	
Are You Ready for a Second Round of Pandemic Lockdowns?	389	318	2020-09-26 16:35:44	
Calls to pursue herd immunity are 'callous, dangerous nonsense': immunologist | CBC Radio	395	103	2020-10-19 18:45:05	
Coronavirus vaccination to be made free in Japan	389	46	2020-10-02 11:16:41	
NEW: Netherlands reports 6,504 new coronavirus cases, the biggest one-day increase on record. - In hospital: 1,190 (+51) - ICU: 235 (-4) - Deaths: +24	388	153	2020-10-10 17:56:47	
Amazon fined by OSHA for coronavirus safety violations at two California warehouses	387	15	2020-10-10 03:29:00	
Long Covid: Long-term effects of coronavirus include damage to heart, liver, kidneys - Oxford study reveals	381	55	2020-09-30 02:03:36	
Brazil is investigating at least 247 possible cases of COVID-19 reinfection, according to CNN Brazil. All tested negative between the two episodes. More research is needed to confirm reinfection.	383	99	2020-10-20 06:20:43	
Millions of Americans risk losing power and water as massive, unpaid utility bills pile up	385	126	2020-10-02 01:51:23	
Parliament’s bars exempt from 10pm coronavirus curfew [UK]	379	43	2020-09-28 13:57:38	
Grocers Stockpile, Build ‘Pandemic Pallets’ Ahead of Winter Resurgence of Covid-19 cases and the impending holiday rush prompt retailers to sideline lean-inventory strategies	377	73	2020-09-28 01:36:23	
Study: 23% of all medical research output dedicated to COVID-19 and related conditions	376	94	2020-09-29 21:53:39	
Italy's daily coronavirus cases soar to new daily record above 15,000	400	157	2020-10-21 19:25:48	
CVS to hire 15,000 workers to prepare for more COVID-19 cases: CNBC	375	17	2020-10-19 14:48:25	
Facebook Greatest Source Of Covid-19 Disinformation, Journalists Say - International Survey Nominates Social Media Giant As Worst Offender, Ahead Of Elected Officials	379	50	2020-10-14 17:47:43	
Scientific Studies Looking For Participants	471	108	2020-10-03 20:31:05	"*What happened to the old post/Why did you guys make a new post? - Reddit automatically archives posts after 6 months, so we needed to make another post to keep it active in order to add studies*

With the rapid increase in severity of the coronavirus situation, we feel as though it is important to make a difference in any way we can. 

Therefore, we are calling on YOU, our users, to help scientists progress research!

**What does this mean?**

This post will host all of the studies/surveys for users to participate in. **Participation is strictly voluntary, and you may withdraw from any of the below studies at any time.** This post will be stickied to the r/Coronavirus subreddit whenever possible in order to give these projects ample exposure.

**For Researchers:** If you would like to have your study/survey posted, please [send us modmail](https://www.reddit.com/message/compose?to=%2Fr%2FCoronavirus) and we will give you instructions on how to verify your study.

In addition, there is a useful resource available for researchers from SafeGraph. They are sharing their data and that of their partners free for non-commercial and academic research use. To access this database, please [click here](https://www.safegraph.com/covid-19-data-consortium?utm_source=consortium_outreach&utm_campaign=consortium_rd)

**For Users:** Feel free to click on the links to any of the studies posted here that interest you and for which you qualify. Again, you are under no obligation to participate in any of the studies listed.


**Disclaimer:** All of the studies posted here have been verified to be authentic studies, either from a recognized research facility, government organization, or academic institution, and are conducted with all the necessary ethical and legal considerations. Individual studies may outline their specific disclaimers in the comments.

**NOTE: This post will remain active at all times. Please check back intermittently as we will be adding new studies on a regular basis. We may unpin the post from our front page to promote featured projects or AMAs, but we will re-pin it after the special events have ended. Individual comments with study details will be removed when the study has ended.**"
Canadians removed from EU's list of approved travellers because of rising COVID-19 cases | CBC News	405	109	2020-10-21 19:53:00	
To avoid quarantining students, a school district tries moving them around every 15 minutes	372	113	2020-10-21 06:25:04	
Californians hospitalized with COVID-19 at lowest level in 6 months	377	70	2020-10-13 04:02:51	
Mouthwashes, oral rinses may inactivate human coronaviruses	381	101	2020-10-20 14:33:24	
Ontario shutting down indoor dining, gyms and movie theatres in three COVID-19 hotspots	377	101	2020-10-09 22:33:26	
How the U.S. 'Uniquely Mismanaged' the Coronavirus Pandemic	375	77	2020-09-25 21:44:41	
Coronavirus Victoria: Melbourne makes world history crushing second wave	375	136	2020-10-20 08:11:29	
'Thank the Lord': 102-year-old woman beats COVID-19, returns home to family	366	42	2020-10-16 17:06:55	
The 'evidence is clear': Hydroxychloroquine doesn't help Covid-19 patients	375	58	2020-10-09 22:41:44	
Schools In Several States Withholding COVID Data	363	27	2020-10-10 16:07:25	
Coronavirus pandemic to cost Americans $16 trillion, study finds	360	81	2020-10-12 22:38:52	
NEW: Netherlands reports 4,007 new coronavirus cases, biggest one-day increase on record. Number in hospital rises to 810 (+69), of which 163 are in ICU (+7)	361	108	2020-10-04 17:42:23	
17-year-old girl becomes North Dakota's youngest COVID-19 death	365	48	2020-10-10 20:44:11	
UK reports more than 21,000 new coronavirus cases, biggest one-day increase on record - New cases: 21,331 - Positivity rate: 8.2% (+2.1) - In hospital: 6,899 (+506) - In ICU: 654 (+30) - New deaths: 241	364	78	2020-10-20 19:45:33	
Face masks don't restrict oxygen or contribute to carbon dioxide buildup.	357	45	2020-10-03 03:40:19	
Dutch coronavirus cases jump by more than 8,500, new daily record	363	35	2020-10-21 16:51:15	
'The old normal is gone': Reluctance to adopt COVID-19 guidelines increasing spread, expert warns	356	155	2020-10-04 17:33:08	
Ohio shatters record for single-day increase in COVID-19 cases	353	43	2020-10-15 01:03:40	
Europe crosses 150,000 daily coronavirus cases mark, a week after reporting 100,000 daily cases	358	85	2020-10-18 01:01:39	
COVID-19 may deplete testosterone, helping to explain male patients' poorer prognosis: Over half of male patients studied were found to have lower than their normal testosterone levels	350	59	2020-09-29 16:12:14	
Photos: The Crowd At Tonight's Georgia Game Is Going Viral	349	126	2020-10-04 07:48:47	
It’s Time for the Debates to Go Remote - The events of the past week show that in-person showdowns won’t work in this pandemic, with this administration.	349	28	2020-10-07 12:04:57	
Over 2,000 at party during USC football game ignored social distancing, officials say	347	80	2020-10-19 00:06:01	
"Fauci: COVID-19 numbers would have to ""get really, really bad"" before advocating national lockdown"	353	191	2020-10-17 23:24:23	
Second COVID-19 wave has already started: PM in address to nation	349	98	2020-09-24 06:51:34	
New Zealand reports 1st new community case of COVID-19 in 23 days	344	107	2020-10-18 04:19:55	
Oregon sets highest-ever daily COVID case count - 457 cases most-ever in a single day since pandemic began in mid-March	346	48	2020-09-26 01:01:27	
Chinese Covid-19 vaccine found to be safe on humans: Study	345	104	2020-10-17 01:59:07	
Rabbi Avrohom Pinter went door-to-door to deliver public health warnings about COVID; within days he caught the virus himself and died	343	56	2020-10-13 12:13:21	
No, the Regeneron drug Trump received is not a Covid-19 “cure”	343	80	2020-10-10 12:40:21	
US and Italy – current and former COVID-19 epicenters – are worlds apart in pandemic approach	344	80	2020-10-17 15:46:52	
Small study finds Moderna's COVID-19 vaccine may work equally well in older people as it does in younger adults	344	20	2020-09-30 01:16:24	
Whitmer orders Michigan schools to tell the public about COVID cases	341	14	2020-09-26 17:01:07	
Covid reinfection: Man gets Covid twice and second hit 'more severe'	340	96	2020-10-13 08:54:28	
Missouri governor’s wife tests positive for COVID-19; governor postpones travel	343	29	2020-09-23 23:35:59	
Do you trust the information you are hearing about COVID-19?	340	260	2020-10-13 01:17:20	"There's a lot of information being shared each day about COVID-19, and we know it can sometimes be hard to know what to believe. The **PBS NewsHour** is trying to learn more about how people are getting their information about the virus, and we need your help. 

If you have thoughts on COVID-19, do us a favor and [**fill out this Google form**](https://forms.gle/umJuKaGk1YD7PDFB9). If you don't mind being contacted by a producer for a follow-up, let us know. The information you provide will not be linked back to your reddit username."
Never-ending cemeteries stretch across Brazilian cities as coronavirus cases soar	342	36	2020-10-04 07:10:27	
Over $150,000 in Fines Issued on First Weekend of New N.Y.C. Lockdown	340	141	2020-10-12 20:56:56	
Corona is also a danger to the athletic heart	341	28	2020-10-03 17:41:29	
Coronavirus live news: France sees record new cases; virus may be becoming more contagious	335	125	2020-09-25 04:03:10	
Australia only recorded 5 new COVID-19 cases today (28 Sep), all in Victoria.	338	57	2020-09-28 05:51:42	
Texas Surpasses 15K Coronavirus Deaths	343	81	2020-09-24 06:18:53	
Canada 'going in the wrong direction' on COVID-19, Trudeau says as cases rise through most of country	337	65	2020-10-06 07:27:12	
The US has reported more than 97,000 new Covid-19 cases since the news of Trump’s positive test | America’s Covid-19 outbreak is a lot bigger than President Trump.	333	28	2020-10-04 21:03:58	
With one of the highest infection rates of Europe, The Netherlands goes back in to partial lockdown again	332	84	2020-10-13 21:29:38	
AstraZeneca U.S. COVID-19 vaccine trial may resume as soon as this week	335	62	2020-10-20 20:55:14	
South Dakota Gov. Kristi Noem blames surge in cases on testing as hospitals fill	329	107	2020-10-14 21:58:55	
Netherlands reports 7,393 new coronavirus cases, the biggest one-day increase on record	334	196	2020-10-13 17:55:58	
Canadians encouraged to stay home as second wave of Covid-19 worsens	327	63	2020-10-09 14:10:01	
Depression anxiety and substance use are on the rise due to lockdowns.	329	122	2020-09-28 06:03:46	
Florida’s COVID-19 death toll is 15,531. This top GOP leader doesn’t believe it.	322	41	2020-10-14 17:02:31	
NYC Fines of Up to $15,000 a Day for COVID Rule Breakers Take Effect Friday	326	58	2020-10-09 16:40:52	
Young adults are now the largest group of Americans getting COVID-19, CDC says	325	159	2020-09-24 17:13:24	
Faith healing “school” becomes a COVID hotspot with 137 cases.	320	21	2020-10-09 20:31:58	
Freshman enrollment drops significantly at U.S. universities and community colleges.	324	131	2020-10-15 19:21:55	
COVID-19 causing stress, depression and obsessive behaviour: survey	324	74	2020-09-26 16:51:24	
No new coronavirus cases recorded in NSW for the first time in three months	317	18	2020-09-27 09:34:22	
Californians shouldn't trick-or-treat this Halloween, state health officials say	320	117	2020-10-14 02:33:08	
Study: mask mandates shown to significantly reduce spread of COVID-19	322	54	2020-10-08 03:27:34	
New James Bond movie pushed to April 2021 as coronavirus cases continue to rise	320	77	2020-10-03 18:00:36	
Virginia Gov. Ralph Northam and First Lady test positive for COVID-19	317	52	2020-09-25 17:57:19	
There are no active community coronavirus cases left in New Zealand, the Ministry of Health has revealed	320	22	2020-10-07 04:45:05	
CEO calls monster trucks a 'necessity,' launches first arena tour during the pandemic	315	50	2020-09-29 21:08:38	
Mexico: Wedding resulted in 100 infected with coronavirus	323	12	2020-10-21 05:50:53	
Las Vegas Strip Resorts Rank High as Possible COVID-19 Exposure Sites: Report	320	35	2020-10-19 02:52:32	
John Hagee, prominent megachurch pastor, ill with COVID-19	313	35	2020-10-07 10:32:59	
Antarctica, the only continent without coronavirus, braces for summer rotation	314	29	2020-09-27 17:40:45	
U.S. COVID-19 cases hit two-month high, 10 states report record increases	312	32	2020-10-10 14:59:21	
"Dutch official and head of ICU union says government's half-measures are not working: ""I am very much in favor of going in [total] lockdown as soon as possible"""	311	67	2020-10-10 20:39:19	
A U.S. astronaut was potentially exposed to COVID by Russia — which kept quiet, emails show	307	31	2020-10-05 17:58:20	
Want to reduce your COVID-19 risk? You need to sleep more.	306	71	2020-10-01 21:02:58	
Amid COVID-19 pandemic, world needs masks, not weapons, declares Prime Minister of Nepal	311	18	2020-10-01 07:14:40	
Meatpackers deny workers benefits for COVID-19 deaths, illnesses	307	42	2020-09-29 16:30:08	
"""Silent wave"" of brain damage could follow pandemic"	314	88	2020-09-27 16:25:27	
Florida puts a positive spin on COVID-19 data, misleading the public on pandemic	305	42	2020-10-15 14:25:08	
UK reports 17,540 new coronavirus cases, the biggest one-day increase on record	308	91	2020-10-08 19:31:42	
France sees record new coronavirus infections, with more than 16,000 cases(the equivalent of 80,000 US cases) in just 24 hours	306	221	2020-09-25 13:44:24	
[Link in Portuguese] Chinese coronavirus vaccine did not give side effects in 94.7% of volunteers	305	177	2020-09-23 21:25:02	
‘We’re Out of Beds’: Russia’s Resurgent Coronavirus Outbreak Is Approaching First Peak	307	29	2020-09-30 17:23:05	
Proposal to hasten herd immunity to the coronavirus grabs White House attention but appalls top scientists	305	179	2020-10-14 05:05:12	
San Antonio pediatric nurse practitioner back home after battling COVID-19 for months in hospital	304	9	2020-10-06 17:52:31	
