title	score	num_comm	created	contentKeep your mask on when you're indoors in a place of business even if there's no one around you: Tiny airborne particles may pose a big coronavirus problem	1664	179	2020-10-04 14:49:27	
If North Dakota was a country, it would have the world's worst confirmed COVID-19 outbreak, one analysis shows	2413	299	2020-10-21 23:23:19	
Republican U.S. Senator Mike Lee has tested positive for coronavirus	1664	244	2020-10-02 19:46:34	
Coronavirus cases in Arizona dropped 75% after mask mandates began, officials say in new CDC report	1664	107	2020-10-10 20:19:34	
Family of Tyson employee in Iowa who died of COVID-19 sues company, alleging gross negligence	1655	43	2020-10-07 17:41:12	
Americans might never go back to the office, and Twitter is leading the charge	1639	455	2020-10-01 16:09:44	
The world crosses an ominous milestone, recording more than 1 million new cases in three days.	1633	240	2020-10-11 01:10:50	
A High School Student created a website to track Covid-19 cases in U.S. public schools.	1634	50	2020-10-17 21:02:50	
“It is a slaughter”: Infectious disease icon asks CDC director to expose White House, orchestrate his own firing	1600	71	2020-10-07 07:54:35	
Sorry to burst your COVID-19 'social bubble' but even small gatherings are getting riskier	1567	482	2020-09-24 22:21:44	
Coronavirus cases are rising in US heartland, home to anti-mask feelings	1565	294	2020-09-27 01:38:40	
Governor Newsom says Disneyland and other parks not re-opening anytime soon	1558	220	2020-10-09 07:10:59	
Germany Has Its Own Dr. Fauci—and Actually Follows His Advice	1560	167	2020-09-28 21:41:42	
Notre Dame’s President Faces an Angry Campus After Getting the Coronavirus	1549	149	2020-10-08 02:07:22	
Bill Gates: The Pandemic Has Erased Years of Progress	1554	216	2020-09-24 08:07:54	
A new study in Italy found that deaths from Covid-19 are less likely to occur in the communities with higher rates of flu vaccines	1521	69	2020-09-28 17:14:27	
Shorter time from symptom onset to hospitalization is associated with worse outcome in patients with COVID-19	1516	140	2020-10-05 14:56:45	
Dr. Fauci Says Some Places 'Better Hold Off' on Thanksgiving Celebrations	1503	307	2020-10-06 08:07:15	
COVID-19 cases in US grow at a speed not seen since July, the summer peak	1503	281	2020-10-16 23:10:58	
Italy reports 5,724 new coronavirus cases, biggest one-day increase since March.	1472	218	2020-10-10 22:35:51	
Dr. Scott Gottlieb: U.S. about ‘a week away from a rapid acceleration’ of coronavirus cases	1465	344	2020-10-20 16:28:13	
20-Something Who Thought COVID Was 'Bull****' Pleads From ICU to Wear Masks	1459	259	2020-09-26 20:43:01	
US states stopped their pandemic social restrictions too soon	1448	222	2020-10-09 05:21:11	
Oxford University says COVID-19 patients experience symptoms months after contracting virus	1448	131	2020-10-19 14:50:19	
Dr. Fauci says to take vitamin D if you're deficient	1422	189	2020-09-27 10:57:45	
Oregon now requires employers to provide masks to workers	1424	81	2020-10-21 07:13:14	
More than 6M households missed their rent or mortgage payment in September	1411	169	2020-10-18 00:55:06	
U.S. Virus-Death Rate Is World’s Worst Among Developed Nations	1399	177	2020-10-13 18:02:36	
Oklahoma City runs out of ICU beds as COVID cases spike	1379	178	2020-10-13 22:26:45	
North Dakota Coronavirus Cases Soar As State Rescinds Quarantine Order and Students Fail to Get Tested	1366	177	2020-09-25 16:48:23	
France reports 20,339 new coronavirus cases, by far the biggest one-day increase on record	1366	299	2020-10-09 22:11:18	
Nurses suffer burn-out, psychological distress in COVID fight - association	1354	100	2020-10-10 14:43:00	
New study suggests in person classes led to extra 3,200 cases per day across United States	1341	146	2020-09-25 01:26:16	
Ireland to move to level 5 lockdown (highest level of restrictions) for six weeks	1339	447	2020-10-19 19:46:28	
Clear Evidence COVID-19 Mask Mandates Significantly Reduce Spread of Virus	1329	130	2020-10-07 22:46:13	
NYC sheriffs break up indoor wedding with nearly 300 guests - NBC News - Sept 29 2020	1296	153	2020-09-29 14:58:06	
Women more cautious, half as likely to die of COVID-19 than men - study	1285	206	2020-10-17 16:51:04	
Coronavirus survives on skin five times longer than flu, Japan study finds	1285	133	2020-10-19 05:10:31	
World-first coronavirus test can detect superspreaders, infectious rate	1306	87	2020-10-21 16:24:03	
'Loss of smell clearer sign of Covid than cough'	1246	135	2020-10-02 17:16:05	
COVID-19 was twice as contagious as experts thought when pandemic started, study says	1236	180	2020-09-29 04:18:15	
White house says stimulus relief negotiations over until after election, pulling back from aid talks	1225	398	2020-10-06 23:50:55	
Positive Tests for Senators Raise Questions About Timing of Barrett Hearings	1218	144	2020-10-03 09:58:32	
‘It Is A Simple Thing To Do’: Gov. Newsom Gets Flu Shot During Middle Of Press Conference	1220	113	2020-09-29 02:10:07	
Sen. Mike Lee, Recently Infected With Coronavirus, Attends Confirmation Hearing	1213	165	2020-10-13 00:53:06	
Superspreading outbreak reaches 51 cases from asymptomatic carrier in spin class that observed screening and physical-distancing guidelines	1190	284	2020-10-13 19:21:06	
‘I Feel Like I Have Dementia’: Brain Fog Plagues Covid Survivors	1184	171	2020-10-11 20:50:35	
Memorial held outside White House in solemn reminder of more than 200,000 Americans killed by covid-19	1187	108	2020-10-05 16:10:58	
Trump quarantined due to possible exposure	1177	349	2020-10-02 07:04:07	
'Near extinction' of influenza in NZ as numbers drop due to lockdown	1176	251	2020-10-11 08:15:23	
Amazon says more than 19,000 workers got Covid-19	1144	122	2020-10-02 01:30:28	
Donald Trump biggest driver of COVID-19 misinformation: study	1148	61	2020-10-03 00:07:23	
Coronavirus: Target to pay hourly employees $70M-plus in bonuses ahead of holidays	1146	83	2020-10-20 17:43:02	
Scientists say social distancing is working — for a completely different disease than COVID-19 | Early evidence suggests that mask-wearing will save thousands of lives from influenza as well as COVID-19 deaths	1137	146	2020-10-02 21:49:12	
Pope wears mask for first time at public service	1138	46	2020-10-20 20:26:32	
Little evidence that White House has offered contact tracing, guidance to hundreds potentially exposed	1129	63	2020-10-04 21:09:21	
White House Blocks New Coronavirus Vaccine Guidelines	1126	191	2020-10-06 03:23:18	
GOP leader: No mask mandates, Michigan needs to learn to live with coronavirus	1115	278	2020-10-03 23:47:04	
Trudeau says any approved COVID-19 vaccine will be free for all Canadians	1113	185	2020-10-08 08:15:39	
North Carolina teacher becomes 8th killed by COVID since school year began	1107	76	2020-10-05 21:31:14	
Swedish virologist says her country's COVID-19 strategy has failed, but nobody will admit it	1058	407	2020-10-20 09:11:13	
If the US Had Australia's Covid-19 Death Rate, it Would Have Had 187,661 Fewer Deaths	1055	296	2020-10-14 20:20:09	
Two More WH Staffer + Journalist Test Positive for COVID - Identities Unknown	1040	70	2020-10-02 21:35:15	
Vietnam has reached 3 weeks without community transmission of coronavirus	1037	121	2020-09-23 17:31:18	
Top military leaders quarantined after official tests positive	1034	111	2020-10-06 21:56:15	
YouTube bans coronavirus vaccine misinformation	1020	164	2020-10-14 17:33:41	
France reports 30,621 new coronavirus cases, by far the biggest one-day increase on record | Positivity: 12.6% (+0.4) | In hospital: 9,605 (+411) | ICU: 1,750 (+77) | Deaths: +88	1008	413	2020-10-15 21:53:16	
Harvard expert: Worst case COVID vaccine scenario is if people don't take it	996	323	2020-10-05 02:04:54	
New York City is 'on the edge of a precipice' as coronavirus cases grow, former CDC director says	996	189	2020-10-04 03:35:28	
South Dakota Reports 38% Positivity Rate In Daily Virus Tests	991	199	2020-10-12 21:12:13	
Dr. Fauci contradicts Trump's false claim that Covid-19 is as deadly as flu	985	74	2020-10-07 03:07:54	
"Fauci says he told Trump to ""shut the country down"""	986	148	2020-10-07 19:53:54	
Study confirms men have 62% increased risk of COVID associated death, possibly related to higher degree of inflammation	987	81	2020-09-24 12:37:42	
Johnson & Johnson Phase 3 Clinical Study Now Paused Due to An Unexplained Patient Illness	974	295	2020-10-13 04:46:35	
‘Super Healthy’ College Student Dies of Rare Covid-19 Complications	971	158	2020-09-30 05:12:31	
California’s Filipino American nurses are dying from COVID-19 at alarming rates	957	74	2020-10-04 23:27:52	
Breathing with face mask does not alter oxygen level; virus can last nine hours on skin	949	96	2020-10-06 00:17:02	
French President Macron is considering an 8 p.m. curfew in Paris as COVID cases continue to rise. He will address the nation at 8 p.m. tomorrow	949	163	2020-10-13 23:02:43	
UK reports 14,542 new coronavirus cases, by far the biggest one-day increase on record	950	95	2020-10-06 19:21:28	
Reopening Colleges Likely Fueled Covid-19 Significantly, Study Finds	939	96	2020-09-23 23:02:18	
"Disney Parks to layoff 28,000 Employees; Cites California's ""Unwillingness"" to Reopen Disneyland"	938	387	2020-09-30 01:14:49	
Florida lifts all COVID-19 restrictions	929	403	2020-09-29 02:23:38	
Washington state tells BNO News it's investigating 120 suspected cases of COVID-19 reinfection. All have at least 3 months between both episodes, but more research is needed to confirm or rule out reinfection	927	266	2020-10-21 03:39:10	
Ambulance driver who ferried 200 bodies of Covid patients since March dies of virus in Delhi	920	19	2020-10-11 21:30:47	
Johnson & Johnson Begins Large Trial of Its One-Shot Vaccine	919	223	2020-09-23 14:56:57	
Trudeau Plans to Keep Borders Closed Until Covid-19 Cases Drop	918	172	2020-10-14 23:29:18	
Coronavirus is spreading quickly in 31 of 50 U.S. states, data shows	916	144	2020-09-30 17:11:46	
‘Show me the evidence’: Doug Ford rejects calls to close indoor dining amid spike in COVID-19 cases	909	130	2020-10-06 07:24:50	
Prepare for a ‘marathon’ and two years of wearing masks to battle COVID-19, says prominent Spanish virologist	914	469	2020-10-08 18:49:21	
'My Brain's Not as Sharp': Covid Woes Stalk Workers Back on Job	906	123	2020-10-06 20:29:47	
U.S. CDC reports 213,037 deaths from coronavirus	909	174	2020-10-11 16:04:45	
Coronavirus: Most people who test positive for COVID-19 have no symptoms when they take test - study	904	64	2020-10-08 14:04:51	
Melatonin is significantly associated with survival of intubated COVID-19 patients	908	89	2020-10-19 02:52:12	
WHO warns of growing ‘Covid-19 fatigue’ across Europe as cases rise	906	346	2020-10-06 17:22:56	
New study: Face-covering use up, more people are taking COVID-19 threats seriously	906	81	2020-09-24 07:45:38	
100 N.Y.C. School Buildings Have Already Reported a Positive Case	898	171	2020-09-24 15:12:44	
Wales imposes two-week lockdown: 'everybody must stay at home'	888	102	2020-10-20 05:08:55	
NFL teams could lose draft picks if coaches don’t wear masks	883	75	2020-10-01 16:53:20	
After week of record high COVID numbers, top Oklahoma doctor says more aggressive measures are needed to save lives	879	63	2020-10-18 03:35:00	
Kenzo Takada, the founder of French fashion house KENZO, has died from COVID-19	882	29	2020-10-04 19:29:33	
Dogs That Can Smell Coronavirus Screen Travelers at Airport: A pilot study at the Helsinki airport has trained dogs to smell coronavirus in a sample of a person's sweat with near 100% accuracy	878	54	2020-09-28 06:30:28	
Fauci calls for racial and ethnic diversity in coronavirus vaccine trials	850	53	2020-10-01 01:36:22	
The covid-19 pandemic is worse than official figures show	838	238	2020-09-25 17:32:57	
France’s coronavirus second wave ‘arriving faster than we thought’	833	129	2020-09-27 13:56:07	
Dutch King Willem Alexander and Queen Maxima returning home because of backlash after it was revealed they left for a vacation to Greece today while the Netherlands went on partial coronavirus lockdown	835	95	2020-10-16 23:18:21	
Covid-19 Zero new cases today; No-one in hospital with virus - New Zealand	827	69	2020-10-12 14:16:29	
Nurse lived in trailer to protect wife from COVID-19 during pregnancy	828	30	2020-10-19 18:42:58	
Negative COVID-19 Test Not a Substitute for 14-Day Quarantine, Experts Say	821	65	2020-10-03 10:38:28	
Dr. Fauci Predicts COVID-19 Vaccine by April 2021	817	315	2020-10-15 20:03:36	
Covid-19 tests that give results in minutes to be rolled out across world	813	80	2020-09-28 19:56:20	
A Redding [CA] Megachurch Leader Came to Humboldt and Flouted Mask Rules. Her Ministry is Now the Source of a Major COVID Outbreak.	808	74	2020-10-15 14:18:39	
As virus fills French ICUs anew, doctors ask what went wrong	802	361	2020-10-09 14:56:10	
(Sweden) The wastewater shows that the virus levels are increasing sharply in Stockholm (translation in comments)	808	376	2020-10-05 13:18:47	
A 'herd mentality' can’t stop the COVID-19 pandemic. Neither can a weak vaccine.	803	144	2020-10-04 03:54:20	
Texas Reports Most Coronavirus Hospitalizations In Nearly 2 Months	799	34	2020-10-20 03:37:00	
Pfizer Says It Won’t Seek Vaccine Authorization Before Mid-November	803	178	2020-10-16 15:27:38	
Pfizer Sets Up Its ‘Biggest Ever’ Vaccination Distribution Campaign	843	248	2020-10-21 17:43:35	
It’s not going away: We need a real, non-political debate about the best way to live with COVID or countries will fracture	793	296	2020-10-13 17:21:50	
Wisconsin sets new record for daily COVID-19 deaths as surge in cases threatens to overwhelm hospitals	797	119	2020-10-01 15:03:50	
Argentina’s Covid Outbreak Worsens With 47% of Tests Positive	782	90	2020-10-05 07:16:00	
Florida police dissolve 1,000-person party as state coronavirus cases pass 700,000	775	64	2020-09-29 06:01:59	
"Half of the swedish ""idol"" participants are infected"	768	149	2020-10-04 00:44:56	
"Trump has COVID-19, is ""fatigued,"" given experimental drugs"	770	267	2020-10-03 00:51:50	
Florida now has more than 700,000 confirmed COVID-19 cases	760	75	2020-09-27 20:17:40	
US reports 70,078 new cases of Covid-19 and 1,001 new deaths on Saturday	769	193	2020-10-17 21:24:06	
The US is beginning to see a resurgence of Covid-19 cases. Small household gatherings are helping drive the surge, CDC chief says	743	381	2020-10-14 15:35:32	
COVID-19 Is Now the Third Leading Cause of Death in the U.S.	747	61	2020-10-08 22:34:36	
Cristiano Ronaldo tests positive for COVID-19	735	122	2020-10-13 18:32:20	
Preventative nasal spray shown to reduce viral replication by up to 96% in COVID-19 challenge study	739	61	2020-09-28 18:57:46	
Our co-workers had coronavirus, but our boss never told us	723	85	2020-10-01 20:41:08	
Las Vegas, Nashville currently have highest rates of COVID-19 infections among US cities	730	130	2020-10-06 06:17:16	
Pack The Swamp? Gov. Ron DeSantis gives clearance for full capacity stadiums in Florida	723	201	2020-10-08 00:49:16	
TX - Galveston County judge signs executive order permitting $1,000 fine against poll workers who turn away maskless voters.	724	273	2020-10-18 00:46:44	
We’re in trouble when the COVID-19 death of a Middleton school staffer is a ‘hiccup’	715	86	2020-09-25 17:54:38	
Largest COVID-19 contact tracing study to date finds children key to spread, evidence of superspreaders	710	154	2020-10-01 18:55:08	
Numbers show lockdowns are a 'no brainer'. Letting people die isn't	708	257	2020-10-04 16:18:46	
Czech Republic - Prime minister to people: if you will not follow our guidelines I will lock you all down.	715	122	2020-10-09 15:47:36	
CBD helps reduce lung damage from COVID by increasing levels of protective peptide	716	106	2020-10-20 18:10:11	
Scientists Confirm Nevada Man Was Infected Twice With Coronavirus	701	147	2020-10-13 03:23:30	
Who Did Trump Infect? Tracing His Contacts Is a Big Task	696	100	2020-10-02 23:39:45	
Dallas is on its way to a second, ‘worse’ spike in COVID-19 cases, says Parkland CEO	732	54	2020-10-21 18:33:57	
Report: Estimated 3 Million US Children Have Had No Formal Education Since Pandemic Began	11116	766	2020-10-22 06:23:47	
Judge reinstates Wisconsin emergency order limiting public gatherings	687	41	2020-10-19 20:50:30	
New Zealand reports 0 new cases of coronavirus, a day after reporting its first domestic case in 3 weeks, linked to a ship - New cases: 0 - Positivity rate: 0% (-0.03) - Active cases: 37 (-5) - In hospital: 0 (-) - New deaths: 0	677	85	2020-10-19 04:58:19	
The ‘darkest’ period of the coronavirus pandemic is still to come, warns top infectious-disease doctor	667	430	2020-10-19 06:50:47	
Online videos falsely claim that face masks can cause CO2 poisoning	667	112	2020-09-30 22:56:57	
'Bad math': Airlines' COVID safety analysis challenged by expert	670	70	2020-10-19 15:17:09	
About 110,000 Californians have bought a gun since the coronavirus arrived, study says	664	388	2020-10-18 17:59:30	
Arizona State Representative Lorenzo Sierra in ICU with COVID-19 symptoms	656	37	2020-10-05 18:59:56	
“To avoid contamination at Christmas”, two Nobel Prize winners in economics recommend confinement from December 1 to 20	667	159	2020-09-27 00:35:37	
NEW: France declares public health emergency amid surge in coronavirus cases; Macron will address the nation at 8 p.m. - BFM	656	111	2020-10-14 21:47:45	
Schools and businesses to close in New York City neighbourhoods hit again by Covid-19	654	89	2020-10-04 21:29:53	
Excess deaths in the U.S. rise to nearly 300,000, according to the CDC. Every week since March had more deaths than expected	653	78	2020-10-20 21:48:48	
Coronavirus cases are rising in U.S., sparking worries the next big wave has begun	647	238	2020-10-14 03:50:02	
Majority of kids who die of coronavirus are Hispanic, Black, or Native American, CDC finds	651	94	2020-10-17 20:21:31	
Even with a Severe Lung Condition, You Can Safely Wear a Mask	1447	139	2020-10-22 03:52:30	
White House Opposes Expanded Virus Testing, Complicating Stimulus Talks	642	109	2020-10-17 17:16:32	
Seattle-area man is the third person in the U.S. confirmed to have been infected twice with coronavirus	639	142	2020-10-15 21:54:06	
"Wisconsin Governor Evers activates field hospital, says healthcare systems are ""beginning to become overwhelmed"" as number of COVID patients triples from 289 to 853 in one month"	627	73	2020-10-07 22:25:45	
Trump’s Friday Florida rally nixed, Miami debate in doubt after president’s COVID test	634	86	2020-10-03 19:44:15	
Florida Governor Ron DeSantis moves to fully reopen the state's economy	630	390	2020-09-25 20:32:38	
Wisconsin surpasses 1,500 coronavirus deaths, reports more than 3,200 new cases in worst day of pandemic yet	629	110	2020-10-14 03:10:32	
CDC Expands Covid Risk Warning to Include Overweight People	622	121	2020-10-09 01:16:50	
Australia only reported 16 COVID infections today, nation-wide.	620	123	2020-09-26 12:01:34	
18 to 22-year-olds banned from gathering in Boulder, Colorado, after coronavirus surge	612	225	2020-09-25 00:35:57	
As cold weather arrives, U.S. states see record increases in COVID-19 cases	608	93	2020-10-05 03:05:15	
NEW: UK reports 12,872 new coronavirus cases, biggest one-day increase on record. This includes a backlog (unclear how many)	613	93	2020-10-03 23:56:03	
Patriots-Chiefs game postponed after positive COVID-19 tests on both teams	610	82	2020-10-03 20:18:21	
Vitamin D deficiency increased risk of COVID in healthcare workers, new study shows	613	87	2020-10-08 12:39:58	
New Zealand marks 1 week without community transmission of coronavirus	607	34	2020-10-03 04:09:16	
NEW: Belgium reports nearly 11,000 new coronavirus cases, biggest one-day increase on record	606	143	2020-10-18 20:16:49	
Fearful of the pandemic and threats from riders, Detroit's bus drivers refuse to work	607	41	2020-10-03 12:55:11	
Mother of SC teacher who died from COVID-19 dies weeks after daughter	613	106	2020-09-27 20:27:53	
MI ‘actively considering’ ordering K-12 schools to reveal COVID outbreaks	614	62	2020-09-25 15:52:29	
US passes UK in official total Covid-19 deaths per million	605	121	2020-09-28 13:39:46	
Ireland announces six-week coronavirus lockdown	604	115	2020-10-21 04:55:13	
Johns Hopkins Researchers Identify Immune System Pathway That May Stop COVID-19 Infection	599	51	2020-10-18 16:16:12	
Japan to Lift Travel Ban to 12 Countries, Including China But Not U.S.	601	118	2020-10-09 05:18:52	
A Student Dies, and a Campus Gets Serious About Coronavirus	592	84	2020-10-05 15:46:27	
Trudeau not taking kids trick-or-treating for Halloween this year due to coronavirus	598	152	2020-10-21 02:31:29	
COVID-19 Cases On The Rise In Nearly Half The U.S.	590	134	2020-09-27 03:06:25	
US Parents Delaying Preschool and Kindergarten Amid Pandemic	587	212	2020-09-25 13:42:18	
France: 30,000 new cases today, 1,939 patients in intensive care	589	74	2020-10-18 23:31:20	
A lot of misinformation is being shared about the death of a vaccine volunteer in Brazil. Here's what we know so far: - Doctor, 28, died of COVID-19 complications - He is reported to have received a placebo, not the vaccine - Oxford University: No safety concerns, trial continues	755	69	2020-10-21 22:47:45	
“Herd Immunity” is Not an Answer to a Pandemic	585	304	2020-10-15 04:45:36	
Scotland's first minister has urged Margaret Ferrier to resign as an MP after she travelled from Glasgow to London with Covid-19 symptoms, then returned home after testing positive	581	20	2020-10-02 15:25:46	
New York Philharmonic Cancels Its Entire 2020-21 Season, Due To Coronavirus	576	49	2020-10-13 21:52:05	
Family urges mask wearing and kindness after 12-year-old dies of COVID-19	573	165	2020-09-29 19:27:53	
Oxford University coronavirus vaccine could be rolled out within six months: Report	579	213	2020-10-05 07:41:54	
No vaccine for cruelty: The pandemic has eroded democracy and respect for human rights	575	89	2020-10-18 16:49:53	
Governor releases video urging Michiganders to wear masks, practice social distancing	574	53	2020-10-06 06:35:11	
No end in sight for North Dakota coronavirus surge as deaths spike and hospitals strain	569	107	2020-10-10 23:54:03	
"""COVID-19 Patients Are Far More Ill During Current Wave,"" Mayanei HaYeshua Director Says"	571	165	2020-09-30 17:36:35	
Mom loses hearing in one ear after mild COVID-19 infection	573	111	2020-10-11 02:53:37	
Australia records second day without COVID-19 death for first time in three months	573	29	2020-10-09 09:42:34	
China's mainland reports first coronavirus outbreak in nearly 2 months with 12 confirmed cases in Qingdao. City's 9 million residents to be tested this week	564	272	2020-10-12 06:32:48	
Trump campaign manager Bill Stepien has tested positive for coronavirus	565	23	2020-10-03 08:06:29	
Argentina COVID update: Positivity rate: 72.5%	567	172	2020-10-12 04:00:17	
Former NJ Governor Chris Christie Released From Hospital After Positive COVID Test	561	269	2020-10-10 19:21:18	
COVID-19 is at least 5 times deadlier than flu for hospitalized patients	566	39	2020-10-21 07:22:05	
Hospital Over Capacity in 'Unsustainable' Coronavirus Spike	561	122	2020-10-19 05:43:53	
Population-wide testing in Slovakia not compulsory: but not taking part means 10-day quarantine	560	56	2020-10-20 15:00:30	
Czech Republic reports more than 11,000 new coronavirus cases, biggest one-day increase on record	558	105	2020-10-17 03:26:28	
Pandemic Spikes In Rural States, Where Small Hospitals Are Already In Financial Distress	559	87	2020-10-16 16:52:04	
'So many bodies,' says ambulance driver as India struggles to stem COVID-19 death toll	555	80	2020-09-26 03:27:08	
Coronavirus: ‘I used to film weddings but now I film funerals’	560	43	2020-09-27 04:15:34	
U.S. Adds 50,000 New Coronavirus Cases	556	112	2020-10-05 03:37:15	
Researchers surprised: 20% of Chicagoans in blood-test study came up positive for coronavirus antibodies	553	150	2020-10-09 17:50:20	
Polish gym declares itself a church to bypass coronavirus rules	550	105	2020-10-19 10:34:30	
Judge upholds Evers' indoor face mask mandate order (WI)	546	34	2020-10-12 19:43:42	
France records 26 896 new cases, highest increase yet. 6557 more than their previous record from yesterday.	554	269	2020-10-10 23:01:56	
Coronavirus vaccine trial participants report day-long exhaustion, fever and headaches — but say it's worth it	550	199	2020-10-01 18:29:53	
27.6 percent of Wisconsin COVID-19 tests return positive, no new deaths	550	109	2020-09-28 00:24:55	
Donald Trump says Canada wants to reopen its border with the U.S. Not so fast, says Bill Blair	548	146	2020-09-26 17:22:25	
41 children in LA County sickened by rare inflammatory syndrome linked to COVID-19	542	88	2020-10-12 14:13:42	
Regal Movie Chain Will Close All 536 U.S. Theaters On Thursday	539	126	2020-10-07 07:06:21	
Coronavirus: doctors call for facemasks to be compulsory outside as well	538	273	2020-10-10 13:07:02	
New CDC Guidance: Coronavirus is airborne	533	102	2020-10-05 22:15:01	
Women more likely to embrace behaviors aimed at preventing the spread of COVID-19	531	149	2020-10-05 22:35:23	
RNC Chairwoman Ronna McDaniel received positive coronavirus test Wednesday, spokesman says	532	33	2020-10-02 18:31:06	
UN warns against pursuing herd immunity to stop coronavirus	526	212	2020-10-12 22:30:56	
Bill Gates: Vaccine conspiracies targeting Dr. Fauci and me are ‘unfortunate’ and hurt public trust	524	83	2020-10-14 18:13:09	