title	score	num_comm	created	contentCOVID-19 reinfection reported in Virginia, raising number of confirmed cases to 11. It's a healthcare worker who suffered more serious symptoms the second time, but has since recovered	307	101	2020-09-23 14:44:33	
Pandemic accelerates with 18.5 percent jump in new U.S. cases	1007	119	2020-10-22 06:32:35	
Poland reports 8,099 new coronavirus cases, biggest one-day increase on record	309	51	2020-10-15 17:22:19	
Coronavirus infections among school-age kids rose in September after classes resumed	305	51	2020-09-29 23:38:04	
Jobless claims were worse than expected amid slowdown in hiring	305	51	2020-10-08 18:19:45	
'This shouldn't have happened': As COVID-19 deaths, hospitalizations climb, health care workers urge people not to ignore the virus	303	17	2020-10-15 02:19:33	
New York Region Sees 40% Bankruptcy Surge, Braces for More	305	73	2020-09-29 19:10:46	
CDC director's office ordered softening of coronavirus safety protocols for meat plant	302	23	2020-09-23 16:11:44	
U.S. Records 70,000 New Cases in a Day for the First Time Since July	302	48	2020-10-18 09:57:30	
Hand hygiene reduces spread of disease in Kenyan slum - 'We have seen a drastic change in the number of diarrheal diseases during pandemic,' pediatrician tells Anadolu Agency	301	9	2020-10-16 07:33:15	
New York City Mayor Bill de Blasio is seeking the state's approval to close all non-essential businesses and schools in 9 coronavirus hotspots in Brooklyn and Queens	297	21	2020-10-04 21:21:35	
Wisconsin sets single day record as more than 2,800 test positive for coronavirus	299	41	2020-09-26 23:25:14	
NFL to penalize talking to refs without a mask	301	27	2020-10-10 07:48:43	
The coronavirus pandemic has caused nearly 300,000 more deaths than expected in a typical year	300	18	2020-10-20 21:05:25	
Georgia withholds school COVID-19 counts from public	296	17	2020-09-27 20:27:39	
New CDC report shows effectiveness of wearing masks and closing bars in stemming coronavirus	294	22	2020-10-07 04:11:47	
Florida Reports 2,590 New COVID Cases, 200 More Virus-Related Deaths	289	35	2020-09-24 05:20:08	
CDC study suggests Covid-19 can be passed in brief interactions	385	101	2020-10-22 01:18:15	
"Collapsing passengers, CDC missteps and ""public health malpractice"": The story of the COVID flight from hell"	290	50	2020-10-19 04:07:32	
Coronavirus: Ways Vitamin D can prevent multiple organ failure in COVID-19 patients	292	53	2020-10-11 13:16:48	
Novel nasal spray reduces viral replication by up to 96%: according to COVID-19 challenge study	288	17	2020-09-30 10:46:33	
Seven months in, coronavirus spreading unchecked in Missouri. ‘It destroys you,’ said one patient	292	35	2020-10-19 06:51:35	
U.S. Daily Coronavirus-Case Count Climbs Back Above 50,000	289	65	2020-10-15 00:37:29	
As cold weather arrives, U.S. states see record increases in COVID-19 cases	290	50	2020-10-04 18:56:27	
9 in 10 Americans not yet immune to COVID, CDC director says	286	61	2020-09-24 22:36:10	
Spain reports 15,186 new coronavirus cases, biggest one-day increase on record	285	24	2020-10-16 20:42:58	
Biontech vaccine: BNT162b2 looked very successful in clinical studies, mass production has already begun and the final approval process had been applied	285	70	2020-10-14 10:40:35	
Remdesivir may not cure coronavirus, but it’s on track to make billions for Gilead	284	55	2020-09-30 16:38:28	
Moderna Won’t Enforce Covid Vaccine Patents During Pandemic	282	19	2020-10-09 20:01:45	
4 attendees of SCOTUS nomination at Rose Garden test positive for COVID-19	282	15	2020-10-03 00:46:23	
UK reports 17,234 new coronavirus cases, second-highest increase on record	287	30	2020-10-13 20:34:56	
Anonymous whistleblowers report producers, star actors, crew bending covid-19 rules on set and creating likely further spread	281	16	2020-09-28 10:07:16	
Healthy young people might not be able to get the coronavirus vaccine until 2022, WHO says	280	244	2020-10-15 01:10:37	
COVID-19 could push 100 million more people into poverty	282	85	2020-10-13 23:56:18	
Falsely reporting a coronavirus contact to force them to self-isolate will receive £1,000 fine	280	27	2020-09-29 14:58:20	
More than 8,000 out-of-state passengers fly into Hawaii on first day they could test out of a travel quarantine	282	76	2020-10-17 06:17:30	
Pfizer, BioNTech Covid Vaccine Trial Remains on Track, CEO Says	281	46	2020-10-15 02:09:24	
Florida's COVID infection stats at odds with major national database	278	38	2020-10-17 01:09:30	
Netherlands reports 5,983 new coronavirus cases, the biggest one-day increase on record	282	78	2020-10-09 18:28:40	
Wisconsin activates field hospital as COVID keeps surging	277	35	2020-10-07 22:11:47	
20,000 empty chairs set up outside White House on COVID-19 Remembrance Day	281	15	2020-10-06 01:24:51	
Sudden Rise in New York City Coronavirus Cases Raises Fears of a Resurgence	282	143	2020-09-30 07:37:14	
More than 200 Australians in hotel quarantine to be urgently screened for HIV after authorities admit to mixing up blood test devices	281	66	2020-10-21 05:04:48	
Studies Point To Big Drop In COVID-19 Death Rates	279	110	2020-10-21 01:25:12	
Mandatory masks made big impact on Ontario’s Covid-19 trajectory: study	281	27	2020-10-06 04:33:16	
Coronavirus: Half a million sharks 'could be killed for vaccine', experts warn	276	102	2020-09-27 14:51:55	
Czech Republic - Health minister: Nobody really wants the two weeks total lockdown, but it would be the solution	276	63	2020-10-04 03:12:31	
‘Super healthy’ college student dies of rare COVID-19 complications	275	54	2020-09-30 23:35:08	
26-year veteran SC elementary school teacher dies from COVID-19 complications	275	13	2020-10-09 02:13:51	
COVID-19 is Hospitalizing Younger, Healthier People Than Influenza Patients	276	17	2020-10-07 23:33:17	
Alarming Data Shows a Third Wave of COVID-19 Is About to Hit the U.S.	273	145	2020-09-28 22:56:22	
Florida says it is not releasing its daily coronavirus update because a lab submitted 400,000 previously-reported test results	276	72	2020-10-11 01:55:35	
Wisconsin reports more than 3,000 single-day COVID cases	272	17	2020-10-09 00:19:46	
16 Houston Schools Close Over COVID-19 Concerns On 2nd Day Of In-Person Learning	275	11	2020-10-21 07:03:49	
The Island Brokers Are Overwhelmed: The wealthy want to escape the pandemic to private, isolated paradise	271	76	2020-10-10 00:24:12	
Movie theaters in jeopardy as studios move blockbusters to 2021, audiences stay home	270	133	2020-09-30 11:48:57	
The coronavirus has now killed more than 1 million people and upended the global economy in less than nine months	270	66	2020-09-29 04:48:15	
Missouri reports record number of COVID-19 hospitalizations	267	36	2020-09-26 15:07:10	
Ten residents die from COVID-19 outbreak at nursing home facility in Norton, Kansas	270	10	2020-10-20 05:23:32	
Australia says world needs to know origins of COVID-19	271	88	2020-09-26 10:10:41	
Poland prepares field hospital at national stadium as COVID cases continue to rise. Hospitalizations have risen by 171% in 2 weeks to reach 8,076	268	43	2020-10-19 16:21:08	
Coronavirus: Paris to shut bars and raise alert to maximum	270	59	2020-10-05 05:52:32	
Virus? What virus? Back to business as usual on Fort Lauderdale beach	267	64	2020-09-28 03:55:39	
Rail travel refused to 400 people without masks	266	14	2020-09-25 15:40:58	
First death from COVID-19 reinfection reported in the Netherlands; patient was an elderly woman with cancer	263	29	2020-10-13 00:50:50	
State officials investigating after cat with COVID-19 dies in Alabama	266	36	2020-10-09 04:34:29	
'It's Not in My Head': They Survived the Coronavirus, but They Never Got Well	262	132	2020-09-29 06:40:13	
‘Together we stand’: Couple married 70 years battles COVID-19 side by side	265	2	2020-09-28 14:35:30	
U.S. coronavirus cases surpass 7 million as Midwest outbreak flares up	264	93	2020-09-25 07:03:52	
WHO study says remdesivir did not reduce mortality in COVID-19 patients	264	32	2020-10-16 00:16:33	
White House pressured CDC on reopening schools, officials say - CBS News	260	24	2020-09-30 01:50:29	
Covid `Long Haulers’ Ask Who Pays When Sickness Just Won’t End	263	29	2020-10-05 16:56:33	
COVID-19 spreads faster in American jails than on cruise ships	262	31	2020-09-25 18:57:56	
Covid Antibodies Endure Over Six Months in China Trial Subjects	267	41	2020-09-25 18:12:51	
Netherlands reports 4,581 new coronavirus cases, biggest one-day increase on record. Number in hospital rises to 892 (+82), of which 177 are in ICU (+14)	260	34	2020-10-05 19:53:52	
Toronto Public Health suspends some contact tracing due to ‘high level’ of coronavirus cases	263	29	2020-10-04 06:16:20	
A study on ferrets showed the product dubbed INNA-051, which could be used complementary to vaccines, lowered the levels of the virus that causes COVID-19 by up to 96%, the company said. The study was led by British government agency Public Health England.	264	13	2020-09-28 16:24:12	
Bali took a huge risk opening up for tourists. Now it's hurtling towards a coronavirus disaster	260	15	2020-09-25 02:38:59	
Ireland reports record high 1012 daily cases in a country with a population of only 4.9 million people.	261	116	2020-10-11 16:01:38	
For the first time since the pandemic began, Europe has reported more than 100,000 new cases in one day	262	118	2020-10-09 20:12:13	
Spain reports first confirmed case of COVID-19 reinfection; patient is a healthy, 62-year-old man who suffered life-threatening pneumonia the second time	255	103	2020-10-15 01:52:43	
North Dakota's new COVID-19 cases are double the number of hospital beds available in state	260	53	2020-10-13 06:51:16	
Gov. Whitmer 'sounding the alarm bell' as COVID-19 cases reach new highs in Michigan	293	33	2020-10-21 23:21:55	
Labor agency closes more than half of workers’ coronavirus retaliation complaints without investigating	254	10	2020-10-21 01:26:02	
Facebook, Twitter Take Action After Trump Falsely Claims Flu Deadlier Than COVID-19	255	20	2020-10-06 22:54:59	
More than half of Canadians are ignoring public health advice and visiting family for Thanksgiving	254	106	2020-10-18 16:15:19	
How Bad Will Coronavirus Be This Winter? Model Projects 170,000 More U.S. Deaths	255	67	2020-10-16 18:59:26	
FDA head: Outside pressures won't rush COVID vaccine	255	12	2020-10-09 02:02:02	
“Lower-pay, higher-risk”: Coronavirus layoffs send middle-class workers down the economic ladder	255	15	2020-09-29 08:57:13	
“We need to get this under control now”: Colorado’s coronavirus test positivity rate rises above 5%	254	42	2020-10-14 03:39:34	
‘Jurassic World’ shoot suspended after COVID-19 positives	253	59	2020-10-07 23:17:26	
Coronavirus vaccine: Oxford trials run smoothly in India, no adverse side-effects reported so far	256	8	2020-10-05 12:52:22	
We're Sacrificing Our Teachers: Several Already Reported Dead From COVID	250	75	2020-10-08 04:17:25	
Europe’s Second Covid Wave Starts to Spill Over From Young to Old	250	56	2020-10-06 15:21:31	
Russia's new coronavirus cases return to highest levels, near 10,000	249	18	2020-10-03 19:25:02	
‘F*ck It Won’t Cut It’: Students Take Aim at Apathy Over COVID-19	249	46	2020-10-14 11:40:48	
White House Outbreak May Have Spread Coronavirus To Other Communities	249	26	2020-10-10 03:57:53	
Notre Dame Announces 18 Football Players Tested Positive for COVID-19	250	50	2020-09-29 11:46:10	
Single-Day COVID-19 Deaths In Illinois At Highest Level In Months	252	26	2020-10-16 04:53:30	
China finds living coronavirus on cold chain food packaging, marking world first	251	72	2020-10-19 15:47:39	
Sweden postpones decision to lift 50-person limit on public events	246	102	2020-10-08 16:15:42	
Canada begins review of Oxford coronavirus vaccine candidate	249	24	2020-10-02 19:29:05	
Alabama Lt. Governor Will Ainsworth contracts COVID-19	337	28	2020-10-22 01:50:05	
COVID-19 data on Native Americans is ‘a national disgrace.’ Scientist Echo-Hawk, a citizen of the Pawnee Nation of Oklahoma, is fighting to be counted.	251	18	2020-10-02 19:50:05	
Blood type O least vulnerable to Covid, A and AB at most risk: Study - The Hindu BusinessLine	245	83	2020-10-17 08:36:15	
High risk of deep vein thrombosis and pulmonary embolism in patients with COVID-19	245	22	2020-10-01 18:05:37	
America's missing kids: Amid COVID-19 and online school, thousands of students haven't shown up	247	70	2020-09-30 10:15:11	
Texas among 21 States reporting increased COVID-19 cases as experts warn of a fall surge	246	57	2020-09-28 16:43:16	
Florida: Coronavirus cases confirmed at 360+ schools across South Florida	253	30	2020-10-21 20:12:23	
Rural Midwest hospitals struggling to handle virus surge	243	31	2020-10-17 17:37:39	
Regal Owner to Close Theaters, With as Many as 45,000 Jobs at Stake: Live Updates	245	135	2020-10-05 16:36:07	
Thousands of minks Dead in COVID outbreak on Utah farms	242	77	2020-10-06 11:23:07	
N.Y., N.J. Unveil New ‘COVID Alert’ Apps That Notify Users If They’re Within 6 Feet Of Someone Who Has Tested Positive	239	48	2020-10-02 04:52:29	
Covid Death Toll Nears 1 Million, But Real Number May Be Double	241	43	2020-09-27 08:16:20	
Black doctors want to vet vaccine process, worried about mistrust from years of medical racism	239	59	2020-09-27 04:06:41	
Key coronavirus model predicts nearly 80 percent rise in deaths by February	238	55	2020-10-16 16:24:25	
Alarming Data Show a Third Wave of COVID-19 Is About to Hit the U.S.	239	116	2020-09-30 14:41:59	
New blood test predicts which COVID-19 patients will develop severe infection	237	3	2020-10-20 23:46:06	
COVID outbreaks in Michigan schools rise 25 percent in a week	242	10	2020-10-20 04:03:14	
Florida Gators coach Dan Mullen tests positive for COVID-19	235	30	2020-10-18 02:23:38	
Coronavirus stays on skin for 9 hours, alcohol disinfectant key	239	62	2020-10-16 10:16:42	
Hundreds of youth hockey players in quarantine after referee tests positive for COVID-19	238	40	2020-10-11 03:41:08	
Rising COVID-19 numbers prompt calls to bring back hazard pay for retail workers	235	20	2020-10-10 05:37:12	
Netherlands reports 5,831 new coronavirus cases, the biggest one-day increase on record.	240	58	2020-10-08 18:07:25	
Poland reports highest daily total of 10,040 coronavirus infections	236	12	2020-10-21 13:38:32	
American Indian tribes ‘very close to reaching a breaking point’ in COVID-19 response	233	13	2020-10-02 15:29:24	
‘Long-haulers’ battle COVID-19 for months, but research into why is scant	234	11	2020-10-05 09:14:37	
Death toll from COVID-19 surpasses 1.1M worldwide	235	48	2020-10-16 06:32:07	
A $52,112 Helicopter Ride: Coronavirus Patients Battle Surprise Medical Bills	233	64	2020-10-13 19:30:55	
Ex-N.J. Gov. Chris Christie stays in hospital for 6th day with COVID-19. Murphy calls him a ‘Jersey fighter.’	232	77	2020-10-09 15:46:52	
Face masks could be giving people Covid-19 immunity, researchers suggest	234	82	2020-09-25 07:16:29	
Elementary school student contracts COVID-19 days after teacher dies from virus	233	16	2020-10-08 12:50:31	
CDC calls off Minnesota COVID-19 study after reports of racism and intimidation against surveyors of color	229	32	2020-09-26 22:10:57	
A Texas family lost four members to Covid-19. Now they want to save others from heartbreak.	235	16	2020-10-04 22:06:49	
Arkansas teachers leave careers over health concerns due to COVID-19	232	45	2020-10-12 03:21:45	
American Airlines says it will begin furlough of 19,000 employees as hope for federal help fades	231	128	2020-10-01 05:17:40	
Germany's Confirmed Coronavirus Cases Rise by A Record 7,830 cases	233	93	2020-10-18 02:05:00	
Early Trial Results Show Promise For Johnson & Johnson And Beth Israel Vaccine	229	46	2020-09-27 19:50:36	
NEW: For the first time in nearly 8 months, Singapore has reported no new domestic cases of coronavirus	229	14	2020-10-13 14:31:36	
BioNTech and Pfizer Initiate Rolling Submission to European Medicines Agency for SARS-CoV-2 Vaccine Candidate BNT162b2	226	32	2020-10-06 13:30:30	
New Zealand Has First Community Case of Covid-19 in Three Weeks	228	39	2020-10-19 01:01:23	
Russia reports 11,615 new coronavirus cases, just a few dozen below the May 11 record, and 188 new deaths	222	20	2020-10-06 16:32:25	
New York state logs over 1,000 new coronavirus cases for 1st time since June	227	60	2020-09-27 06:44:07	
The Lancet: Herd immunity approaches to COVID-19 control are a 'dangerous fallacy', say authors of open letter	220	52	2020-10-15 13:37:20	
"Depression ""is on a constant rise"" among teens due the stress of covid-19"	229	91	2020-10-15 04:42:17	
Italy reports record 15,000 new coronavirus cases, daily death toll surpasses 100 for the first time since May	240	20	2020-10-21 20:11:56	
Beloved Brooklyn Park charter school principal dies from COVID-19 complications	220	31	2020-10-12 17:10:12	
Moderna CEO eyes December for COVID vaccine	223	200	2020-10-20 08:27:26	
South Dakota Gov. Kristi Noem says lockdowns are 'useless' as state's COVID-19 cases soar	223	114	2020-10-07 06:10:30	
Boulder, seeking to stop coronavirus surge, bans all gatherings among 18 to 22 year olds until Oct. 8	223	140	2020-09-24 19:13:23	
Signs COVID cases rising in Sweden again 'worrying' says PM Lofven	223	244	2020-09-24 17:11:44	
Johnson & Johnson Begins Final-Stage Testing of Covid-19 Vaccine	220	17	2020-09-23 14:49:59	
Belgium reports 8,271 new coronavirus cases, biggest one-day increase on record	217	69	2020-10-15 17:21:50	
DeWine: Ohio seeing 'tremendous spread' of coronavirus in rural areas	221	49	2020-10-20 03:42:26	
They keep global trade afloat – now 400,000 seafarers, stranded since the start of the pandemic, just want to go home	219	115	2020-10-14 16:16:28	
Cloth face masks don't work if you're not washing them every day - research	219	183	2020-10-11 22:05:54	
Rising COVID cases take Europe and US off the travel list for next year	218	21	2020-10-11 10:17:11	
'So frustrating': Doctors and nurses battle virus skeptics	216	68	2020-10-08 19:39:12	
42 Percent Of All Native American COVID-19 Cases In Wisconsin Were Reported In September	220	6	2020-10-01 15:27:37	
COVID-19 Is Ravaging Wisconsin, And Wisconsinites Still Aren't Staying Home	216	84	2020-10-20 18:28:35	
UK adds 22,961 new coronavirus cases, including 15,841 cases which it failed to report over the past week	212	62	2020-10-05 00:40:08	
Dr. Fauci: NJ Can Now Reopen 'Competently' Amid Coronavirus	216	27	2020-09-24 21:20:56	
Italy reports 5,901 new coronavirus cases, biggest one-day increase since March	216	34	2020-10-13 20:19:34	
Bill Gates says U.S. coronavirus testing is still 'truly a sad thing'	211	42	2020-10-06 23:42:04	
Florida will be 'like a house on fire' in weeks with loose coronavirus restrictions, infectious disease expert says	214	64	2020-10-10 06:04:12	
Cam Newton tests positive for COVID-19 - ProFootballTalk	215	24	2020-10-03 19:25:21	
Russia is spreading lies about Covid vaccines, says UK military chief	211	36	2020-10-01 14:42:57	
Coronavirus: California’s COVID-19 deaths continue to plummet	215	52	2020-10-15 06:49:42	
8 million Americans slipped into poverty amid coronavirus pandemic, new study says	207	46	2020-10-17 09:10:55	
Conservatives ask for immediate halt to Wisconsin mask order	211	71	2020-09-29 00:28:58	
France COVID update: Daily admissions (1,424) at highest level since April, daily hospital deaths highest since May	209	33	2020-10-19 22:39:47	
4 Swiss Guards test positive as COVID-19 penetrates Vatican	208	32	2020-10-12 20:59:35	
Fans descend on Staples Center in downtown LA after Lakers win championship	209	96	2020-10-12 19:05:46	
NHS preparing to roll out coronavirus vaccine next month if jab gets approved	207	69	2020-10-11 21:21:18	
U.S. Coronavirus Cases Have Been Highest in the World For 6 Months	210	59	2020-09-26 15:31:11	
COVID-19 deaths surpass 150,000 in Brazil, second only to U.S.	208	26	2020-10-11 12:35:07	
Covid-19 Continues Its Ever-Changing Onslaught on the U.S.	207	27	2020-10-04 04:54:38	
Avoid trick-or-treating due to coronavirus this Halloween, CDC says	209	137	2020-09-25 11:15:56	
Coronavirus Cases Rise To Highest Level Since Late July	209	31	2020-10-19 18:54:17	
New U.S. COVID-19 cases rise 11% last week, Midwest hard hit	207	31	2020-10-13 00:22:23	
Fauci warns of 300,000 to 400,000 coronavirus deaths	209	72	2020-10-09 04:32:29	
Governor Baker and his staff continue to withhold key pandemic data	207	9	2020-09-28 03:35:37	
Sweden - Public Health Authority update: 103200 (+793) confirmed cases and 5918 (+8) deaths (last update till Tuesday)	207	220	2020-10-16 16:04:10	
Argentina COVID update Positivity rate: 64.8%	207	51	2020-10-14 06:36:52	
Coronavirus can survive on skin for 9 hours	208	72	2020-10-07 22:58:36	
US medical supply chains failed, and COVID deaths followed	209	7	2020-10-06 19:49:01	
Florida reports 698,682 total COVID-19 cases, over 14K deaths	206	59	2020-09-27 04:22:10	
When it comes to COVID-19, social media fills a gap left by scientists — and it's a problem, says sociologist	208	9	2020-10-18 21:10:12	
Americans Are Dying In The Pandemic At Rates Far Higher Than In Other Countries	206	40	2020-10-14 07:27:09	
Dr. Fauci: Avoid large gatherings without masks	209	50	2020-10-10 23:03:27	
Trump given Remdesivir as treatment for COVID-19 infection	204	108	2020-10-03 07:45:33	
City of Cleveland says it's aware of at least 11 coronavirus cases stemming from pre-debate planning and set-up. The majority are out of state residents. -BNO	206	3	2020-10-02 23:43:21	
Up to 46 million jobs at risk due to Covid-19 aviation downturn	203	92	2020-10-01 15:00:36	
The birth of a ghost town: Point Roberts has lost 80% of its business, hundreds of its residents	203	44	2020-09-27 23:55:06	
"Iowa doctor warns ""the virus is absolutely winning right now"""	206	25	2020-10-17 06:03:44	
Dying in a Leadership Vacuum	204	10	2020-10-08 02:30:00	
China's mainland reports 2 domestic cases of coronavirus, the first in more than a month. They work at the Port of Qingdao and handled frozen seafood imported from abroad. Both are asymptomatic.	201	65	2020-09-25 08:24:10	
Months Into the Pandemic, 16 States Don't Mandate Mask Use. Why?	201	83	2020-10-08 15:35:02	
Portland Has the Nation’s Second-Lowest Rate of COVID-19 Infection Among Major Cities, Study Says	200	50	2020-10-07 07:25:48	
Man dies after being shoved to the ground in New York mask altercation	202	20	2020-10-07 01:10:44	
Blood pressure medications decrease death and severe disease in COVID-19 patients	199	13	2020-09-25 18:26:22	
Hopes of vaccine by Christmas as doses seen rolling off production line	203	153	2020-10-18 20:18:52	
COVID Patients May Be Protected for Up to Four Months According to a Harvard study	200	49	2020-10-12 07:30:13	
Broadway to remain closed till at least June 2021, possibly Fall — OnStage Blog	197	76	2020-10-09 14:07:58	
COVID-19 cases among young adults in U.S. rise 55% in August: CDC	200	17	2020-09-29 23:20:57	
Russia reports 15,982 new coronavirus cases, the biggest one-day increase on record, and 179 new deaths	198	18	2020-10-19 16:00:20	
U.S. reports over 69,000 new COVID-19 cases – the most in a single day since July	198	31	2020-10-17 19:26:51	
California won't allow virus vaccines without state approval	199	36	2020-10-20 03:11:51	
Coronavirus vaccine may be ready by end of 2020, WHO says	196	73	2020-10-06 22:26:57	
There are four coronavirus vaccines in late-stage studies — here’s how they differ	199	33	2020-09-28 17:23:43	
104 students test positive for coronavirus on Univ of Washington’s Greek Row	194	8	2020-10-03 04:49:38	
Wisconsin Is on the Brink of a Major Outbreak	199	24	2020-09-27 00:03:26	
CDC 'strongly recommends' all passengers on planes, trains, buses wear masks to slow spread of COVID-19	200	47	2020-10-21 18:42:10	
Idaho woman in the hospital after being infected with coronavirus for the second time	198	106	2020-10-13 06:16:07	
Leader of NYC protest against Covid-19 rules arrested in alleged assault	193	28	2020-10-12 07:14:27	
Covid-19: World in ‘for a hell of a ride’ in coming months, Dr Mike Ryan says - WHO official estimates that 750m people globally have likely had coronavirus to date	195	59	2020-10-03 09:22:50	
Notre Dame president could be patient zero at Rose Garden event	192	42	2020-10-03 08:17:25	
Germans embrace fresh air to ward off coronavirus	194	33	2020-10-01 03:20:52	
NEW: Spain reports nearly 17,000 new coronavirus cases, biggest one-day increase on record - New cases: 16,973 - In hospital: 13,698 (+410) - In ICU: 1,930 (+19) - New deaths: 156	208	73	2020-10-21 21:41:49	
Researcher: 1 in 30 eastern Idahoans actively spreading COVID-19	194	15	2020-10-20 05:16:43	
Czech Republic - We will run out of the hospital capacity even with the most optimistic scenario, warns ministry of health	190	40	2020-10-14 16:57:17	
Coronavirus: 'They don't care that people are dying' - ICU doctors criticise last night's crowds in Liverpool city centre	192	27	2020-10-14 11:03:59	
The White House Bet on Abbott’s Rapid Tests. It Didn’t Work Out.	191	20	2020-10-07 08:15:20	
France reports more than 25,000 new coronavirus cases, daily hospital admissions (1,225) at highest level since April | New cases: 25,086 | Positivity: 12.9% (+0.3) | In hospital: 10,021 (+416) | ICU: 1,791 (+41) | Deaths: +178 (122 in hospital)	192	55	2020-10-16 22:17:53	
New Yorkers With ‘Long-Haul’ Symptoms Are Upending the Narrative About COVID-19	191	72	2020-09-28 03:16:38	
CBD could reduce lung damage caused by COVID-19	191	64	2020-10-19 21:51:56	
